language,country,source,collection_method,article_id,url,title,content,climate_max_sim,health_max_sim,climate_best_keyword,health_best_keyword,sample_bucket,climate,health,health_climate_impact,climate_justification,health_justification,impact_justification
Korean,Korea,mk.co.kr,scrapai,1059,https://www.mk.co.kr/news/it/11983327,이세돌 10분 만에 ‘패배 선언’…AI와 10년 만의 리벤지 빅매치,"사진 확대 바둑기사 이세돌 9단이 9일 서울 종로구 포시즌스호텔에서 개최된 ‘에이전틱 인공지능(AI) 상용화 글로벌 캠페인’에 참석해 AI 바둑 프로그램을 시연하던 중 AI 에이전트의 훈수에 활짝 웃고 있다. [공동취재] 바둑기사 이세돌 9단이 패배를 선언했다. 인공지능(AI)과의 바둑 대국이 시작된 지 10분이 지난 시점에서 61수 만에 벌어진 일이었다. 9일 정보기술(IT)업계에 따르면 이세돌은 이날 오후 서울 종로구 포시즌스호텔 아라홀에서 다시금 AI와 마주했다. 이세돌이 지난 2016년 알파고와 세기의 대국을 펼쳤던 장소다. 당시 이세돌은 알파고를 상대로 1승 4패를 거뒀다. 당시에는 AI가 대결 상대에 그쳤다면 이번에는 공존 대상으로 위치가 뒤바뀐 부분이 차이점이었다. 이세돌은 대국에 앞서 엔터프라이즈 에이전틱 AI 스타트업 인핸스의 ‘AI 운영체제(OS)’ 기술을 이용해 바둑 애플리케이션을 만들었다. 이세돌이 음성으로 원하는 기능을 전달하면 AI 에이전트들이 명령을 이해하고 자동으로 코드를 짜냈다. 별도의 기획이나 코딩, 디자인 작업이 필요하지 않았다. AI OS가 기업과 개인의 언어 지시를 정확히 이해하고, 개별 작업에 적합한 AI 에이전트에게 작업 단계를 나눠 주는 방식으로 지식 체계를 구축하기에, 프로그램 개발에 투입되는 시간과 비용을 줄일 수 있다. 실제로 이세돌의 바둑 앱이 완성되기까지 소요된 시간은 약 20분에 불과했다. 사진 확대 바둑기사 이세돌 9단이 9일 서울 종로구 포시즌스호텔에서 개최된 ‘에이전틱 인공지능(AI) 상용화 글로벌 캠페인’에 참석해 AI 바둑 프로그램을 소개하고 있다. [공동취재] 완성된 바둑 앱을 시연한 이세돌은 “체감상 알파고보다 뛰어난 수준”이라며 “너무 빠르고 어렵게 바둑을 둬서 혼란스러울 정도”라고 평가했다. AI 에이전트가 만들어낸 AI 바둑기사가 세계적으로도 손꼽히는 업적을 보유한 베테랑 바둑기사를 압도한 것이다. 이세돌은 “인간과 AI가 어떻게 협업을 해야 하는지 보여 주는 대표적 사례”라며 “이제 AI는 승부나 경쟁의 대상이 아니라, 인간의 개성과 감정을 살리면서 창의성을 발휘할 수 있도록 도와주는 도구로 정의돼야 한다”고 전했다. 이세돌은 어린이나 초보자도 쉽게 바둑을 배울 수 있도록 튜터링 기능이 포함된 AI 기반 바둑 교육 프로그램 제작을 희망했다. 이세돌은 “바둑을 잘 두는 AI는 이미 존재하지만 바둑을 잘 가르치는 AI는 없다고 봐도 무방하다”며 “AI가 바둑 선생 역할을 할 수 있다면 바둑에 대한 진입장벽이 굉장히 낮아질 것”이라고 기대했다. # 프로그램 # 바둑기사 # 에이전트 # 포시즌스호텔 # 인공지능 # 알파고와 # 바둑모델 # 연합뉴스 이가람 기자 + 구독 [속보] 한국 야구, 17년 만에 WBC 8강 결선 라운드 진출 충주맨 왕따설 유포자·사칭범 떨고 있나…온라인 범죄에도 쇠고랑 찬다 이 기사가 마음에 들었다면, 좋아요 를 눌러주세요. 0",0.2690,0.2889,extreme event,west nile virus,low_both,,,,,,
Korean,Korea,hani.co.kr,scrapai,79,https://www.hani.co.kr/arti/opinion/column/1247155.html,"넘어지고, 일어나고…연습생에서 아이돌까지 [6411의 목소리]","권예웅 | 아이돌
오늘도 연습실은 거친 숨소리와 분주한 발소리로 가득 찬다. 데뷔라는 꿈을 품은 이들이 거울 앞에서 뜨거운 땀방울을 흘린다. 습한 공기에 거울은 뿌옇게 흐려지고 바닥은 미끄럽지만, 흠뻑 젖은 티셔츠가 오늘 하루 내가 얼마나 치열했는지를 증명한다. 몸이 부서져라 연습하다 보면 어느덧 대중교통 막차 시간이 다가온다. 연습생에게 ‘퇴근’이란 곧 막차 시간을 의미했다.
집으로 돌아가는 길에도 쉴 수 없다. 스마트폰 속에 담긴 오늘 연습 영상을 꼼꼼히 점검한다. 부족한 점을 분석해 내일의 계획표를 빼곡히 채우고 나서야, 동경하는 선배들의 무대 영상을 보며 상상의 나래를 펼친다.
‘나도 할 수 있어, 저 무대에 반드시 서고 말 거야.’
아이돌 연습생의 길로 들어선 건 열일곱살 무렵이었다. 운 좋게 첫 오디션에서 합격 통보를 받았고, 이름만 대면 누구나 알 법한 대형 기획사와 계약을 맺었다. 그렇게 꿈에 그리던 연습생 생활이 시작됐다. 하지만 마주한 아이돌 문화는 생각보다 훨씬 엄격했다. 인사법 하나부터 일상의 사소한 습관까지 모든 것이 체계적인 훈련의 연속이었다.
보컬과 댄스 테스트를 치를 때면 ‘어떻게 내가 합격했을까?’ 싶을 정도로 부족함을 뼈저리게 느꼈다. 그러나 내 가능성을 믿어준 회사의 선택에 보답하기 위해 젖 먹던 힘까지 쥐어짜 냈다. 평온함은 오래가지 않았다. 연습생 생활 사흘째 되던 날, 월말 평가 일정이 잡혔다. 연습실 안의 공기는 순식간에 차가워졌다. 연습생들의 말투와 태도는 예민해졌고, 언제든 방출될 수 있다는 불안감이 공간을 지배했다. 춤을 한번도 배워본 적 없던 내게 댄스 미션은 거대한 벽과 같았다.
동작은 엉성했고 거울 속 내 모습은 한없이 초라했다. 쉬는 시간도 없이 연습에 매달렸지만, 마음처럼 몸은 따라주지 않았다. 낮아진 자존감과 날이 갈수록 심해지는 주변의 텃세를 견디지 못한 채, 나는 결국 첫 회사를 한달도 채우지 못하고 나오게 됐다. 험난했던 첫 경험은 쓰라린 실패로 막을 내렸다.
하지만 포기하지 않았다. 수많은 연습과 탈락을 반복한 끝에 다른 기획사에서 다시 기회를 얻었고, 마침내 ‘데뷔’라는 문턱을 넘었다. 이제는 대중의 냉정한 평가를 받아야 했다. 영하의 매서운 추위 속에서 모든 스태프가 열정을 쏟았던 뮤직비디오 촬영은 지금도 잊을 수 없는 기억이다. 화려한 영상미 뒤에 숨겨진 수많은 이의 노고와 땀방울을 보며 프로의 세계가 얼마나 엄격한지 몸소 깨달았다.
현실은 냉정했다. 간절히 바라던 지상파 음악 방송 무대에 서지 못하는 상황이 반복됐다. 누구보다 치열하게 살았고 가슴 졸이며 준비했건만, 내가 마주한 결과는 노력의 양과 비례하지 않았다. 첫 활동이 끝나고 맞이한 휴식기는 전혀 달콤하지 않았다. 성과에 대한 아쉬움과 앞날에 대한 불안 때문에 조급함만 앞섰다. 하지만 시간이 흐른 지금의 나는 그때의 나에게 말해주고 싶다.
“조급해하지 말고, 건강하게 휴식을 취하며 너 자신을 충분히 돌아봐 줘.”
동료들의 성공과 화려한 무대를 보며 느끼는 괴리감은 아이돌이라는 직업이 감내해야 할 숙명 같은 대가일지도 모른다. 어쩌면 나는 데뷔만을 목표로 삼았기에 더 쉽게 흔들렸던 것 같다. 아티스트로서 그 너머를 바라보지 못했고, 견고한 시스템 속에서 스스로 자유롭지 못했다.
아이돌을 꿈꾸는 이들에게 꼭 당부하고 싶은 말이 있다. 이 시장에는 재능 넘치는 인재들이 차고 넘친다. 점점 줄어드는 무대 기회 속에서 나만의 차별성과 독창성을 찾는 것은 이제 선택이 아닌 필수다. 무엇보다 중요한 것은 ‘어떻게, 어디를 향해, 무엇을 위해 달리고 있는가’이다.
첫번째 팀에서의 활동은 넘어지고 일어서는 과정의 연속이었다. 하지만 그때 배운 ‘털고 일어나는 법’ 덕분에 두번째 데뷔에서는 조금 더 단단한 마음으로 무대에 설 수 있었다. 비록 예상치 못한 시련으로 활동이 종료됐고 다시 일어서기까지 긴 시간이 걸렸지만, 나는 이제 새로운 인생의 목표를 설정했다.
누군가는 나를 보며 이미 꿈을 이뤘다가 실패한 사람이라고 생각할지도 모른다. 하지만 나에게 데뷔는 끝이 아닌 성장의 과정이었다. 진짜 꿈은 이제부터다. 수없이 넘어져 본 사람만이 아는 다시 달리는 요령을 익혔기에, 나는 다시 성실하게 나만의 길을 개척해 나갈 것이다. 아이돌을 꿈꾸는 모든 이가 각자의 무대 위에서 가장 빛나는 별이 되기를 진심으로 응원한다.
※노회찬 재단과 한겨레신문사가 공동기획한 ‘6411의 목소리’에서는 삶과 노동을 주제로 한 당신의 글을 기다립니다. 200자 원고지 12장 분량의 원고를 6411voice@gmail.com으로 보내주세요.",0.2017,0.2178,extreme heat,mental disorder,low_both,,,,,,
Korean,Korea,mk.co.kr,scrapai,361,https://www.mk.co.kr/news/world/11982137,삼성에 반도체 전수 … 하마다 박사 별세,"사진 확대 삼성전자에 반도체 기술을 전수해준 일본인 하마다 시게타카 박사가 별세했다. 향년 101세. 지난 7일 양향자 국민의힘 최고위원은 자신의 페이스북에서 하마다 박사가 지난 6일 오전 1시께 도쿄의 한 병원에서 세상을 떠났다고 밝혔다. 1925년생인 하마다 박사는 도쿄제국대(현 도쿄대) 전자공학과를 졸업했다. 통신회사 NTT의 전신인 일본전신전화공사 전기통신연구소에서 반도체를 연구하다 이후 일본전신전화공사 관계사인 긴키플랜트레코드(현 NTEC)에서 근무했다. 하마다 박사는 1980년대 초 삼성전자에서 신기술을 강연한 것을 계기로 최신 기술 흐름을 파악하고 싶어한 고(故) 이병철 삼성 회장의 기술 자문 역할을 했다. 이 회장은 하마다 박사가 공장을 오가는 데 불편하지 않도록 전용 헬리콥터를 내줬을 정도로 각별히 챙겼다. 양 최고위원은 삼성전자가 1988년 하마다 부부를 초청했을 때 일본어 통역을 담당했다. 양 최고위원은 오는 12일 도쿄에서 하마다 박사의 고별식이 열릴 예정이라고 했다. [한상헌 기자] # 시게타카 # 삼성전자 # 최고위원 # 일본전신전화공사 # 페이스북 한상헌 기자 + 구독 트럼프가 “용납 못한다”던 차남 모즈타바 승계…이란, 결사항전 태세 이란, 결사항전 … 트럼프가 ""용납 못한다""던 모즈타바 승계 이 기사가 마음에 들었다면, 좋아요 를 눌러주세요. 0",0.2525,0.2947,carbon dioxide,west nile virus,low_both,,,,,,
Korean,Korea,hani.co.kr,scrapai,110,https://www.hani.co.kr/arti/opinion/column/1247895.html,"회한 없는 AI, 고뇌하는 인간 [세상읽기]","김인아 | 한양대 교수(직업환경의학)
일본 제국주의에 대한 저항의 역사로 기념되는 삼일절 직전, 이스라엘과 미국은 이란의 정권 교체를 목표로 주요 시설을 폭격했다. 그리고 이란 최고 지도자인 알리 호세인 하메네이가 사망했다. 베네수엘라를 폭격해 니콜라스 마두로 대통령을 체포한 뒤 미국에 협조적인 정부로 정권 교체를 해냈다는 자신감에 넘친 나머지 오만한 폭력이 이어진 것이다. 하지만 미국이 원하는 방향으로의 정권교체는 쉽지 않아 보인다. 이 전쟁이 길어지는 것은 아닌지 전세계가 주목하고 있다. 경제적 이해에 따라 권력을 재구성하는 것을 목적으로 하는 신제국주의적 군사 행동이 이어지는 상황이다. 제2차 세계대전 이후 지구 공동체를 유지하기 위해 여러 나라가 함께한 노력을 더 이상 하지 않겠다는 미국의 노골적 천명이 참으로 염치없게 느껴지고 무서웠다.
안절부절 기사들을 보던 중 인공지능(AI) 클로드의 개발사 앤트로픽이 미국 ‘전쟁부’(국방부)가 원하는 ‘완전 자율 무기’ 등의 협업을 거절하자, 챗지피티의 오픈에이아이가 대신 나섰다는 소식이 들렸다. 최근 소셜미디어에서는 챗지피티와 제미나이, 클로드 가운데 무엇이, 어떻게 더 우수하냐는 비교 분석이 일종의 유행이었다. 저마다 경험을 유행처럼 공유했다. 인공지능을 효율적으로 사용하는 요령을 나누며, 다들 선택이 아닌 필수가 된 인공지능에 적응하려 애쓰고 있었다. 이렇게 어떤 인공지능이 자신에게 가장 적합한지 고민이 한창인데, 미 국방부가 클로드에서 챗지피티로 갈아탔다는 소식이 이란 공습 뉴스와 함께 전해진 것이다.
사실 이는 베네수엘라 공습에 클로드가 활용된 사실이 알려지면서 시작된 앤트로픽과 미 국방부 간 갈등의 마무리를 의미하는 뉴스였다. 사람들은 넘지 말아야 할 선을 지키고자 애썼던 앤트로픽의 노력을 무색하게 만든 오픈에이아이의 행보를 비판했다. 미 국방부는 대립각을 세우는 앤트로픽을 ‘공급망 위험 기업’으로 지정해 제품을 퇴출하는 등 기업의 존립 자체를 압박하는 상황이었다. 인공지능 사용자들 사이에선 챗지피티 구독을 중지하고 클로드를 유료 결제했다는 인증도 나오기 시작했다. 쿠팡의 행태를 비판하기 위해 ‘탈팡’을 했던 것처럼, 이른바 ‘탈챗지피티’ 움직임도 나타났던 셈이다. 오픈에이아이와 구글의 직원들은 우리를 갈라치지 말라며 미 국방부 요구에 반대하는 성명을 냈다.
지난달 26일 앤트로픽은 이번 사태와 관련해 성명을 발표했다. 이들이 절대 하지 않으려 한 것은 자국민 대상 대규모 감시 체계 구축과 함께 표적 선정 등을 인간 개입 없이 자동화하는 완전 자율 무기 사용이라고 밝혔다. 우크라이나 전쟁에서 이미 사용된 부분적 자율 무기는 민주주의 방어에 필수적이라면서도, 어디를 타격하고 어떻게 전쟁을 이끌지 결정하는 모든 과정에 인간이 참여하지 않는 완전 자율 무기는 아직 신뢰성이 부족해 미국 군인과 민간인을 위험에 빠뜨릴 수 있다는 주장이었다.
사실 앤트로픽은 반전 기업도 아니고, 개인에 대한 감시를 모두 반대하는 기업도 아니다. 다만, 초기에 비영리 조직으로 시작한 오픈에이아이가 영리화 길을 가면서 인공지능의 안전성보다 속도를 중시하는 상황에 반발한 연구원들이 설립한 공익법인이 앤트로픽이었다. 그래서 클로드는 헌법에 기반한 명문화한 자체 원칙을 기준으로 학습하도록 훈련되었고, 철학자가 만든 지침과 대화를 통해 옳고 그름을 구분하고 공감할 수 있도록 설계되었다고 알려져 있다. 앤트로픽이 미 국방부의 압박에도 협업 중단 결정을 내린 것은 이런 창립 취지의 선상에 있는 것으로 보인다. 그럼에도 세가지 인공지능 모델에 다양한 상황에서의 전쟁 시뮬레이션을 해봤더니 결국 대부분 핵무기를 쓰더라는 연구 결과가 최근 발표되었다. 학습의 출발점이 다른 인공지능이라고 했지만 결론은 같았던 셈이다.
영화 ‘오펜하이머’에서, 핵무기 개발 실험을 성공적으로 이끈 줄리어스 로버트 오펜하이머는 ‘이제 나는 죽음이 되었고 세상을 파괴하는 자가 되었다’고 했다. 되살아난 제국주의의 세계에서 전쟁에 나설 인공지능이 오펜하이머처럼 회한이라도 느끼도록 좀 더 확실하고 체계적으로 인권을 학습시켜야 하는 걸까? 그러한 상황에서 머뭇거리고 고뇌하는 인공지능을 개발하기에 앞서 전체 의사결정의 과정에서 고뇌하고 결단하는 인간이 되어야 할 것이다. 이후 오픈에이아이의 행보에 주목해야 하는 이유다.",0.2705,0.2992,carbon dioxide,west nile virus,low_both,,,,,,
Korean,Korea,hani.co.kr,scrapai,72,https://www.hani.co.kr/arti/opinion/column/1248252.html,"진짜같은 가짜, 가짜같은 진짜 [이서윤의 인공지능&인권지능]","이서윤 | 사법연수원 교수·판사
버스 안에서 포털사이트를 검색하다 자연스레 쇼츠로 넘어갔다. 요즘에는 쇼츠 페이지로의 전환이 눈치채지도 못하는 사이에 놀랄 만큼 빠르고 자연스럽게 이루어진다. 작위적 퍼포먼스, 과장된 개그, 광고 영상들을 무심하게 넘기던 손가락이 멈춘 영상은 한 아기와 골든리트리버가 집 안을 여러차례 난장판으로 만들어놓고, 아기가 그때마다 능청스럽게 강아지 탓을 하는 내용이었다. 쏟아진 밀가루도, 바닥에 널브러진 휴지와 베갯속도 전부 강아지 짓이라 했다. 강아지는 그저 눈만 끔벅였다. 아기의 해명은 자못 진지하다 못해 논리 정연해 웃음이 터졌다. 두어번을 반복해보다가 문득, 아기가 저 정도 규모로 집을 어지르는 것이 가능한가, 강아지와 아기가 매번 한 앵글 안에 완벽한 구도를 만든 것이 우연일까 의문이 들었다. 댓글을 보니 인공지능 생성물이라는 의견과 진짜라는 의견이 팽팽하게 갈렸다. 묘한 짜증이 일었다. 진짜라 믿고 본 영상이 사실은 가짜일 수도 있다는 불쾌감과 더불어 나를 자극한 것은, 이젠 기계의 창작물이 인간 뇌의 직관적 감별 영역을 벗어났구나 하는 위기감과, 무엇을 믿어야 할지 모르겠다는 불신의 감각이었다.
이러한 불안은 역사적 시각에서 보면 완전히 새로운 것은 아니다. 16세기에는 인쇄술이 발달하자 문서 위조가 성행했다. 19세기에 등장한 사진은 빛이 기록한 진실이라 불렸지만 조작된 심령사진의 유행 등 합성이 가능하다는 것이 드러났다. 그러나 그때마다 사람들은 기본값으로 일단 ‘신뢰’를 선택했다. 과거의 조작에는 기술과 자본이 필요했기 때문이다. 전문가의 영역이었고, 의심의 대상이 한정되어 있었다.
하지만 지금은 스마트폰 하나로 누구나 완성도 높은 가짜를 하루에도 수십개씩 만들 수 있다. 양적 변화와 질적 변화가 동시에 일어나고 있는 것이다. 미국의 커뮤니케이션학자 티머시 러바인은 인간에게 진실 기본값이 있다고 설명한다. 명확한 기만의 단서가 없는 한 정보를 사실로 받아들이도록 설계되어 있다는 것이다. 노벨상 수상자인 심리학자 대니얼 카너먼의 이중과정이론으로 말하자면 빠르고 자동적인 직관 시스템이 먼저 반응하고, 분석적 판단 시스템은 그다음에야 작동한다. 인간 스스로에 대한 과신은 문제를 키우고 있다. 대규모 딥페이크 실험 연구들은 사람이 딥페이크를 잘 판별하지 못하면서도 자신이 판별할 수 있다고 믿는 경향을 반복적으로 보고한다. 이 과신이 허위 영상의 확산과 피해를 조장한다.
한편, 신뢰의 붕괴는 더 깊은 곳까지 파고든다. 우리는 지금 딥페이크의 시대에 이어 필연적으로 딥다우트(deep doubt)의 시대로 접어들고 있는지도 모른다. 생성형 인공지능의 확산이 “영상은 언제든 조작될 수 있다”는 사회적 학습을 낳아, 진짜 영상도 자동으로 의심받는 환경을 만들고 있다. 증거의 진위를 다투는 거짓말쟁이에게는 이보다 좋은 피난처가 없다. 가짜가 흔해질수록 진짜 증거마저 가짜로 몰아붙일 수 있는 여지가 생기는 것이다. 이것이 바로 ‘거짓말쟁이의 배당금’, 즉 거짓말쟁이들이 혼돈으로부터 얻는 사회적 이득이다. 딥다우트의 시대에는 진짜처럼 보이는 가짜, 가짜처럼 보이는 진짜가 한데 묶여 혼돈을 야기할 수 있다.
한때 가수들의 립싱크 여부가 방송에 표시되었듯, 인공지능기본법의 시행과 함께 머지않아 인공지능 생성물 표시 의무도 정착될 것이다. 인공지능 사용 여부를 명확히 하는 표시가 콘텐츠의 신뢰를 담보하도록 하는 것이다. 규제의 어려움과 비용 등의 문제로 아직 갈 길이 멀지만, 그때쯤이면 잃어버린 신뢰의 기본값을 되찾을 수 있을지 궁금하다.",0.2690,0.2544,carbon dioxide,mental disorder,low_both,,,,,,
Korean,Korea,hani.co.kr,scrapai,63,https://www.hani.co.kr/arti/politics/politics_general/1248070.html,"정청래 “조희대 탄핵, 지도부 공식 의견은 아냐…스스로 거취 표명해야”","기사를 읽어드립니다
0:00
광고
정청래 더불어민주당 대표가 당 일각에서 제기되는 조희대 대법원장 탄핵 추진이 “당 지도부의 공식 의견은 아니”라고 말했다.
정 대표는 6일 전남 영광군 현장 최고위원회의를 마친 뒤 영광터미널시장을 방문한 자리에서 취재진을 만나 이렇게 말했다. 그는 이어 “국민들의 그런 열망이 있고 우리 당 소속 국회의원들의 의지도 강한 만큼 앞으로 의원총회를 통해 의견을 잘 모아보겠다”고 말했다.
정 대표는 또 “이런 탄핵 추진 움직임에 앞서 조 대법원장이 일말의 양심이 있다면 스스로 거취를 빨리 표명하는 것이 좋을 것 같다”고 했다. 조 대법원장의 거취 표명을 재차 촉구하면서도, 민주당 강경파 의원들을 중심으로 제기되는 조 대법원장 탄핵 추진론에는 거리를 둔 것으로 풀이된다.
광고
지난 4일 민주당 민형배·조계원, 조국혁신당 황운하, 무소속 최혁진 의원 등이 참여하는 국회 공정사회포럼(옛 처럼회)은 “조 대법원장이 스스로 사퇴하지 않으면 곧바로 탄핵 절차에 돌입해야 한다”(조계원 의원)며 탄핵 소추 추진 의지를 밝힌 바 있다.
고한솔 기자 sol@hani.co.kr",0.2095,0.2061,co2 emission,west nile virus,low_both,,,,,,
