language,country,source,collection_method,article_id,url,title,content,climate_max_sim,health_max_sim,climate_best_keyword,health_best_keyword,sample_bucket,climate,health,health_climate_impact,climate_justification,health_justification,impact_justification
Hungarian,Hungary,magyarnemzet.hu,scrapai,4938,https://magyarnemzet.hu/sport/2023/03/liu-shaolin-sandor-kinaikent-banalis-ok-miatt-marad-le-a-vilagbajnoksagrol,Liu Shaolin Sándor kínaiként banális ok miatt marad le a világbajnokságról,"A Nemzetközi Korcsolyázó-szövetség (ISU) honlapján már elérhető a benevezett versenyzők névsora, s a kínai csapatban Liu Shaoang és Liu Shaolin Sándor nevét sem láthatjuk. Előbbiét persze nem is láthatnánk, hiszen a testvérek hiába vették fel titokban a kínai állampolgárságot, s hiába adott nekik zöld jelzést a távozáshoz a magyar szövetség, az ISU szabályai szerint országváltás esetén egy évet ki kell hagyniuk az érintetteknek. Márpedig a most 24 éves Liu Shaoang tavaly azután, hogy a pekingi téli olimpián egy aranyat (500 méter) és két bronzot (1000 méter, vegyes váltó), rész vett a montreali világbajnokságon is, ahol négy aranyat (összetett, 500, 1000 és 1500 méter) gyújtött be, így a kétszeres olimpiai bajnoknak – hiszen 2018-ban, Phjongcshangban a magyar férfiváltóval is győzött – még nem járt le az egyéves kényszerszünete. Liu Shaolin Sándornak viszont igen, hiszen ő legutóbb a tavalyi olimpián versenyzett, ahol ő is benne volt a bronzérmes vegyesváltónkban. S persze arra is emlékezhetünk, hogy 1000 méteren a döntőben ő haladt át elsőként a célvonalon, de kizárták. Így neki egy olimpiai aranya van, a 2018-as férfiváltónkkal. Liu Shaoang és Liu Shaolin Sándor búcsút intettek Fotó: MTI/Kovács Tamás A tavaly év végi, valamint az idei első világkupa-versenyeken még ő sem vehetett részt, s arról nincs információnk, hogy jelenleg milyen edzettségi állapotban van. A Sportal.blikk.hu cikke viszont arról árulkodik, hogy ő megcélozta a vb-részvételt. A portának Burján Csaba nyilatkozott, aki ugyancsak tagja volt a 2018-ban a téli olimpiák első magyar aranyérmét szerző váltónknak. Liu Shaolin peches esete – Beszéltem velük, és Shaolin már ott is lehetne a vb-n, de azt mesélte, hogy valamilyen adminisztrációs ügy miatt végül lecsúsztak a kínaiak a nevezéséről. Úgyhogy ez az oka annak, hogy továbbra is várni kell a bemutatkozásra – árulta el Burján Csaba. A 27 éves Liu Shaolin Sándor bizonyosan azért is szívesen elment volna Szöulba, mert a két vb-címe közül az elsőt ott szerezte, 2016-ban 500 méteren nyert a dél-koreai fővárosban.",0.4232,0.4827,extreme event,west nile virus,low_both,,,,,,
Hungarian,Hungary,magyarnemzet.hu,scrapai,19257,https://magyarnemzet.hu/kultura/2023/06/az-ot-legjobb-jack-nicholson-film-szall-a-kakukk-feszkere-video,Az öt legjobb Jack Nicholson-film – Száll a kakukk fészkére + videó,"Jack Nicholson filmjeit bemutató mini toplistánkon ezen a héten a negyedik helyet szerzett mozival érkezünk. A múlt héten a Kínai negyed (Chinatown, 1974) című filmmel nyitottuk meg a Nicholson-sorozatot, most pedig ismét egy igazi klasszikus dráma kerül terítékre, a Száll a kakukk fészkére (One Flew Over the Cuckoo's Nest) című zseniális mozi. Ez a film hozta meg Jack Nicholson számára az első Oscar-szobrot és tulajdonképpen az igazi ismertséget is. A lázadó, vagány, de kissé deviáns Patrick McMurphy szerepében Nicholson szinte lubickolt, nem véletlenül nyerte el a legjobb színésznek járó díjat. 4. Száll a kakukk fészkére (1975) A filmet Milos Forman rendezte, aki a nagy hatású cseh újhullám rendezői közé tartozott, olyan filmeket készített hazájában, mint a Fekete Péter (Cerny Petr, 1964) , Egy szöszi szerelme (Lásky jedné plavovlásky, 1965) vagy éppen a Tűz van, babám! (Horí, má panenko, 1967) . Majd 1968-ban a Varsói Szerződés csehszlovákiai invázióját követően az Egyesült Államokba emigrált és ott is zseniális filmeket készített, úgymint a Hair (1979), a Ragtime (1981) , Amadeus (1984) , Valmont (1989) , Larry Flynt, a provokátor (The People vs. Larry Flynt, 1996) és az Ember a Holdon (Man on the Moon, 1999) . A mozi Ken Kesey azonos című regényének adaptációja, bár annyiban mindenképpen eltér a két alkotás egymástól, hogy a regényben Bromden indián „főnök” nézőpontjából van elmesélve a cselekmény, a filmben azonban másképpen ábrázolják a történetet. Kirk Douglas tulajdonában voltak a filmjogok hosszú évek óta, de mire elkezdődhetett a forgatás, Kirk a kora miatt már nem érezte úgy, hogy el tudná játszani hitelesen Patrick McMurphy szerepét. De a film producere fia, Michael Douglas lett, ami nagyszerű húzásnak bizonyult, hiszen Michael megkapta érte az első Oscar-díját is. A száll a kakukk fészkére című film egyik plakátja – Fotó: InterCom A film készítői, bármilyen furcsa is ezt kimondani, nagyon alacsony költségvetésből dolgoztak. Ezért olyan, akkor még nem ismert színészeknek adtak lehetőséget, akik később világhírűvé váltak, köztük Danny Devito , Christopher Lloyd és természetesen a már ismert, de mindenképpen a pályája elején járó Jack Nicholson.",0.4035,0.4797,heatwave,west nile virus,low_both,,,,,,
Hungarian,Hungary,magyarnemzet.hu,scrapai,5221,https://magyarnemzet.hu/sport/2025/01/slot-szoboszlai-liverpool-ipswich-premier-league-23,Slot megfeledkezett Szoboszlairól a Liverpool meccse előtt,"Arne Slot tavaly nyáron az Ipswich ellen mutatkozott be a Liverpool élén a Premier League-ben, az augusztusi találkozót 2-0-ra nyerték meg a vendég Vörösök. A holland tréner arra számít, hogy másodszorra, szombat délután (16.00, tv: Spíler1) nagyobb kihívás elé állítja csapatát a kiesés elől menekülő gárda. – Az idény második fele mindig nehezebb, mert néhány csapat megerősödik az átigazolási ablakban, illetve addigra hosszabb ideje dolgoznak együtt az edzőjükkel. Az Ipswich is erősebb lesz, mint az első meccsünkön volt. Mostanában megnehezítették az ellenfelek dolgát, kivéve a legutóbbi meccsükön, de a Manchester City akkor újra a régi önmaga volt – utalt Slot az Ipswich legutóbbi meccsére, amelyet az együttes 6-0-ra bukott el a címvédő Cityvel szemben. De a holland tréner rávilágított, ez a meccs jelentette a kivételt, a topcsapatok egyébként szenvednek a mélyen védekező alakulatok ellen. – A volt klubom, a Feyenoord hét közben a Bayern ellen játszott, és senki sem számított ilyen eredményre (3-0-ra nyert a Feyenoord – a szerk.). A Bayern talán nyolcvan százalékban birtokolta a labdát, de nagyon nehéz a mélyen védekező csapatok ellen játszani, helyzeteket kialakítani, főleg, ha olyan keményen dolgoznak, mint azt a Feyenoord tette a Bayern ellen, vagy az Ipswich az Arsenal ellen. Slot a sajtótájékoztatón felidézte, az apja gyakran kritizálja a Liverpool teljesítményét, amivel ő nem feltétlen ért egyet. Az édesapa azt szeretné, ha több rizikót vállalna az együttes, de a fia szerint annak vereség lenne a vége. – A szurkolók számára ez olykor nehéz. Az édesapám is közéjük tartozik, a Lille elleni meccs után is elmondta, hogy nem volt olyan izgalmas, mint a Liverpool többi mérkőzése. Ilyenkor megpróbálom neki megmagyarázni, hogy elveszíthetjük ezeket a mérkőzéseket, ha, ahogy én nevezem ezeket, buta labdákkal próbálkozunk, de nem mindig ért velem egyet. Edzőként én elégedett voltam a Lille elleni teljesítményünkkel, mert az ellenfél egy szervezett csapat volt. Volt Jonesnak egy rizikós passza a felezővonalnál, elveszítettük a labdát, aztán kontrázott a Lille. Ez mindig kockázatot jelent egy mélyen védekező csapat ellen – magyarázta a tréner.",0.4167,0.4500,extreme event,west nile virus,low_both,,,,,,
Hungarian,Hungary,magyarnemzet.hu,scrapai,14311,https://magyarnemzet.hu/kultura/2022/09/masolat-a-ciganykutato-fenykepei-a-karpat-medenceben,A cigánykutató fényképei a Kárpát-medencében,"A Néprajzi Múzeum kezdte meg Erdős Kamill cigánykutató különleges etnográfiai fotóhagyatékának feldolgozását Budapesten. Az ötszáz fényképet és az ötszáz tárgyleíró kartont a gyulai Erkel Ferenc Múzeumból szállították a fővárosba, hogy itt a legmodernebb módszerekkel, szakszerűen archiválják az anyagot, adta hírül az M5 tévécsatorna EtnoKultúra című műsora. A fényképek mellett a gyulai közgyűjteményben levelek, gyűjtött tárgyak, szakkönyvek, feljegyzések és terepnaplók képezik az egyik legnagyobb hazai romológus örökségét. Mindezekből a Néprajzi Múzeum vándorkiállítást állít össze, amelyet a határon túli magyar területekre is elvisznek. Az ország legnagyobb etnográfiai közgyűjteménye ezzel szélesíti ki együttműködését a vidéki múzeumokkal, hiszen már korábban is dolgoztak hálózatban, digitalizáltak és archiváltak vidékről érkező anyagokat. Terveik szerint az egykori – és még létező – forrásközösségeket is felkeresik majd. A Budapesten 1924-ben született Erdős Kamill egyébként tragikus életpályát futott be. Alighogy tisztté avatták a második világháború végén külföldre menekített Ludovika Akadé­mián, francia fogságba esett. Innen hazakerülve végzett el egy jegyzői tanfolyamot, de kiderült, hogy tüdőbajos lett, ezért nem maradhatott ezen a pályán. Kórházi kezelésre szorulva került 1952-ben Gyulára. Ebben a városban nősült meg, itt kapott munkát a kórház orvosi könyvtárában. Mivel a betegség elhatalmasodott rajta, 1956-ban rokkantsági nyugdíjba ment. 1962. július 2-án hunyt el, Gyulán temették el. A megyei kórház kápolnája közelében állítottak tiszteletére egy fából készült szobrot. Erdős Kamill páratlan kutatásait szélesebb körben csak 1956 után ismerték meg, azt követően, hogy kezdtek megjelenni a tanulmányai. Késői bemutatkozásának egyik oka az volt, hogy néprajzi tájékozottságát autodidakta módon szerezte. A cigány nyelv kárpáti cigány nyelvjárását például a budakeszi szanatóriumban vele együtt ápolt Bárányi Dezső balassagyarmati cigányprímástól sajátította el. Az oláh cigány nyelvjárást Gyulán tanulta meg, főként Kolompár Jánostól, akinek az édesanyja is fontos szerepet játszott cigánytanulmányaiban.",0.4075,0.4755,extreme event,west nile virus,low_both,,,,,,
Hungarian,Hungary,magyarnemzet.hu,scrapai,17257,https://magyarnemzet.hu/belfold/2022/10/modositotta-a-kormany-a-taxisrendeletet-a-szabalyokat-betarto-szolgaltatok-es-az-utasok-erdekeben,Módosította a kormány a taxisrendeletet a szabályokat betartó szolgáltatók és az utasok érdekében,"Több ponton is megérett a változtatásra a taxizás szabályozása, a kormány módosította az erről szóló rendeletet a szabályokat betartó taxisok és a taxival utazók érdekében – hívta fel a figyelmet közösségi oldalán Vitézy Dávid, a javaslatot benyújtó Technológiai és Ipari Minisztérium közlekedési államtitkára. A rendelet lényege szerinte: szigorúbb fellépés a szabálytalan taxizás ellen, illetve a járművek legmagasabb megengedett életkorának rendezése. Vitézy kifejtette: a taxijárművek életkorára vonatkozó, a járvány idejére felfüggesztett szabályok ez év végével lejárnak. Figyelembe véve, hogy az elmúlt időben a pandémia, a járműipari és energiapiaci válság a taxisok helyzetét sem könnyítette meg, a 2017. január 1. előtt nyilvántartásba vett taxijárművek maximálisan megengedett életkorát tízről 13 évre emeljük, a 2017 óta forgalomba helyezett, tehát ma hat évnél fiatalabb autók esetében marad a tízéves szabály. Megteremtjük a jogszabályi feltételeit, hogy a taxiszolgáltatók bekapcsolódhassanak a közösségi közlekedési közszolgáltatásba – folytatta az államtitkár. „Ma az ötvenfős Volánbusz alatti léptékben nincs kapacitási lépcső a tömegközlekedésben, márpedig sok helyen például este, hétvégén csak jóval kisebb igény jelentkezik, és a néhány vonatról leszálló utast pedig érdemes egy kisebb településen akár a céljához vinni kötött útvonal helyett. A nyugat-európai példákra épülő új szabályozás megteremti a lehetőséget az iránytaxik minden félnek előnyös működtetésére” – magyarázta Vitézy. Hozzátette: ilyen szolgáltatásokat a jövőben az országos közlekedésszervező rendelhet meg, elsőre nyilván kísérleti jelleggel. Az államtitkár közölte azt is: szigorítják a taxisengedélyek kiadását, hogy a nem megbízható vállalkozásokat gyorsan ki lehessen szűrni a piacról. A jövőben próbautazás nélkül is lehetővé válik a jogellenesen működő szolgáltatók, a szabálytalan taxisok büntetése. Ez azért is fontos, mert a jelenlegi szabályozás több okból is kijátszhatónak bizonyult az elmúlt években, egy idő után például arcról felismerik a próbautasokat a jogellenesen működő taxisok.",0.4153,0.4479,extreme heat,casualties,low_both,,,,,,
Hungarian,Hungary,magyarnemzet.hu,scrapai,1432,https://magyarnemzet.hu/belfold/2025/06/magyar-peter-tisza-part-adatgyujtes-discord-szerver,"Magyar Péterék lelőtték a Discord-szervert, ahol a tiszások lázadoztak + videó","„Az elmúlt évben a Discord-szerverünkön rengeteg értékes beszélgetés zajlott, nagyszerű tartalmak születtek, barátságok szövődtek – egy közösség formálódott. De sajnos ez a közösségi tér mára célponttá vált: visszaélnek vele, kiforgatják, támadásokra használják. A kormány kezében olyan eszközzé vált, amellyel megpróbálnak félelmet kelteni, bizalmatlanságot szítani” – ecsetelte hosszan szombat esti Facebook-bejegyzésében a Tisza Párt, majd bejelentette: úgy döntöttek, bezárják a Discord-szervert. A Mandiner felhívta a figyelmet arra, ugyan Magyar Péterék a kormány támadásait emlegetik, valójában azután zárják be a szervert, hogy a napokban kiszivárgott az aktivistáikról vezetett lista, amelyben egyes önkénteseiket durva jelzőkkel illették.",0.4172,0.4416,climate crisis,west nile virus,low_both,,,,,,
Hungarian,Hungary,borsonline.hu,newsapi,2780,https://www.borsonline.hu/test-es-lelek/2026/02/narcisztikus-pszichopata-jelek,"Nárcisztikus vagy pszichopata? Így ismerd fel, melyikkel van dolgod","""Mi a közös bennük? Mi a különbség köztük? Hogyan ismerhetem fel őket?"" Ha valaha is feltetted magadban ezeket a kérdéseket, jó helyen jársz, mert utánajártunk, mi a különbség a két mentális zavar között, és eláruljuk, hogyan ismerheted fel, hogy nárcisztikussal vagy pszichopatával van dolgod! Olvass tovább!

A nárcisztikus és pszichopata személyek tulajdonságai gyakran előkerülő témák, de mit jelentenek valójában ezek a fogalmak? Miért nem mindegy, melyikkel hoz össze a sors? Utánajártuk!

Amikor a nárcisztikus szót halljuk, szinte mindenki a magát túlzóan szerető, minden tekintetben ragyogni vágyó emberre gondol. Van is benne igazság: a nárcisztikus személyiségzavar lényege, hogy az illető erősen énközpontú, és folyamatosan visszaigazolásra és csodálatra vágyik másoktól.

- emeli ki Hailey Shafir, mentálhigiénés tanácsadó.

Ezt a figyelmet akár hosszú beszélgetésekkel, dominanciával vagy folyamatos dicséretet kérő viselkedéssel is próbálja kicsikarni környezetétől. Ha nem kapja meg azt az elismerést amire vágyik, érzelmileg könnyen összezuhan vagy dühbe gurul - gondolj csak arra, mikor valaki azonnal megsértődik, ha nem kapja meg a neki kijáró ""tapsot"".

Egy nárcisztikus ember nem feltétlenül mély, bensőséges kapcsolatokra vágyik, inkább olyanokra, ahol ő van a középpontban. Ez gyakran azt jelenti, hogy manipulál, másokat leértékel, vagy elfelejti a másik szükségleteit.

A pszichopata kifejezés egy kicsit már sötétebb tónusú. Míg a nárcisztikusnak sokszor fontos a külső kép, a figyelem és a csodálat, addig a pszichopata hidegebb, számítóbb és gyakran még kevesebb lelki ""gátlással"" rendelkezik. Ő nem feltétlenül törődik azzal, mások mit gondolnak róla - hacsak az nem segíti elő célja elérését.",0.4018,0.4351,extreme heat,undernourishment,low_both,,,,,,
Hungarian,Hungary,magyarnemzet.hu,scrapai,4647,https://magyarnemzet.hu/sport/2020/01/tamado-tavozik-a-fraditol,Támadó távozik a Fraditól,"Távozik az OTP Bank Ligában címvédő Ferencváros labdarúgócsapatától a 63-szoros válogatott Priskin Tamás. A zöld-fehér klub szerdán, a honlapján közölte a hírt, emlékeztetve, hogy a 33 éves támadó 2017 nyarán érkezett az együtteshez. Az első szezonjában 17 NB I-es mérkőzésen négy gólt szerzett, majd a következő idényt kölcsönben a Szombathelyi Haladásnál töltötte, tavaly nyáron azonban visszatért. A felkészülési időszak jól sikerült neki, így két Bajnokok Ligája- és egy Európa Liga-selejtezőn is pályára léphetett, az ősszel azonban csak két NB I-es és három Magyar Kupa-mérkőzésen jutott szóhoz – írja a fradi.hu. Egyelőre nem ismert, hogy Priskin hol folytatja a pályafutását.",0.3814,0.4357,extreme event,west nile virus,low_both,,,,,,
Hungarian,Hungary,borsonline.hu,newsapi,2219,https://www.borsonline.hu/sport/2026/03/kathi-bela-szobor-cutler,Szívszorító! Szobrot állítanak Kathi Bélának,"Szobrot állítanak a legendának. Kathi Béla előtt tiszteleg a győri Cutler Fitness.

A győri Cutler Fitness a hivatalos Facebook-oldalán osztotta meg a hírt, miszerint szobrot állítanak Kathi Bélának. A tisztelgésre a győri terem 10. születésnapja alkalmából kerül sor.

A rendezvényre március 28-án kerül sor, ahol a legenda előtt fognak tisztelegni a műalkotással.

Március 28-án, 10. születésnapunkon egy nagyon fontos eseményre is sor kerül, amivel a magyar testépítés legendás alakja, barátunk, Kathi Béla előtt szeretnénk tisztelegni. A rendezvény keretében a Kathi Béla-szobor felavatására is sort kerítünk, ez a programelem pedig kiemelt helyet foglal majd el a nap menetrendjében, éppúgy, ahogy Kathi Béla a szívünkben

- áll a közleményben.

Nagyon sajnáljuk, hogy ezt a jeles ünnepet nem tölthetjük már vele, és bár lelkünkben örök űr marad utána, de bízunk benne, hogy az elkészült műalkotással méltó emléket állítunk neki és a hazai erősportra gyakorolt hatásának egyaránt

Kathi Béla július 31-én, tragikus hirtelenséggel hunyt el, 46 éves korában. Az erőemelésben és fekvenyomásban is országos bajnok sportoló ciprusi nyaralása közben, kerékpárbalesetben vesztette életét.",0.4235,0.4520,extreme event,casualties,low_both,,,,,,
Hungarian,Hungary,borsonline.hu,newsapi,448,https://www.borsonline.hu/kek-hirek/2026/03/gyerekgyilkos-apa-egermereg-kislany,Saját apja etette meg a halálos kapszulát a kisgyerekkel: Megdöbbentő ítélet született,"A hároméves kislány nem is sejtette, hogy a saját édesapja az életére tör. Az apa egy házi készítésű méregkapszulát gyömöszölt le a gyerek torkán, hogy megússza a gyerektartást.

A bajorországi Landshut bíróságán szerdán végre kimondták az ítéletet: nyolc év börtön vár arra a 28 éves férfira, aki hidegvérrel próbálta megmérgezni saját húsát és vérét. A történet még 2024 decemberében kezdődött, amikor a gyerekgyilkos apa, az afgán származású Elias G. úgy döntött, végleg ""megoldja"" a családi konfliktusokat és az anyagi nehézségeket.

A férfi nem bízta a véletlenre a szörnyű tettet. A nyomozás során kiderült, hogy Elias előre kutatott az interneten a különböző mérgek után, majd egy darab folpackból és egérméregből otthon barkácsolt halálos kapszulát. A dózist milligrammra pontosan úgy lőtte be, hogy az egy ilyen korú kisgyermek számára biztosan végzetes legyen.

Miután a kislány lenyelte a mérget, az apa visszavitte őt a tőle különélő volt élettársához. A célja egyértelmű volt: azt akarta, hogy a gyerek az anyjánál haljon meg, így a gyanú a nőre terelődjön.

A kislány élete csak a véletlenen múlt. Nem sokkal azután, hogy hazaért, hányni kezdett. Édesanyja azonnal hívta a mentőket, a kórházban pedig kiderült a sokkoló igazság. A szerencsét a szerencsétlenségben az jelentette, hogy a méregkapszula csomagolása a gyomorban nem szakadt ki teljesen, így a méreg nem szívódott fel a gyerek szervezetében.

A kislány később a gondozóinak is elárulta a szörnyű titkot:

Az ügyészség szerint a férfi motivációja a tiszta kapzsiság volt: egyszerűen nem akart gyerektartást fizetni. Bár a bíróság végül az aljas indokot nem vette külön figyelembe, az emberölési kísérletet és a súlyos testi sértést bizonyítottnak látta. Az apa DNS-ét ugyanis megtalálták a kislány által kihányt kapszula belsejében is.

Az apa és ügyvédjei az utolsó pillanatig tagadtak, sőt, gyomorforgató módon az anyát vádolták meg.

- harsogta a védelem, ám a bírót nem tudták megvezetni.",0.4006,0.4732,carbon dioxide,starvation,low_both,,,,,,
Hungarian,Hungary,magyarnemzet.hu,scrapai,9352,https://magyarnemzet.hu/belfold/2022/04/sajat-volt-tagtarsuk-cafolja-a-birakat-a-pressman-talalkozo-kapcsan,Saját volt tagtársuk cáfolja a bírákat a Pressman-találkozó kapcsán,"Mint ismeretes, mind bírósági körökben, mind a nyilvánosságban botrányt okozott, hogy David Pressman amerikai nagykövet találkozott két magyar bíróval, Matusik Tamással és Vasvári Csabával, akik nem mellesleg az Országos Bírói Tanács (OBT) tagjai is. Az ügyben megszólalt a tanács, többek között arra utalva, hogy egy rutinszerű találkozóról volt szó, amelynek elvi kerete a „demokráciákban teljesen szokásos mód”. A kúria elnöke, Varga Zs. András ugyanakkor rámutatott , hogy az egyes nagykövetségek természetesen kapcsolatot tartanak a fogadó állam intézményeivel, viszont a hivatalos kapcsolatok helyszíne általában a fogadó állam intézményének székhelye. A Kúria elnöke hozzátette, hogy nincs tudomása arról, hogy  az OBT és az Amerikai Egyesült Államok nagykövetének kapcsolata az októberi két OBT-ülés bármelyikén napirenden szerepelt volna. Ezt erősíti Vadász Viktor korábbi OBT-tagnak az ügyben megjelent Twitter-üzenete, amelyben egyértelműsíti, hogy Matusik és Vasvári nagykövetségi látogatása jelzésértékű, a két bíróval előbb találkozott Pressman nagykövet, mint az igazságszolgáltatás bármely más szereplőjével, és ez azt jelzi, hogy Magyarországon az igazságot, az igazságszolgáltatást az Országos Bírói Tanács képviseli – írja a Tűzfalcsoport . The Ambassador (we are talking about one of the most important allies of Hungary) has met two members of #OBT before meeting any other stakeholder from the judiciary. I think it’s a clear sign for someone, who said “OBT is just a group of buddies”. OBT represents #justice in 🇭🇺 https://t.co/YrEGsaDNSd — Viktor Vadász (@vadaszviktor1) October 27, 2022 Vadász és Matusik szemlátomást jóban vannak – tette hozzá a portál. The Ambassador (we are talking about one of the most important allies of Hungary) has met two members of #OBT before meeting any other stakeholder from the judiciary. I think it’s a clear sign for someone, who said “OBT is just a group of buddies”. OBT represents #justice in 🇭🇺 https://t.co/YrEGsaDNSd — Viktor Vadász (@vadaszviktor1) October 27, 2022 Megjegyzendő, hogy az OBT mindig is népszerű volt a balliberális médiában, sajtófigyelő rovatában túlnyomó többségben balos újságokat szemléz a tanács.",0.4472,0.5221,climate crisis,west nile virus,borderline,,,,,,
