language,country,source,collection_method,article_id,url,title,content,climate_max_sim,health_max_sim,climate_best_keyword,health_best_keyword,sample_bucket,climate,health,health_climate_impact,climate_justification,health_justification,impact_justification
Italian,Italy,repubblica.it,newsapi,3008,https://www.repubblica.it/motori/2026/02/23/news/flotte_aziendali_fino_a_2_milioni_di_vendite_in_piu_per_l_elettrico_con_obiettivi_ue_piu_ambiziosi-425178696/,"Flotte aziendali, fino a 2 milioni di vendite in più per l'elettrico con obiettivi Ue più ambiziosi","ROMA - Secondo una ricerca dell'ente indipendente Transport & Environment, l'Unione europea potrebbe accelerare significativamente la transizione ecologica innalzando l'obiettivo di elettrificazione per le grandi flotte aziendali dal 45% al 69%, escludendo gli ibridi plug-in. Questa modifica permetterebbe di immettere sul mercato fino a due milioni di auto elettriche in più, aiutando i produttori a rispettare i limiti di emissioni e coprendo gran parte delle vendite necessarie per il raggiungimento degli obiettivi comunitari al 2030. Le grandi aziende, pur rappresentando una piccolissima parte del totale delle imprese, acquistano oltre un terzo delle nuove auto immatricolate nel Vecchio Continente e potrebbero trainare l'intero settore.

In Italia, con la traiettoria definita dagli standard di CO2, le immatricolazioni di veicoli elettrici delle grandi aziende al 2030 raggiungerebbero il 36%. Per raggiungere il 45% previsto dall'attuale proposta sulle flotte, si chiederebbe quindi alle grandi aziende uno sforzo aggiuntivo di appena due punti percentuali l'anno, da qui al 2030. Un target più ambizioso, come quello proposto da T&E al 69%, sosterrebbe invece la produzione interna e l'occupazione, poiché la maggior parte dei veicoli aziendali elettrici è realizzata in Europa. ""Proporre una legge sulle flotte che non incentivi le grandi aziende a guidare il cambiamento rischia di essere inefficace - ha sottolineato Esther Marchetti, clean transport advocacy manager di T&E Italia - I legislatori hanno due strade: aumentare gli obiettivi per i veicoli elettrici ed eliminare gli ibridi plug-in, oppure rischiare che questa norma non realizzi il suo pieno potenziale come volano strategico per la decarbonizzazione del trasporto stradale"".

Inoltre, poiché le società rinnovano i propri parchi auto molto velocemente (2-4 anni), un aumento dei volumi aziendali alimenterebbe il mercato dell'usato, rendendo le auto elettriche accessibili a una fascia più ampia di utenti. La proposta di T&E porterebbe 21,1 milioni di veicoli elettrici sul mercato dell'usato tra il 2030 e il 2035, 3,6 milioni in più rispetto allo scenario attuale, mentre gli obiettivi proposti dalla Commissione lascerebbero sostanzialmente invariato tale numero. Da segnalare infine, che la modifica proposta da T&E contribuirebbe anche alla riduzione della dipendenza energetica europea dal petrolio estero, portando vantaggi non solo ambientali ma anche economici e strategici.",0.5791,0.5042,carbon emission,west nile virus,high_climate,,,,,,
Italian,Italy,repubblica.it,newsapi,3292,https://www.repubblica.it/green-and-blue/2026/02/20/news/clima_a_rischio_il_20_della_copertura_dei_ghiacci_marini_in_antartide-425171444/,"Clima, a rischio il 20% della copertura dei ghiacci marini in Antartide","La crisi climatica sta riscaldando rapidamente l'Antartide, con conseguenze potenzialmente disastrose. Ora gli scienziati hanno elaborato modelli degli scenari migliori e peggiori per il cambiamento climatico in quell'area, dimostrando quanto sia alta la posta in gioco, ma anche quanti danni possano ancora essere prevenuti.

""La Penisola Antartica è un luogo speciale"", ha affermato Bethan Davies dell'Università di Newcastle, autrice principale dell'articolo su Frontiers in Environmental Science e candidata nazionale per il Regno Unito al Frontiers Planet Prize 2026. ""Il suo futuro dipende dalle scelte che facciamo oggi. In un futuro a basse emissioni, possiamo evitare gli impatti più gravi e dannosi. Tuttavia, in uno scenario a emissioni più elevate, rischiamo la perdita di ghiaccio marino, piattaforme di ghiaccio, ghiacciai e specie iconiche come i pinguini"".

Gli scienziati si sono concentrati sulla Penisola Antartica, un centro di ricerca, turismo e pesca molto studiato, ma anche molto vulnerabile ai cambiamenti antropici. ""Ho trascorso il mio primo periodo in Antartide come 'svernante' presso la stazione Signy nelle Isole Orcadi Meridionali, da novembre 1989 ad aprile 1991"", ha affermato il Peter Convey del British Antarctic Survey, coautore. ""Per un visitatore occasionale, la prima impressione è inevitabilmente che la regione sia dominata dai ghiacci. Tuttavia, per chi ha il privilegio di tornarci più volte, i cambiamenti nel tempo sono molto evidenti"".

Gli scienziati hanno utilizzato scenari che stimano le emissioni future per modellare i risultati per la Penisola Antartica: basse emissioni (aumento della temperatura di 1,8 °C rispetto ai livelli preindustriali entro il 2100), emissioni medio-alte (3,6 °C) ed emissioni molto alte (4,4 °C). Hanno esaminato otto diversi aspetti dell'ambiente della Penisola interessati dai cambiamenti climatici: ecosistemi marini e terrestri, ghiaccio terrestre e marino, piattaforme di ghiaccio, Oceano Antartico, atmosfera ed eventi estremi come le ondate di calore.

""Nel 2019, abbiamo dimostrato come la Penisola Antartica sarebbe stata influenzata da uno scenario climatico di 1,5 °C"", ha affermato Martin Siegert dell'Università di Exeter, coautore. ""Ora, nel 2026, condividiamo cosa significherebbe per la Penisola Antartica superare 1,5 °C, una prospettiva spaventosa"".

In scenari con emissioni più elevate, l'Oceano Antartico si riscalderà più rapidamente. Le acque oceaniche più calde eroderanno i ghiacci sulla terraferma e in mare. Più elevate saranno le temperature, maggiore sarà la probabilità che le piattaforme di ghiaccio collassino, provocando l'innalzamento del livello del mare.

Nello scenario con le emissioni più elevate, la copertura di ghiaccio marino potrebbe ridursi del 20%, devastando le specie che ne dipendono - come il krill, una preda importante per balene e pinguini - e amplificando il riscaldamento degli oceani in tutto il mondo. Un riscaldamento oceanico più intenso metterebbe inoltre a du...",0.6134,0.5434,changing climate,extreme poverty,high_climate,,,,,,
Italian,Italy,repubblica.it,newsapi,2000,https://www.repubblica.it/cronaca/2026/03/04/news/previsioni_meteo_anticipo_primavera-425198284/,"Previsioni meteo, anticipo di primavera: blocco anticiclonico e temperature fino a 20-21 gradi","Attenzione alle nebbie. Da giovedì cieli più sereni e limpidi

La protezione granitica dell'alta pressione ad oltranza porterà i termometri a toccare i 20 gradi da Nord a Sud, regalandoci un netto anticipo di primavera.

Lorenzo Tedici, meteorologo responsabile media de iLMeteo.it, ci spiega la dinamica atmosferica che sta alla base di questo anticipo di Primavera: ""l'anticiclone ha eretto un vero e proprio scudo sul Mediterraneo centrale. Le perturbazioni atlantiche in arrivo da ovest sbattono letteralmente contro questo 'muro' di alta pressione e sono costrette a deviare la loro traiettoria, scendendo verso l'Algeria per poi dissolversi nel nulla"".

Se diamo uno sguardo alla climatologia della prima decade di marzo, ci rendiamo conto della portata di questa anomalia. Storicamente, l'inizio di marzo è ancora un periodo di transizione, dove i colpi di coda invernali e le gelate tardive sono la norma, con temperature massime che in media dovrebbero aggirarsi intorno ai 12-14°C.Toccare i 20°C su scala quasi nazionale in questa fase dell'anno rappresenta uno scarto termico notevole, che ci proietta direttamente nel mese di aprile.

Tuttavia, alta pressione in inverno e inizio primavera non è sempre sinonimo di cieli azzurri. Bisognerà prestare molta attenzione alla nebbia, che tornerà a fare la voce grossa sulla Pianura Padana e sulle coste del Centro-Nord adriatico, riducendo la visibilità e mantenendo i cieli grigi nelle prime ore del giorno. Inoltre nubi di origine marittima interesseranno ancora le regioni centrali nelle prossime ore.

Da giovedì il cielo sarà più limpido, seppur a tratti offuscato dalla ""sabbia del deserto"" mentre da venerdì e per il weekend avremo qualche piovasco nordafricano su Sardegna, Sicilia e Appennino Meridionale.

Infine, la tendenza per tutto il mese di marzo sembra tracciata: avremo temperature costantemente sopra la media del periodo, sebbene nella seconda metà del mese potremmo assistere al ritorno di qualche pioggia in più.

Mercoledì 4. Al Nord: nubi basse in pianura, sole in montagna; nebbia notturne. Al Centro: cielo spesso coperto o molto nuvoloso; isolati piovaschi possibili tra Toscana, Lazio e Appennini centrali. Al Sud: parzialmente nuvoloso, clima mite; piovaschi fino al mattino in Sardegna.

Giovedì 5. Al Nord: bel tempo e sole, resistono le nebbie notturne e mattutine in Val Padana. Al Centro: poco nuvoloso ovunque. Al Sud: soleggiato. Temperature in generale aumento.

Venerdì 6. Al Nord: sereno e mite. Al Centro: tanto sole e clima piuttosto piacevole. Al Sud: nubi in aumento con piogge su Sardegna e Sicilia.

Weekend. In prevalenza soleggiato e termicamente gradevole su quasi tutta la Penisola, ma con un po' di instabilità e qualche rovescio concentrato tra Sardegna, Sicilia e Calabria.

Prossima Settimana. Un ciclone in arrivo dalla Spagna proverà a farsi strada, ma non sfonderà il muro anticiclonico: al massimo avremo qualche rovescio sparso limitato ai nostri settori più occidentali.",0.5596,0.5172,rising temperatures,west nile virus,high_climate,,,,,,
Italian,Italy,repubblica.it,newsapi,696,https://www.repubblica.it/cronaca/2026/03/16/news/iceberg_a23a_piu_longevo_sta_morendo-425225266/,L'iceberg dei record sta morendo. Ma prima di sbriciolarsi fa fiorire la vita marina,"A23-A si è distaccato 40 anni fa dall'Antartide ed è il più longevo mai registrato. Ora gli restano poche settimane di esistenza. Ma i nutrienti rilasciati dal ghiaccio stanno causando una fioritura di microalghe essenziali per la catena alimentare

L'iceberg A23-A sta per scomparire. All'età che per un uomo rappresenterebbe il mezzo del cammino della vita, gli restano solo poche settimane. Quando si è staccato dall'Antartide nel 1986 era uno dei più grandi della storia: con 4mila chilometri quadri raggiungeva quasi le dimensioni del Molise. Oggi si è spostato molto verso nord. Si trova vicino all'isola della Georgia del Sud, alla stessa latitudine della Terra del Fuoco. Una temperatura dell'acqua attorno ai 10 gradi segna la sua condanna a morte.

Nel morire, A23-a sta però portando nuova vita all'oceano. Le sostanze nutrienti di cui è ricco il suo ghiaccio vengono infatti rilasciate nell'acqua. Minerali e metalli nutrono la miriade di organismi unicellulari che formano il plankton e che svolgono la fotosintesi tramite la clorofilla. Un satellite della Nasa chiamato Pace è stato costruito proprio per cogliere dall'alto il colore verde di questa molecola. La fioritura attorno alle spoglie dell'iceberg è diventata così osservabile dallo spazio.

Le microalghe non sono solo la base della catena alimentare degli oceani (nutrono il krill, piccoli crostacei che a loro volta sono il cibo degli organismi via via più grandi, incluse le balene, le foche e i pinguini). Essendo dei vegetali, consumano anidride carbonica e rilasciano ossigeno. Si stima che circa la metà del gas che respiriamo sia stata prodotta dal fitoplankton. Una sua terza funzione utile all'ambiente è il trasferimento dell'anidride carbonica - il più abbondante gas serra responsabile del cambiamento climatico - dall'atmosfera verso le profondità degli oceani.

Dopo il suo distacco, A23-a (chiamato megaberg per le sue dimensioni) è rimasto per trent'anni immobile nel mare di Weddell. Con la sua stazza toccava infatti sul fondale marino. Ci sono voluti tre decenni di lenta fusione e assottigliamento per disincagliarlo e fargli intraprendere una lenta navigazione verso nord, spinto dalle correnti, in quello che viene chiamato il corridoio degli iceberg. Anche se in passato sono stati osservati almeno due iceberg più grandi (B15 nel 2000 ha raggiunto addirittura gli 11mila chilometri quadri), A23-a è il più longevo e quello che ha raggiunto la latitudine più settentrionale.

Nel 2025 l'iceberg, ancora gigantesco, è arrivato a minacciare l'isola della Georgia del Sud (all'epoca non troppo più grande di lui). La vita sui fondali e nelle colonie che pinguini e uccelli marini avevano costruito sulle scogliere sarebbe stata spazzata via dall'impatto con A23-a. La sua rotta alla fine ha schivato l'isola e oggi l'iceberg si trova a circa 70 chilometri dalle sue coste. Le sue dimensioni si sono ridotte a 180 chilometri quadri. Presto scenderà sotto il limite di superficie che prevede il censimento e...",0.5618,0.5702,rising sea levels,west nile virus,high_climate,,,,,,
Italian,Italy,repubblica.it,scrapai,131,https://www.repubblica.it/economia/2026/03/08/news/svizzera_denaro_contante_entra_nella_costituzione_banca_centrale_garantira_approvvigionamento-425208258/,"Svizzera, denaro cash entra nella costituzione. “Banca centrale dovrà garantire approvvigionamento”","Svizzera, denaro cash entra nella costituzione. “Banca centrale dovrà garantire approvvigionamento” di Arturo Cocchi I cittadini elvetici si sono espressi su due referendum che, con sfumature diverse, proponevano di garantire la sopravvivenza di monete e banconote, in un mondo di crescente commercio telematico. Ha vinto quello del governo federale L'ascolto è riservato agli abbonati premium 08 Marzo 2026 Aggiornato alle 21:19 1 minuti di lettura Abbonati per leggere anche Leggi i commenti I commenti dei lettori Osservatori FTSE MIB 44.025 -0,29% Eur/Usd 1,1627 -0,08% Spread 76,51 Dati di mercato Leggi anche Islanda, mareggiata devasta la spiaggia nera di Reynisfjara. Su Instagram era la Braies del Nord Qantas svela l’aereo da record. Ecco l’Airbus che volerà da Londra a Sydney senza scalo. Nel 2027 Livigno, il cartello della benzina low cost. Nel borgo duty free 10 anni senza concorrenza: multe Raccomandati per te Le conseguenze del conflitto in Medio Oriente su petrolio, oro e azioni: tre scenari per i mercati Bollette del gas, la stangata iraniana sarà pagata da anziani e più fragili Cannibale e “fan di Trump”, una nuova biografia racconta Hannibal Lecter “Miracolo a Milano”, Totò il buono spegne l’utopia di Zavattini © Riproduzione riservata Tutti gli Esperti Casa Fisco Pensioni Diritti e Consumi Lavoro Risparmio Ricerca Esperto Tutti gli esperti Casa Fisco Pensioni Diritti e Consumi Lavoro Risparmio Cerca",0.5643,0.6202,climate crisis,west nile virus,high_climate,,,,,,
Italian,Italy,repubblica.it,newsapi,77,https://www.repubblica.it/green-and-blue/2026/03/22/news/un_deserto_in_cina_rifiorisce_e_contribuisce_a_catturare_anidride_carbonica-425232446/,"Un deserto in Cina ""rifiorisce"" e contribuisce a catturare anidride carbonica","Le decennali opere di riforestazione dei confini del deserto del Taklamakan stanno dando risultati: la ""Grande Muraglia verde"" protegge le terre agricole e dà speranza alla lotta al cambiamento climatico

Il deserto del Taklamakan, nella Cina nord-occidentale, si sta lentamente trasformando: grazie a un piano di riforestazione che ormai va avanti da oltre 50 anni, quel ""vuoto biologico"" non è più senza speranza e può diventare un alleato nella lotta al cambiamento climatico. A sostenerlo è uno studio condotto da ricercatori statunitensi e cinesi e pubblicato su Pnas, che, grazie a dati satellitari, ha messo in evidenza come i confini del deserto abbiano iniziato ad assorbire gas serra, diventando un (piccolo) pozzo di assorbimento del carbonio.

I ricercatori hanno analizzato i dati satellitari relativi a livelli di anidride carbonica, estensione della copertura vegetale e modelli meteorologici della regione del deserto del Taklamakan, rilevando un aumento costante della capacità di trattenere carbonio, in particolare nella stagione umida (luglio-settembre). Si tratta ovviamente di un effetto molto limitato (anche se l'intero deserto del Taklamakan fosse ricoperto da foreste, si otterrebbe una compensazione di sole 60 milioni di tonnellate di anidride carbonica, rispetto alle emissioni globali di circa 40 miliardi di tonnellate all'anno), ma - sottolineano gli esperti - anche solo il fatto che esista e sia misurabile è importante e offre speranza per misure che potrebbero essere adottate in futuro. ""Non risolveremo la crisi climatica piantando alberi solo nei deserti - commenta King-Fai Li, dell'Università della California e tra gli autori dello studio - ma capire dove e quanta anidride carbonica può essere assorbita, e in quali condizioni, è essenziale. Questo è un tassello del puzzle"".

Questi risultati sono stati possibili grazie al programma Three-North Shelterbelt, un'iniziativa che mira a circondare le aree desertiche della Cina con una ""Grande Muraglia verde"", una cintura protettiva di vegetazione. Si tratta di un piano di lunga durata: va avanti da 50 anni e proseguirà fino al 2050, con l'obiettivo di triplicare la copertura forestale in 13 province della Cina settentrionale, passando dal 5% attuale al 15% circa. L'idea di fondo è che anche per ambienti estremi come i deserti possa esserci modo di recuperare forme di vita vegetale. Non dobbiamo immaginare foreste pluviali o giungle lussureggianti, sottolinea Li: quelli piantati ai margini di territori ostili, aridi, sono più che altro arbusti simili a quelli che si trovano in California, che, rispettando le specificità ecologiche, offrono diversi vantaggi. Oltre a recuperare carbonio contribuendo alla mitigazione del cambiamento climatico, infatti, la muraglia verde ha un impatto sulla sicurezza del territorio: attenua l'erosione del vento e riduce la frequenza e l'intensità delle tempeste di sabbia, proteggendo i terreni agricoli e le comunità circostanti. ""Con la giusta pianificazione e...",0.5769,0.5272,environmental change,west nile virus,high_climate,,,,,,
Italian,Italy,repubblica.it,newsapi,1263,https://www.repubblica.it/rubriche/invece-concita/2026/03/11/news/chiamiamoli_effetti_secondari_invece_concita_11_marzo_2026-425213078/,Chiamiamoli effetti secondari,"Come dice Pegah Moshir Pour non è la bomba che cade sulla raffineria, sull'impianto petrolifero, il vero danno. È quello che avviene dopo. È che noi siamo assuefatti alle immagini, allo skyline televisivo del fumo che si alza sull'orizzonte, al videogioco in bianco e nero delle immagini dal drone. Noi l'odore non lo sentiamo, a noi non si riempiono i polmoni di veleno. Non vediamo la nube che arriva in casa, non possiamo renderci conto. Eppure. Quel fumo acre, l'inquinamento che si produce riguarda anche noi. E non solo ora.

Anni fa un amico mi raccontò che dopo la Guerra del Golfo, dopo l'incendio dei pozzi del Kuwait nel deserto s'erano formati laghi di petrolio, oltre cento chilometri quadrati, laghi che la sabbia non assorbiva. L'Onu stanziò 50 miliardi di dollari per sanare il danno. Lui partecipava al progetto, ci lavoravano da anni per ripristinare le falde acquifere, evitare che il danno si propagasse al mare. Ma non bastava mai. Ora dicono che forse finiranno nel 2027. Saranno passati 36 anni, e intanto un'altra guerra è arrivata.

Non è la prima volta che accade, nel nostro tempo e nel nostro mondo, ma sembriamo ignorarlo. In una guerra chi vince e chi perde -- ci hanno sempre insegnato a pensare -- si conta con il numero di morti, vince chi resta in campo. Ma quale campo. La contaminazione dell'aria, dell'acqua e della terra non si può mai confinare a un solo luogo né a una sola generazione. Qualcuno sta valutando le conseguenze? Non solo per la popolazione di Teheran, per tutti.

È una guerra fatta per il petrolio, come tutte le ultime guerre, come quella paventata per la Groenlandia, ma il petrolio è la risorsa di un tempo alla fine. È una guerra per un bene che ha già provocato altre guerre, altrui morti, inquinamento globale e sta in definitiva uccidendo la terra e chi la abita. Forse la colonna di fumo di Teheran ci mostra che non si sta morendo per la libertà ma per avere un bene che ha già ucciso e uccide. È una battaglia di retroguardia voluta da chi ignora il futuro. Il nostro.",0.5817,0.5690,climate crisis,west nile virus,high_climate,,,,,,
Italian,Italy,repubblica.it,newsapi,2075,https://www.repubblica.it/green-and-blue/2026/03/03/news/anidride_carbonica_sangue_emissioni-425194905/,"Il cambiamento climatico è entrato nel nostro sangue, ed è un problema","Una nuova ricerca svela come alcuni marcatori indicano ora un aumento di anidride carbonica nel corpo umano con conseguenze future sconosciute. Gli scienziati: ""Fra 50 anni si potrebbero superare i limiti massimi""

Fin quando non siamo coinvolti in prima persona la crisi del clima ci appare qualcosa di distante, complessa da percepire. Conosciamo i suoi effetti devastanti legati ad esempio agli eventi meteo estremi, come la mortalità dovuta dalle ondate di calore, le alluvioni o la siccità, ma ciò che è meno noto è che ora il global warming sta modificando anche il nostro corpo. Il cambiamento climatico infatti ci è ormai ""entrato"" dentro, nel sangue. Un nuovo studio del Kids Research Institute Australia, della Curtin University e dell'Australian National University (ANU) pubblicato su Air Quality, Atmosphere and Health racconta infatti come l'aumento dei livelli di anidride carbonica nel mondo sia rilevabile anche nel corpo umano, più precisamente nel nostro sangue. Si tratta di livelli di CO2 ancora bassi ma che - avvertono gli scienziati - nel giro di cinquant'anni potrebbero andare oltre ai limiti di sicurezza per la nostra salute.

Gli esperti si sono concentrati su un marcatore importante, ovvero il bicarbonato sierico, che è strettamente legato all'anidride carbonica presente nell'organismo. Analizzando gli esami del sangue della popolazione degli Stati Uniti i ricercatori hanno scoperto che i livelli medi di bicarbonato sierico sono aumentati del 7% dal 1999 al 2020 e, nello stesso periodo, sono invece diminuiti quelli di calcio e fosforo. Lo studio si basa sulle analisi del sangue di circa 7.000 persone effettuate ogni due anni tra il 1999 e il 2020. Un periodo di oltre vent'anni in cui nel mondo, a forza di bruciare combustibili fossili e produrre emissioni climalteranti, è accaduta una cosa: la costante crescita delle emissioni di CO2. Quando sono iniziati gli esami, nel 1999, le parti per milione (ppm) di CO2 in atmosfera erano circa 369. Per dare un altro valore di riferimento, quando nel 2003 è nata Greta Thunberg, una delle paladine della lotta contro la crisi del clima, eravamo a 375 ppm. Oggi, nel 2026, le parti per milione sono intorno a 430. I cambiamenti osservati nel sangue con l'aumento del bicarbonato sierico rispettano questa tendenza, l'aumento costante dell'anidride carbonica. Esattamente come per i modelli climatici, che indicano scenari critici per il surriscaldamento globale entro fine secolo, i rischi legati all'aumento cumulativo di CO2 nel corpo umano saranno ""particolarmente rilevanti per i bambini e gli adolescenti"" di oggi. Più saranno esposti alla CO2, più aumenteranno i valori di bicarbonato sierico.

""Ciò a cui stiamo assistendo è un graduale cambiamento nella chimica del sangue che rispecchia l'aumento dell'anidride carbonica atmosferica che sta provocando il cambiamento climatico"" ha spiegato uno degli autori della ricerca, il professor Alexander Larcombe. Di fatto il bicarbonato sierico aiuta a regolare l'...",0.5451,0.4686,carbon dioxide,west nile virus,high_climate,,,,,,
