language,country,source,collection_method,article_id,url,title,content,climate_max_sim,health_max_sim,climate_best_keyword,health_best_keyword,sample_bucket,climate,health,health_climate_impact,climate_justification,health_justification,impact_justification
Italian,Italy,repubblica.it,newsapi,451,https://www.repubblica.it/cronaca/2026/03/18/news/consumo_cocaina_analisi_acque_reflue_italia_europa-425230361/,Bolzano supera Milano nel consumo di cocaina e canapa: così le acque reflue rivelano l'uso di droghe,"Diminuisce l'assunzione di ecstasy e aumenta invece quella della chetamina

Scoprire che tipo di droga viene usata in città, in quali giorni e in quali quantità attraverso le acque reflue è l'ultima frontiera, oltre ai dati sui sequestri di droga, per comprendere il business e il consumo delle sostanze stupefacenti. L'ultimo report ""Wastewater analysis and drugs, a European multi-city study"", pubblicato dal gruppo Score in collaborazione con l'Agenzia dell'Unione europea per le droghe (Euda) mostra un trend interessante. E cioè che Bolzano supera Milano per quanto riguarda il consumo di cocaina.

Secondo questo dato fornito dalla ricerca europea delle acque nere nei maggiori centri urbani - ovvero il più grande progetto europeo di monitoraggio delle droghe illegali nelle acque reflue - nel capoluogo altoatesino, dopo una lieve flessione nel 2025, il consumo di cocaina è nuovamente aumentato, come già negli anni precedenti. Ma stavolta l'aumento rende Bolzano la prima città italiana per consumo di polvere bianca.

Le giornate con la più alta concentrazione di questa sostanza nelle acque nere sono domenica, seguita da sabato e giovedì. Bolzano supera Milano anche per quanto riguarda l'uso di canapa, mentre il capoluogo lombardo stacca nettamente Bolzano per il consumo di anfetamine, metanfetamine, Mdma e ketamine.

In generale questo studio ha rilevato ""un netto calo"" del consumo di Mdma/ecstasy e un ""forte aumento"" dei casi di cocaina e chetamina. Il progetto ha analizzato campioni giornalieri di acque reflue per un periodo di una settimana, tra marzo e maggio 2025 in 115 città europee di 25 paesi (23 dell'Ue più Turchia e Norvegia) con l'obiettivo di indagare le abitudini di consumo di droga dei loro abitanti. In tutto il campione ha raccolto dati relativi a circa 72 milioni di persone per rilevare tracce di cinque droghe stimolanti (anfetamina, cocaina, metanfetamina, Mdma e chetamina), nonché di cannabis.

Il calo del consumo di ecstasy risulta più accentuato nelle città della Germania, Austria e Slovenia, mentre i livelli più elevati di residui di ecstasy sono stati registrati in Belgio, Spagna, Paesi Bassi e Slovenia. Per quanto riguarda la chetamina (il potente analgesico che provoca una sensazione di trance), i livelli rilevati sono aumentati di quasi il 41% tra il 2024 e il 2025 nelle città che hanno comunicato i dati. Per l'Italia - dove i risultati ottenuti a Bologna e Roma sono stati possibili grazie al finanziamento del Dipartimento Politiche Antidroga - va segnalato che i livelli di anfetamine risultano molto più bassi rispetto all'Europa settentrionale. Una tendenza comune, questa, ad altre città del Sud (per esempio a Cipro e in Turchia).",0.5435,0.5822,carbon emission,west nile virus,high_climate,,,,,,
Italian,Italy,repubblica.it,newsapi,2793,https://www.repubblica.it/green-and-blue/2026/02/25/news/energia_crisi_clima_appello_di_150_scienziati_ed_economisti_al_governo_per_ets-425182322/,"Decreto bollette, l'appello di 150 scienziati ed economisti al governo per il clima","Il premio Nobel per la fisica Giorgio Parisi e altri 150 studiosi, tra scienziati ed economisti, richiamano l'attenzione del governo sulla crisi climatica, chiedendo di rafforzare le misure di mitigazione (riduzione delle emissioni dei gas a effetto serra) e di adattamento (l'adeguamento delle infrastrutture alle conseguenze dell'innalzamento delle temperature). L'appello arriva dopo l'annuncio da parte di Palazzo Chigi del decreto legge ""bollette"", con la premier Giorgia Meloni che ha nei giorni scorsi chiesto una profonda revisione a livello europeo dell'Ets, il sistema di scambio delle emissioni, considerato uno degli strumenti cardine della politica climatica dell'Unione europea. Secondo i firmatari della lettera aperta, non c'è ""niente di più miope che attaccare il sistema Ets mentre l'Italia frana. Niscemi è la drammatica metafora di un intero Paese a rischio"".

""Limitarsi a rincorrere le emergenze senza ridurre con decisione le emissioni significa esporsi a impatti sempre più gravi e costosi. Senza mitigazione, l'adattamento diventa progressivamente meno efficace e, in alcuni casi, impossibile, afferma Antonello Pasini (CNR-IIA). Sarebbe inoltre ""un grave errore slegare il tema della competitività da quello della sostenibilità"".

""Innovazione e competitività sono oggi indissolubilmente legate alla decarbonizzazione"", conferma Carlo Carraro (Università Ca' Foscari Venezia). ""Ostacolare la transizione espone le imprese a rischi tecnologici e finanziari crescenti e rende il Paese meno competitivo. Accelerare sulle rinnovabili significa invece rafforzare sicurezza energetica e capacità industriale"".

della Presidente del Consiglio dei Ministri, On. Giorgia Meloni,

del Ministro dell'Ambiente e della Sicurezza Energetica, On. Gilberto Pichetto Fratin,

e del Governo,

Noi studiosi impegnati nella ricerca sul cambiamento climatico, sulle politiche di mitigazione e adattamento e sui sistemi complessi, esprimiamo profonda preoccupazione per il modo in cui il governo italiano sta affrontando la crisi climatica, in particolare per le recenti prese di posizione volte a indebolire i principali strumenti della politica climatica europea.

I recenti eventi estremi che hanno colpito vaste aree del Sud Italia con il passaggio del ciclone Harry non sono episodi isolati, ma segnali coerenti con quanto la comunità scientifica documenta da anni: un clima che cambia aumenta la frequenza e intensità degli eventi meteorologici estremi. Il disastro di Niscemi appare a molti come la drammatica metafora di un intero Paese a rischio. Non a caso, da anni l'ISPRA colloca l'Italia ai primi posti in Europa per l'esposizione al rischio di frane.

Gli anni 2024 (il più caldo dal 1880), 2023 e 2025 sono stati i tre anni più caldi mai registrati a livello globale, e gennaio 2026 è risultato il quinto gennaio più caldo della serie storica, confermando una tendenza al riscaldamento senza segnali di inversione. Non è pessimismo, ma realismo scientifico, ritenere che l'Italia d...",0.5499,0.4903,climate action,west nile virus,high_climate,,,,,,
Italian,Italy,repubblica.it,newsapi,91,https://www.repubblica.it/cronaca/2026/03/22/video/petroliera_russa_alla_deriva_le_ultime_immagini_di_sea-watch-425238736/,Petroliera russa alla deriva: le ultime immagini di Sea-Watch,"Ieri l'aereo da ricognizione di Sea-Watch, Seabird, ha sorvolato la metaniera Arctic Metagaz alla deriva a sud di Lampedusa e a rischio esplosione. Solo pochi giorni fa Malta aveva chiamato l'Italia per scongiurare il disastro ecologico nel Mediterraneo e ora, secondo una compagnia petrolifera statale del Paese nordafricano, sarà rimorchiata verso un porto libico. Sabato 21 marzo la National Oil Corporation (NOC) libica ha annunciato infatti che collaborerà con il gruppo italiano Eni per recuperare la nave naufragata. Come riporta il Times of Malta, la compagnia ha dichiarato di aver già adottato misure per ""ridurre il rischio di inquinamento"".

La nave, che porta con sé 700 tonnellate di gas naturale liquefatto, è stata bombardata, si presume, da droni ucraini e al momento non ha nessuno a bordo. E' quindi completamente fuori controllo, una mina vagante nel canale di Sicilia e, se esplodesse o avesse perdite, inquinerebbe una vasta area marina.",0.5383,0.6055,heatwave,west nile virus,high_health,,,,,,
Italian,Italy,repubblica.it,scrapai,20,https://www.repubblica.it/cultura/rubriche/lapsus/2026/03/08/news/lapsus_stefano_bartezzaghi_si_no-425206138/,Sì e No,"Sì e No di Stefano Bartezzaghi L'ascolto è riservato agli abbonati premium 08 Marzo 2026 alle 00:01 2 minuti di lettura Abbonati per leggere anche Leggi i commenti I commenti dei lettori Leggi anche Medici Discontinuità Diciamo Raccomandati per te Essere Jayson Tatum Le conseguenze del conflitto in Medio Oriente su petrolio, oro e azioni: tre scenari per i mercati Bollette del gas, la stangata iraniana sarà pagata da anziani e più fragili Cannibale e “fan di Trump”, una nuova biografia racconta Hannibal Lecter © Riproduzione riservata Rubriche Passaparola di Silvana Mazzocchi Chiude Passaparola, il saluto di Silvana Mazzocchi ai lettori Vedi tutte",0.5275,0.5771,extreme event,west nile virus,high_health,,,,,,
Italian,Italy,repubblica.it,newsapi,416,https://www.repubblica.it/esteri/2026/03/19/video/guerra_in_iran_lamerica_copia_teheran_ecco_i_droni_kamikaze_lucas-425231456/,"Guerra in Iran, l'America ""copia"" Teheran: ecco i droni kamikaze Lucas","Droni a basso costo, ispirati agli iraniani Shahed, utilizzati in sciami dall'esercito americano per distruggere le infrastrutture militari di Teheran. Si chiamano LUCAS (Low-Cost Unmanned Combat Attack System), e sono in uso da poche settimane.

Utilizzano il sistema Starshield, la versione militare di Starlink, per le comunicazioni e la guida, hanno un raggio d'azione stimato tra i 500 e i 1.000 chilometri e trasportano testate esplosive ad alto potenziale tra i 15 e i 25 chili.

Il punto di forza è proprio il prezzo contenuto, attorno i 30.000 dollari, che permette agli Stati Uniti di impiegarne a decine contemporaneamente per saturare le difese aeree nemiche

Leggi l'articolo",0.5084,0.5743,extreme event,west nile virus,high_health,,,,,,
Italian,Italy,repubblica.it,scrapai,213,https://www.repubblica.it/economia/2026/03/09/news/perche_petrolio_100_dollari_e_un_problema-425209024/,"Carburanti, prodotti più cari e tassi in rialzo: perché il petrolio a 100 dollari è un problema","Carburanti, prodotti più cari e tassi in rialzo: perché il petrolio a 100 dollari è un problema di Flavio Bini (reuters) Il rincaro di benzina e diesel rende i trasporti più cari, portando a rincari per i normali beni di consumo. Il rialzo dell’inflazione riduce il potere di acquisto e rallenta l’economia L'ascolto è riservato agli abbonati premium 09 Marzo 2026 Aggiornato alle 11:22 1 minuti di lettura Abbonati per leggere anche Leggi i commenti I commenti dei lettori Osservatori FTSE MIB 44.025 -0,29% Eur/Usd 1,1627 -0,08% Spread 76,51 Dati di mercato Leggi anche Aggirare Hormuz: i due oleodotti per bypassare lo stretto per il trasporto del petrolio Il Btp Valore sfiora il record del debutto: incassati 16 miliardi. E i tassi si alzano Anche Polymarket ha un limite: stop alle scommesse su una possibile esplosione nucleare Raccomandati per te Le conseguenze del conflitto in Medio Oriente su petrolio, oro e azioni: tre scenari per i mercati Bollette del gas, la stangata iraniana sarà pagata da anziani e più fragili Cannibale e “fan di Trump”, una nuova biografia racconta Hannibal Lecter “Miracolo a Milano”, Totò il buono spegne l’utopia di Zavattini © Riproduzione riservata Tutti gli Esperti Casa Fisco Pensioni Diritti e Consumi Lavoro Risparmio Ricerca Esperto Tutti gli esperti Casa Fisco Pensioni Diritti e Consumi Lavoro Risparmio Cerca",0.5722,0.5965,carbon emission,west nile virus,high_health,,,,,,
Italian,Italy,repubblica.it,scrapai,186,https://www.repubblica.it/economia/2026/03/09/news/passaggio_di_consegne_in_lidl_italia_una_direttrice_operation_ai_vertici_di_danone-425199911/,"Passaggio di consegne in Lidl Italia, una direttrice operation ai vertici di Danone","Passaggio di consegne in Lidl Italia, una direttrice operation ai vertici di Danone di Sibilla Di Palma L'ascolto è riservato agli abbonati premium 09 Marzo 2026 alle 08:00 2 minuti di lettura Abbonati per leggere anche Leggi i commenti I commenti dei lettori Osservatori FTSE MIB 44.025 -0,29% Eur/Usd 1,1627 -0,08% Spread 76,51 Dati di mercato Leggi anche Battistini (Allianz GI): “Nuove opportunità tra longevity e sovranità strategica europea” Pietrafesa (Allianz Bank Financial Advisors): “La consulenza oggi deve essere olistica” Foà (Algebris Investments): “Il credito globale resta un’opportunità, ma con più selezione” Raccomandati per te Le conseguenze del conflitto in Medio Oriente su petrolio, oro e azioni: tre scenari per i mercati Bollette del gas, la stangata iraniana sarà pagata da anziani e più fragili Cannibale e “fan di Trump”, una nuova biografia racconta Hannibal Lecter “Miracolo a Milano”, Totò il buono spegne l’utopia di Zavattini © Riproduzione riservata Tutti gli Esperti Casa Fisco Pensioni Diritti e Consumi Lavoro Risparmio Ricerca Esperto Tutti gli esperti Casa Fisco Pensioni Diritti e Consumi Lavoro Risparmio Cerca",0.5297,0.5807,extreme event,west nile virus,high_health,,,,,,
Italian,Italy,repubblica.it,scrapai,215,https://www.repubblica.it/esteri/2026/03/09/news/accusa_hrw_israele_proiettili_fosforo_bianco_libano-425209072/,L’accusa di Hrw: “Israele usa munizioni al fosforo bianco su aree residenziali in Libano”,"L’accusa di Hrw: “Israele usa munizioni al fosforo bianco su aree residenziali in Libano” dal nostro inviato Fabio Tonacci La foto che Hrw mostra come prova dei proiettili al fosforo Il dossier di Human Rights Watch sugli attacchi nel villaggio di Yohmor, nel sud del Paese. “Foto e comunicazioni dell’esercito, ecco le prove”. L’Idf. “Non confermiamo l’utilizzo di tali proiettili nel caso riportato”. 09 Marzo 2026 Aggiornato alle 17:24 1 minuti di lettura Abbonati per leggere anche Leggi i commenti I commenti dei lettori Leggi anche Libano, il leader Aoun vuole negoziare ma è sfida con Hezbollah Abagnara: “In Libano l’Unifil decisiva per evitare l’escalation. Gli italiani non andranno via” Iran, Mojtaba Khamenei è la nuova Guida suprema. Larijani: “Restiamo uniti” Raccomandati per te Essere Jayson Tatum “Miracolo a Milano”, Totò il buono spegne l’utopia di Zavattini Edoardo Pesce, l’artigiano del set: “La fama è ossessione, fare bene il proprio lavoro viene prima” Stefano Massini, il suo Putin è un evento tv. “La storia di un bambino nutrito da violenza e potere” © Riproduzione riservata",0.5379,0.6007,heatwave,west nile virus,high_health,,,,,,
Italian,Italy,repubblica.it,scrapai,252,https://www.repubblica.it/spettacoli/tv-radio/2026/03/09/news/pechino_express_2026_chanel_totti_in_viaggio_verso_l_oriente-425209810/,"Pechino Express, si riparte. Anche Chanel Totti in viaggio verso l’Oriente","Pechino Express, si riparte. Anche Chanel Totti in viaggio verso l’Oriente a cura della redazione Spettacoli Chanel Totti e Filippo Laurino sono I Raccomandati Dal 12 marzo su Sky la nuova edizione dello show condotto da Costantino della Gherardesca 09 Marzo 2026 alle 15:30 1 minuti di lettura Da giovedì 12 marzo in esclusiva su Sky e in streaming su Now riparte Pechino Express . Quest’anno il programma volerà dritto verso est, in una rotta dura e fra le più sorprendenti di sempre, attraversando Indonesia, Cina e Giappone: le coppie scopriranno Bali e Java , attraverseranno e si sorprenderanno nei territori cinesi e poi di corsa in direzione est, verso il Sol Levante, in Giappone, con destinazione finale Kyoto. Sarà una corsa imprevedibile, alla scoperta di un Estremo Oriente che mai come stavolta, per i viaggiatori, sarà davvero “estremo”. A condurre Costantino della Gherardesca , che per la prima volta nella storia dello show sarà accompagnato da ben tre inviati, uno per Paese: Lillo , Giulia Salemi, Guido Meda . Ecco i viaggiatori di quest’anno: Biagio Izzo e Francesco Paolantoni formano la coppia de Gli Spassusi, Chanel Totti e Filippo Laurino sono I Raccomandati, Jo Squillo e Michelle Masullo sono Le Dj, Fiona May e Patrick Stevens sono I Veloci, Dani Faiv e Tony 2Milli sono I Rapper, Steven Basalari e Viviana Vizzini sono Gli Ex, Tay Vines e Assane Diop sono I Comedian, Elisa Maino e Mattia Stanga sono I Creator, Candelaria e Camila Solórzano sono Le Albiceleste, Gaia De Laurentiis e Agnese Catalani sono Le Biondine . Come d’abitudine a Pechino Express , anche la corsa verso “l’Estremo Oriente” si svilupperà su un doppio binario: quello della competizione, per una gara che al traguardo dell’ultima tappa proclamerà la coppia vincitrice, e quello della scoperta , con i viaggiatori che avranno la possibilità di imparare e conoscere proprio dall’interno abitudini e tradizioni delle popolazioni incontrate sul proprio percorso nonché di esplorare luoghi geograficamente lontani e popoli culturalmente distanti da noi. Inoltre, anche quest’anno il premio finale sarà devoluto a sostegno di una ong che con i suoi volontari opera nei Paesi visitati durante il tragitto. Leggi i commenti I commenti dei lettori Video in evidenza 10 marzo 1946, alle urne senza rossetto: il primo voto delle donne in Italia Le schede dei film Serie TV, Drammatico - Spagna, 2022, 5x60’ Apagón Guarda subito Drammatico - Cipro, Germania, Grecia, Giordania, 2025, 145' Tutto quello che resta di te Guarda subito Commedia - Francia, 2024, 102' La famiglia Leroy Guarda subito Avventura, Fantasy - USA, 2025, 96' The Legend of Ochi Guarda subito Serie TV, Thriller - Francia, 2024, 6x50' Nell'ombra Guarda subito Drammatico - Croazia, Italia, Slovenia, 2025, 89' La ragazza del coro Guarda subito Serie TV, Crime, Thriller - Danimarca, Francia, 2019, 8x40’ DNA Guarda subito Serie TV, Thriller - Spagna, 2023, 6x50’ Memento Mori Guarda subito Drammatico - Francia, 2023, 91' Sconosciuti per ...",0.5347,0.5738,extreme event,west nile virus,high_health,,,,,,
Italian,Italy,repubblica.it,newsapi,1659,https://www.repubblica.it/esteri/2026/03/07/diretta/guerra_iran_usa_israele_news_oggi-425205332/,"Guerra in Iran, news di oggi. Usa: ""Ininfluente se Mosca aiuta Teheran"". I pasdaran minacciano l'Europa","La Casa Bianca minimizza sulla possibilità rilanciata dal Wp. I guardiani della rivoluzione: ""Chi si unisce all'aggressione diventa obiettivo sensibile"". In Libano colpiti caschi blu ghanesi: sono gravi

Ombre russe sul Medio Oriente. Per il Washington Post dietro alla rappresaglia iraniana contro le basi americane ci sarebbe Mosca. Un'opzione su cui la Casa Bianca ha minimizzato, dicendo che un'eventuale complicità ""non farebbe la differenza"". Dopo la telefonata tra Italia, Germania, Francia e Regno Unito sul coordinamento militare e la diplomazia comune da portare avanti, il viceministro degli Esteri di Teheran ha minacciato l'Europa: ""Chi si unisce all'aggressione diventa un obiettivo sensibile"".",0.5171,0.5838,extreme event,west nile virus,high_health,,,,,,
Italian,Italy,repubblica.it,scrapai,42,https://www.repubblica.it/esteri/2026/03/08/news/una_settimana_di_guerra_iran_armi_missili_usa_israele-425206799/,"Una settimana di raid: sull’Iran un diluvio di missili, gli Usa rinforzano l’Armada","Una settimana di raid: sull’Iran un diluvio di missili, gli Usa rinforzano l’Armada di Gianluca Di Feo (afp) Stati Uniti e Israele hanno scaricato sul Paese 10mila tra bombe e missili: è un record ma Teheran resiste. In arrivo la Bush: è la terza portaerei L'ascolto è riservato agli abbonati premium 08 Marzo 2026 alle 01:00 2 minuti di lettura Abbonati per leggere anche Leggi i commenti I commenti dei lettori Leggi anche Elicotteri e forze speciali: il piano sull’uranio che può valere la vittoria di Usa e Israele in Iran Sistemi di difesa destinati ai paesi del Golfo. Consiglio supremo al Quirinale L’arma diabolica dei pasdaran: testate cluster che nascondono una pioggia di granate assassine Raccomandati per te Essere Jayson Tatum Stefano Massini, il suo Putin è un evento tv. “La storia di un bambino nutrito da violenza e potere” Le conseguenze del conflitto in Medio Oriente su petrolio, oro e azioni: tre scenari per i mercati Bollette del gas, la stangata iraniana sarà pagata da anziani e più fragili © Riproduzione riservata",0.5202,0.5815,heatwave,west nile virus,high_health,,,,,,
Italian,Italy,repubblica.it,scrapai,51,https://www.repubblica.it/esteri/2026/03/08/news/john_lloyd_intervista_europa_usa_guerra_iran-425207140/,John Lloyd: “Finalmente il Vecchio Continente è diventato adulto”,"John Lloyd: “Finalmente il Vecchio Continente è diventato adulto” dal nostro corrispondente Antonello Guerrera John Lloyd L’editorialista britannico: “Giusto ribellarsi alla politica americana, ma serviranno altri dieci anni per una vera autonomia” L'ascolto è riservato agli abbonati premium 08 Marzo 2026 alle 02:51 2 minuti di lettura Abbonati per leggere anche Leggi i commenti I commenti dei lettori Leggi anche Walzer: “Trump è nei guai in Iran e vuole la exit strategy, la crisi energetica spaventa anche lui” Caso Epstein, Andrea trema: la sua ex assistente testimonierà Starmer e Macron, telefonate con la Casa Bianca. “Serve una soluzione diplomatica” Raccomandati per te Le conseguenze del conflitto in Medio Oriente su petrolio, oro e azioni: tre scenari per i mercati Bollette del gas, la stangata iraniana sarà pagata da anziani e più fragili Cannibale e “fan di Trump”, una nuova biografia racconta Hannibal Lecter “Miracolo a Milano”, Totò il buono spegne l’utopia di Zavattini © Riproduzione riservata",0.5406,0.5907,climate crisis,west nile virus,high_health,,,,,,
Italian,Italy,repubblica.it,newsapi,2995,https://www.repubblica.it/esteri/2026/02/24/diretta/guerra_ucraina_russia_news_oggi-425179365/,"Guerra Ucraina - Russia, le news di oggi. Esplosione a Mykolaiv: sette agenti feriti","Zaluzhnyi, ex capo dell'esercito, rivela la frattura con Zelensky

Primo colloquio tra Zelensky e il nuovo primo ministro dei Paesi Bassi Rob Jetten

""Mi sono congratulato con il Primo Ministro dei Paesi Bassi, Rob Jetten, per il suo insediamento e gli ho augurato successo"", ha dichiarato Zelensky, che ha ringraziato i Paesi Bassi e il popolo olandese per il forte sostegno all'Ucraina fin dall'inizio dell'invasione su vasta scala della Russia. I due leader hanno discusso delle esigenze più urgenti dell'Ucraina: missili per i sistemi di difesa aerea e equipaggiamento energetico.",0.5143,0.6025,climate crises,west nile virus,high_health,,,,,,
Italian,Italy,repubblica.it,newsapi,2428,https://www.repubblica.it/esteri/2026/02/28/diretta/guerra_ucraina_russia_news_oggi-425190205/,"Guerra Ucraina - Russia, le news di oggi. Zelensky sente Rutte: ""Pace dipende in larga parte dagli Usa""","Il presidente ucraino ha assicurato che il coordinamento tra Kiev e Nato proseguirà.

Il presidente Zelensky ha avuto un colloquio con il segretario generale della Nato, Mark Rutte, al quale ha riferito gli esiti degli ultimi incontri della delegazione di Kiev con la controparte americana e sui preparativi per un nuovo incontro trilaterale.

""È importante essere sinceramente impegnati a mettere fine a questa guerra e stiamo facendo tutto il possibile per riuscirci. Per molti aspetti, dipende proprio dagli Stati Uniti se la Russia sarà pronta a mettere fine al conflitto"", ha affermato Zelensky in un post su X.",0.4957,0.5725,climate crisis,west nile virus,high_health,,,,,,
Italian,Italy,repubblica.it,newsapi,1109,https://www.repubblica.it/esteri/2026/03/12/video/krasnodar_droni_ucraini_attaccano_deposito_di_petrolio_russo_esplosioni_e_incendi-425216480/,"Krasnodar, droni ucraini attaccano deposito di petrolio russo: esplosioni e incendi","Nella notte, droni hanno attaccato un deposito di petrolio nel distretto di Tikhoretsk, nella regione di Krasnodar, in Russia. Testimoni oculari hanno udito diverse esplosioni e un incendio è scoppiato nella struttura. Il quartier generale operativo russo ha spiegato l'incendio al deposito di petrolio come conseguenza della ""caduta di detriti da un drone"". L'area del rogo ha raggiunto i 150 metri quadrati e non si sono registrate vittime. Secondo i media, a prendere fuoco sarebbero stati i serbatoi di carburante appartenenti al punto di trasbordo Tikhoretsk-Nafta LLC. Il polo petrolifero di Tikhoretsk è uno dei più grandi punti di trasbordo di petrolio nella Russia meridionale, si trova nel Territorio di Krasnodar ed è gestito da Tikhoretsk-Nafta LLC, una sussidiaria di Transneft. Guerra Ucraina - Russia, le news di oggi",0.5181,0.5883,heatwave,west nile virus,high_health,,,,,,
Italian,Italy,repubblica.it,scrapai,27,https://www.repubblica.it/economia/2026/03/08/news/di_vincenzo_fegica_non_siamo_noi_gli_speculatori_ma_il_governo_ci_manda_la_guardia_di_finanza-425207009/,"Di Vincenzo (Fegica): “Non siamo noi gli speculatori, ma il governo ci manda la guardia di finanza”","Di Vincenzo (Fegica): “Non siamo noi gli speculatori, ma il governo ci manda la guardia di finanza” Roberto Di Vincenzo, presidente di Fegica Intervista al presidente dell’associazione dei gestori: “I prezzi vengono fissati dalle compagnie petrolifere” L'ascolto è riservato agli abbonati premium 08 Marzo 2026 alle 01:00 1 minuti di lettura Abbonati per leggere anche Leggi i commenti I commenti dei lettori Osservatori FTSE MIB 44.025 -0,29% Eur/Usd 1,1627 -0,08% Spread 76,51 Dati di mercato Raccomandati per te Essere Jayson Tatum Le conseguenze del conflitto in Medio Oriente su petrolio, oro e azioni: tre scenari per i mercati Bollette del gas, la stangata iraniana sarà pagata da anziani e più fragili Cannibale e “fan di Trump”, una nuova biografia racconta Hannibal Lecter © Riproduzione riservata Tutti gli Esperti Casa Fisco Pensioni Diritti e Consumi Lavoro Risparmio Ricerca Esperto Tutti gli esperti Casa Fisco Pensioni Diritti e Consumi Lavoro Risparmio Cerca",0.5263,0.5839,heatwave,west nile virus,high_health,,,,,,
