language,country,source,collection_method,article_id,url,title,content,climate_max_sim,health_max_sim,climate_best_keyword,health_best_keyword,sample_bucket,climate,health,health_climate_impact,climate_justification,health_justification,impact_justification
Hungarian,Hungary,blikk.hu,scrapai,1474,https://www.blikk.hu/eletmod/egeszseg/parlagfu-allergia-biztonsag/p24q7qh,"Túlságosan jól érzi magát a parlagfű Magyarországon, a 40 fokos aszájban is virul","Tetőzik a parlagfű pollen mennyisége a levegőben. A hét elejétől esőssé válik az idő, ez segíthet az allergiásokon?

– Átmenetileg kimossa a levegőből, de ha felszáradt és a szél is feltámad, újra szállni kezd.

Mennyien lehetnek érzékenyek a parlagfűre Magyarországon?

– Pontos adat nincs, de egymillió fölött lehetnek, és egyre csak növekszik a számuk.

Miért?

– Mert a parlagfű túlságosan jól érzi magát a klímánkon, nem is látom esélyét, hogy a következő 5-10 évben visszaszoruljon. Ha pedig mindenhol folyamatosan jelen van, a még egészséges emberi szervezet is folyamatosan találkozik vele, és ebből előbb-utóbb kialakulhat az allergia.

Ez nem egy olyan betegség, amivel születik az ember?

– Nem. Könnyen lehet, hogy akinek eddig soha semmi baja nem volt, jövőre hirtelen allergiássá válik. Növekszik az allergiások száma, évről évre egyre többen jelentkeznek orvosnál erős tünetekkel. De ha nem csinálnak célzott vizsgálatot, csak valószínűsíteni lehet, hogy a szénanáthát parlagfű okozza, hiszen ez a legagresszívabb allergén növény.

Csak a gyógyszer a megoldás?

– Nem, létezik célzott immunterápia is. A parlagfű fehérjét juttatják a szervezetbe és késztetik válaszra az immunrendszert. Háziorvostól is kérhető.",0.4835,0.5404,rising temperatures,hay fever,high_both,,,,,,
Hungarian,Hungary,magyarnemzet.hu,scrapai,11311,https://magyarnemzet.hu/sport/2024/02/nagy-visszaterokkel-keszul-a-valogatott-a-fontos-selejtezore,Nagy visszatérőkkel készül a válogatott a fontos selejtezőre,"Március 14–17. között Tatabányán rendezik a férfi kézilabdázók olimpiai selejtezőit. Magyarország Norvégiával, Portugáliával és Tunéziával szerepel egy csoportban , az első két helyezett jut ki a párizsi játékokra. Chema Rodríguez most erre a tornára hirdetett keretet. Mikler Roland 2004 óta tagja a nemzeti csapatnak. Fotó: Illyés Tibor A selejtező előtti hétvégén kezdődik a felkészülés – Mikler Roland tudására, tapasztalatára az előzetesen megbeszélteknek megfelelően az olimpiai selejtezőn természetesen számítunk, visszatér a csapatba – magyarázta Chema Rodríguez szövetségi kapitány a Magyar Kézilabda-szövetség honlapjának . – Rodríguez Pedro személyes okok miatt hagyta ki az Eb-t, most azonban csatlakozni tud hozzánk, ő jobbszélen, Máthé Dominik hiányában akár jobbátlövőben és nyitott védekezésben is hasznos tagja lehet a csapatnak. A felkészülést a selejtező előtti hétvégén kezdjük; sok időnk nem lesz, de ezzel nyilván az ellenfeleink is így vannak, a lehető legoptimálisabban kell majd kihasználnunk azt a néhány napot, hogy Tunézia, Norvégia és Portugália ellen is eredményesek tudjunk lenni. A magyar keret az olimpiai selejtezőre Kapusok: MIKLER Roland (OTP Bank-Pick Szeged), BARTUCZ László (Mol Tatabánya KC), PALASICS Kristóf (Logrono La Rioja, spanyol) Jobbszélsők: KRAKOVSZKI Zsolt (HSA-NEKA), IMRE Bence (FTC-Green Collect), RODRÍGUEZ ALVAREZ Pedro (Mol Tatabánya KC) Jobbátlövők: ANCSIN Gábor (Mol Tatabánya KC), ILIC Zoran (Hamburg, német) Irányítók: LÉKAI Máté (FTC-Green Collect), HANUSZ Egon (TvB Stuttgart, német), FAZEKAS Gergő (Orlen Wisla Plock, lengyel) Beállók: BÁNHIDI Bence (OTP Bank-Pick Szeged), ROSTA Miklós (CS Dinamo Bucuresti, román), SZÖLLŐSI Szabolcs (Dabas KC), SIPOS Adrián (MT Melsungen, német) Balátlövők: BODÓ Richárd (OTP Bank-Pick Szeged), LIGETVÁRI Patrik (Telekom Veszprém), SZITA Zoltán (OTP Bank-Pick Szeged) Balszélsők: BÓKA Bendegúz (Balatonfüredi KSE), KRAKOVSZKI Bence (Mol Tatabánya KC) A 35 fős keret további tajgai: Kapusok: ANDÓ Arián (Balatonfüredi KSE), SZÉKELY Márton (Mol Tatabánya KC), NAGY Martin (OTP Bank-Pick Szeged)",0.4741,0.5471,extreme event,west nile virus,high_both,,,,,,
Hungarian,Hungary,blikk.hu,scrapai,1316,https://www.blikk.hu/eletmod/egeszseg/nebih-energiaital-egeszseg-koffein/8dgf2sc,Fontos bejelentést tett a Nébih az energiaitalokkal kapcsolatban,"A Nébih emellett megerősítette, hogy egy egészséges felnőtt naponta akár 400 mg koffeint is fogyaszthat biztonságosan – ez körülbelül öt doboz (250 ml-es) energiaital koffeintartalmának felel meg. Fontos hangsúlyozni, hogy az energiaitalok felnőtteknek készülnek, gyermekeknek pedig semmi nem ajánlott, ami koffeint tartalmaz: kávé, energiaital és kóla sem.

A Nébih szakemberei nemcsak a termékek összetevőit és koffeintartalmát ellenőrizték, hanem a termékjelöléseket is, különös tekintettel azokra az apróbetűs részekre is, amelyeket a fogyasztók gyakran észre sem vesznek. A feltárt jelölési hibák kijavítására azonnal kötelezték a gyártókat, és szükség esetén büntetéseket is kiszabtak.

A MESZ örömmel látja, hogy az energiaitalok megfelelnek a szigorú hazai és nemzetközi előírásoknak és továbbra is együttműködik a hatóságokkal a termékek minőségének fenntartása és szakmai információk szolgáltatása érdekében.",0.5001,0.5786,extreme heat,undernourishment,high_both,,,,,,
Hungarian,Hungary,magyarnemzet.hu,scrapai,22389,https://magyarnemzet.hu/kulfold/2025/11/sorkotelezettseg-torveny-nemetorszag,Itt a bejelentés a német sorkatonaságról,"A törvényt Boris Pistorius védelmi miniszter (SPD), valamint a kormányzó szociáldemokraták és a kereszténydemokraták frakcióvezetői, Matthias Miersch és Jens Spahn dolgozták ki. A cél a Bundeswehr létszámának jelentős növelése, különösen a keleti határ menti biztonsági kockázatok és a NATO új védelmi tervei miatt, írta a Die Welt. Matthias Miersch (jobbra), az SPD parlamenti frakcióvezetője és Boris Pistorius (SPD), szövetségi védelmi miniszter az SPD parlamenti frakciójának sorkötelezettségről szóló Bundestag-ülésén (Fotó: dpa Picture-Alliance/AFP/Kay Nietfeld)",0.4877,0.5422,heatwave,west nile virus,high_both,,,,,,
Hungarian,Hungary,magyarnemzet.hu,scrapai,17723,https://magyarnemzet.hu/lugas-rovat/2022/07/bibliai-merteku-aszaly-sujtja-az-alfoldet,Bibliai mértékű aszály sújtja az Alföldet,"Eddig mintegy háromszázezer hektárnyi kukorica és kétszázezer hektárnyi napraforgó ment tönkre a régiót ­sújtó aszály miatt Magyarországon. A klímaváltozás erődemonstrációt tart a földeken, ráadásul éppen olyan évben viszi el a termés jelentős részét, amikor az árak kifejezetten magasra szöktek, és az ukrajnai piac kiesésével a kereslet is megnőtt. Csupán az említett két növénynél mintegy négyszázmilliárd forint a kiesés, és nemcsak a mennyiség, de a minőség terén sem rózsás a helyzet. A csapadékeloszlás miatt a szántóföldi terméseket tekintve kettészakadt az ország: míg a Dunántúlon közepes vagy jó a termés, az Alföldön tombol a szárazság. Feldman Zsolt mezőgazdaságért és vidékfejlesztésért felelős államtitkár szerint már most tisztán látható, hogy noha az őszi búza és a repce teljes vetésterületének még csak az egyharmadát takarították be a gazdák, az előző évekhez képest jóval gyengébb termésmennyiség várható: – A munkálatok 1,6 millió hektárra terjednek ki, ebből 932 ezer hektár az őszi búza, 313 ezer az őszi árpa, 205 ezer a repce. A búzatermést egyelőre nehéz megbecsülni, de az elmúlt öt év átlagához képest több mint harmincszázalékos lehet a hozamcsökkenés. A termésátlagok között az időjárási hatások miatt jelentős, több mint kétszeres különbség is lehet megyénként, az eddigi átlag 3,6 tonna hektáronként. A repce termésmennyiségének visszaesése a korábbi évekhez képest negyven-ötven százalék. Az őszi árpa betakarítása körülbelül 1,4 millió tonnával zárult, a hektáronkénti átlag 4,5 tonna, de a búzá­hoz hasonlóan nagy az eltérés térségenként – sorolja az államtitkár, hozzátéve, hogy a termelők eddig 322 ezer hektárra jelentettek be aszálykárt. Feldman Zsolt kihangsúlyozza, a jelenlegi eredmények ismereté­ben ez a búzamennyiség a hazai felhasználást (2,5 millió tonna) kielégíti, ugyanakkor várhatóan idén mindössze egymillió tonna alatti exportárualap képződik, ezért az Agrárminisztérium folyamatosan monitorozza a gabonakivitelt a hazai ellátás érdekében. A 12,5 milliárd forintos kárenyhítési alap bővítéséről a bejelentési időszak végeztével születhet döntés.",0.4738,0.5373,rising temperatures,undernourishment,high_both,,,,,,
Hungarian,Hungary,magyarnemzet.hu,scrapai,8223,https://magyarnemzet.hu/belfold/2022/07/miert-volt-szukseges-energia-veszelyhelyzetet-hirdetni,Miért volt szükséges energia-veszélyhelyzetet hirdetni?,"Hozzátette: a nyugati politikusok részéről erősek a félelmek aziránt, hogy a tíznapos karbantartás után nem fogja újraindítani a szállításokat a Gazprom, így Németországnak és az Európai Uniónak – hiszen ezek a piacok szorosan összekapcsoltak – egy általános gázhiányos állapottal kell majd szembenéznie. Hortay szerint a magyar kormány időben lépett, és minden erejével azon dolgozik, hogy támogassa a magyarokat. A kormány energia-veszélyhelyzetet hirdetett és hét pontból álló intézkedési tervet fogadott el, ennek részeként 2022. augusztus 1-jétől a rezsicsökkentett gáz- és áram árát csak a lakossági átlagfogyasztás mértékéig biztosítja. Hortay Olivér, a Századvég Konjunktúrakutató Zrt. energetikai üzletágának vezetője az Origó azon kérdésére, miszerint miért fontos, és mi a célja ennek az újabb intézkedésnek, miközben Németországban energia-veszélyhelyzet van, azt válaszolta, hogy egy hónappal ezelőtt az európai energiapiac helyzete nagyot fordult. Addig az elsődleges kérdést az jelentette, hogy mekkora költséggel lehet energiához jutni az európai piacon, ezzel szemben mostanra az elsődleges kérdés már az, hogy lesz-e egyáltalán gáz, amivel a háztartások és az ipari szereplők fűteni tudnak.",0.5068,0.5548,climate crisis,undernourishment,high_both,,,,,,
Hungarian,Hungary,magyarnemzet.hu,scrapai,15646,https://magyarnemzet.hu/gazdasag/2023/01/az-unio-uj-kiszolgaltatottsaganak-uj-koltsegei-lesznek-video,Az unió új kiszolgáltatottságának új költségei lesznek + videó,"A palaforradalom és az orosz–ukrán háború újra a globális energiapolitikai hierarchia csúcsára repítette Amerikát. A kérdés már csak az, hogy képes lesz-e megtartani a pozícióját. A helyzetről és a kilátásokról Hortay Olivér, a Századvég klíma- és energiapolitikai üzletágának vezetője beszélt a közösségi oldalán. Barack Obama korábbi energiapolitikai főtanácsadója szerint a közelmúltban lezajlott energiapiaci folyamatok a geopolitikai tabella élére repítették az Egyesült Államokat. Amerika olajexportjának drasztikus növekedését a palaolaj-forradalom tette lehetővé. Az elmúlt tíz évben az amerikai befektetők elképesztő mennyiségű pénzt fektettek a technológiába, de a háború kirobbanásáig kérdéses volt, hogy a beruházások megtérülnek-e. A repesztéses olajkitermelés drágább a hagyományos megoldásoknál, ezért a 2014-es olajáresés, valamint a koronavírus-járvány számos palaolaj-vállalatot csődbe juttatott. – A háborúval a helyzet gyökeresen megváltozott. A nyugati szankciók piacot nyitottak az amerikai cégek előtt, amit más nagy kitermelők csak korlátozottan töltenek be. Az, hogy az Egyesült Államok meghatározó exportőrré vált, nagy geopolitikai lehetőség. A hiány az európai piacon várhatóan tovább növekszik majd, és Joe Biden amerikai elnök szeretné, ha annak lehető legnagyobb részét Amerika fedné le, és ezzel még inkább magához láncolná az öreg kontinenst. Az elnök ezért – korábbi környezetvédelmi aggályait felrúgva – mindent megtesz, hogy rávegye vállalatait a kitermelés fokozására – magyarázta a szakértő.",0.5162,0.5647,climate crisis,west nile virus,high_both,,,,,,
Hungarian,Hungary,magyarnemzet.hu,scrapai,17582,https://magyarnemzet.hu/kulfold/2024/01/csernobilhoz-hasonlo-katasztrofa-johet,Csernobilhoz hasonló katasztrófa jöhet?,"A zaporizzsjai atomerőművet lekapcsolták a külső áramellátásról − közölte hétfőn a létesítmény oroszok által kinevezett tisztviselője. Vlagyimir Rogov szerint az erőművet készenléti és vészhelyzeti ellátásra kapcsolták át − közölte az MTI. Az Enerhoatom atomerőműveket üzemeltető ukrán állami vállalat hétfőn arról tájékoztatott, hogy áramkimaradás volt az atomerőműben a külső áramvezeték ágyúzása miatt. − Ez volt a hetedik áramszünet az erőműben az Oroszország által Ukrajna ellen indított háború kezdete óta − mondta el az Enerhoatom illetékese. Jurij Malasko, az ukrajnai Zaporizzsjai megye kormányzója arról számolt be, hogy Zaporizzsja egyik létesítményében tűz ütött ki az energiarendszer túlterhelése miatt. Malasko azonban hozzáfűzte: a Zaporizzsjában felmerült energiaellátással kapcsolatos problémáknak nem volt közük az ágyúzáshoz. Rafael Grossi, a Nemzetközi Atomenergia-ügynökség főigazgatója múlt héten arra figyelmezetetett, hogy ezek az incidensek súlyos nukleáris katasztrófákhoz vezethetnek. A zaporizzsjai atomerőmű körüli helyzet egyre kiszámíthatatlanabbá és veszélyesebbé válik − szögezte le Grossi. Az Enerhoatom igazgatója ezzel kapcsolatban arra figyelmezetett: amennyiben a szivattyúk leállnak, úgy a reaktorok leolvadásának ideje kilencven perc és három nap közé tehető, mivel a tartalék generátorokat már túl sokszor kellett bekapcsolni a háború kitörését követően. Ez a csernobili tragédiához hasonló katasztrófát eredményezhet − hangsúlyozta. A zaporizzsjai atomerőmű néhány kilométerre található a Zaporizzsja megyei Enerhodar városától. Ez Európa legnagyobb atomerőműve. Tavaly február végén, röviddel az Ukrajna elleni orosz háború kezdete után az orosz erők ellenőrzésük alá vonták. Október végén Vlagyimir Putyin orosz elnök rendeletileg orosz szövetségi tulajdonba vette. Borítókép: Az orosz védelmi minisztérium sajtószolgálata által közreadott, videófelvételrõl készült kép az orosz ellenõrzés alatt álló zaporizzsjai atomerőműről a délkelet-ukrajnai Enerhodarban 2022. augusztus 7-én (Fotó: MTI/EPA//Orosz védelmi minisztérium sajtószolgálata)",0.4904,0.5463,heatwave,west nile virus,high_both,,,,,,
Hungarian,Hungary,magyarnemzet.hu,scrapai,19861,https://magyarnemzet.hu/english/2025/07/tamas-sulyok-sends-condolence-letter-to-family-of-transcarpathian-hungarian-who-was-beaten-to-death,Tamas Sulyok Sends Condolence Letter to Family of Transcarpathian Hungarian Who Was Beaten to Death,"Tamas Sulyok, the President of Hungary, expressed his condolences in a letter to the family of the Hungarian man from Transcarpathia who was beaten to death by Ukrainians during forced conscription. We publish the English translation of the letter in its entirety: “Dear Grieving Family, It is with deep shock that I learned of the death of your son, Jozsef Sebestyen Jr. It is an unnatural state of affairs when a parent must bury their child. No one can imagine the profound pain that a grieving mother and father may feel. I was utterly horrified by what I heard about the circumstances leading to your son's death. Such a thing cannot happen in Europe; it completely contradicts all human values represented by our much-tried continent, values that European nations have consistently adopted as their own for centuries. Every single Hungarian life is of unique value to our nation, and the loss of every Hungarian in the prime of their life is therefore also a national tragedy. Beyond the natural bond that connects us as Hungarians, we are also united by an inner command to take responsibility for one another. Our Hungarian communities, wherever they may live in the Carpathian Basin or around the world, can always count on each other. The loss of one is a loss for all of us. On behalf of every Hungarian, please accept my sincere condolences. We stand with you during this difficult time. May God rest your son’s soul!” Cover photo: Tamas Sulyok, the President of Hungary (Source: Facebook)",0.5114,0.5337,changing climates,deaths,high_both,,,,,,
Hungarian,Hungary,magyarnemzet.hu,scrapai,14907,https://magyarnemzet.hu/english/2023/07/migrants-fire-shots-from-automatic-weapons-near-hungarian-border,Migrants fire shots from automatic weapons near Hungarian border,"Yet another shoot-out took place near the Serbia-Hungary border on Friday night. This time again locals in Hajdukovo (Hajdujaras) most clearly heard the shoots being fired near the village. In their posts on social media, locals wrote they are shooting again, you can hear migrants and people smugglers shooting at each other in the distance. The gunshots fired by migrants were heard not only in Hajdukovo, but also in surrounding villages, as confirmed by people in the Facebook group of locals. According to reports, several rounds of shots were heard in the village, situated only a few kilometres far from the Hungarian border. The shooting started near the local landfill in the early hours of the night. Several people wrote that despite significantly increased police presence in the village where mainly Hungarians live, police continue to bring back dozens of migrants during the night in the early evening, pointing out that authorities fail to take action swiftly enough after receiving reports from locals. Pannon Radio and Television, based in Subotica (Szabadka), also reported on Friday night's shootings. A video was also posted on its website, showing footage taken by a surveillance camera. In the recording, rounds of shots can be clearly heard, fired from automatic weapons presumably by migrants and smugglers, in the immediate vicinity of residential areas. Several gangs of migrants marched though the streets of Hajdukovo, Pannon TV reported on its website. Several shoot-outs between migrant gangs took place in Hajdukovo in recent days. As Magyar Nemzet previously reported , one of the incidents ended in death and injuries. No local residents died or were injured in the clashes.",0.5063,0.5517,climate emergencies,casualties,high_both,,,,,,
Hungarian,Hungary,magyarnemzet.hu,scrapai,14993,https://magyarnemzet.hu/kulfold/2023/06/tizmilliardokat-ker-brusszel-miutan-ukrajna-miatt-kiurult-az-unios-kassza,"Tízmilliárdokat kér Brüsszel, miután Ukrajna miatt kiürült az uniós kassza","Reagált Dömötör Csaba, a Miniszterelnöki Kabinetiroda parlamenti államtitkára arra a brüsszeli tervre, miszerint az uniós tagállamok a következő négy évben összesen 50 milliárd euró segélyt nyújtanának Ukrajnának vissza nem térítendő támogatás és hitel formájában az ország újjáépítése céljából. A tervezetet az Európai Bizottság elnöke, Ursula von der Leyen mutatta be kedden. Az Európai Bizottság pénzt kér a tagországoktól. Tehát úgy állunk, hogy a háború és Ukrajna finanszírozása miatt kiürült az uniós kassza, ezért több tíz milliárd eurót kell beletolni pluszban az uniós költségvetésbe – mutatott rá Dömötör Csaba. Az államtitkár ismertette, mire költené Brüsszel a milliárdokat: „Először is, és ez a legnagyobb összeg, Ukrajna további finanszírozására. Ez 50 milliárd euró lenne, ami körülbelül 18 ezer milliárd forint. Aztán fedezni kellene az elszállt kamatterheket. Erre is kell plus forrás, mint ahogy a brüsszeli bürokraták inflációval növelt fizetésére is” – fogalmazott Facebook-oldalán közzétett videójában. Hangsúlyozta, „lényeges körülmény, hogy az uniós költségvetés módosításához egyhangúságra van szükség, tehát minden tagállam beleegyezésére szükség van”.",0.4755,0.5455,climate crises,undernourishment,high_both,,,,,,
Hungarian,Hungary,magyarnemzet.hu,scrapai,1301,https://magyarnemzet.hu/kulfold/2025/06/iran-beismeres-fordo,Irán beismerést tett,"A támadások nemcsak katonai cselekménynek minősülnek, hanem a nemzetközi jog megsértésének is – jelentette ki az ország külügyminisztériuma. Irán atomlétesítményeit támadta az Egyesült Államok (Fotó: AFP) Irán hivatalosan is megerősítette, hogy az Egyesült Államok június 22-i légitámadásai súlyosan megrongálták nukleáris létesítményeit. Ismael Baghai, az iráni külügyminisztérium szóvivője szerint az ország nukleáris létesítményei „súlyosan megrongálódtak” – írta a Bloomberg. Szerinte a támadások nemcsak katonai cselekménynek minősülnek, hanem a nemzetközi jog és a nukleáris fegyverek elterjedésének megakadályozásáról szóló szerződés megsértésének is. Tehran has acknowledged damage caused by US strikes on its nuclear facilities that took place over the weekend https://t.co/JrSLSO5aOm — Bloomberg (@business) June 25, 2025",0.4805,0.5354,extreme event,west nile virus,high_both,,,,,,
Hungarian,Hungary,magyarnemzet.hu,scrapai,17592,https://magyarnemzet.hu/kulfold/2023/09/nagytakaritas-kijevben-kisoportek-az-ukran-vedelmi-miniszteriumot,Nagytakarítás Kijevben: kisöpörték az ukrán védelmi minisztériumot,"Olekszij Reznyikov leváltását követően folytatódik a nagytakarítás az ukrán védelmi minisztériumban. Az Ukrinform hírportál beszámolója szerint hétfőn hat miniszterhelyettestől váltak meg a tárcánál, név szerint Vologyimir Gavrilov, Hanna Majlar, Rosztyiszlav Zamlinszki, Denisz Sarapov, Vitalij Deljnega és Andrij Sevcsenko távozott posztjáról. Tarasz Melnyicsuk, a miniszterek tanácsának állandó képviselője közlése szerint menesztették továbbá Konstantin Vascsenkót, aki államtitkári pozíciót töltött be a minisztériumnál. The Cabinet of Ministers of #Ukraine has dismissed all deputy defense ministers and the state secretary of the ministry. Anna Malyar, the chief speaker of the department, was also dismissed. pic.twitter.com/joHXVRKDv2 — NEXTA (@nexta_tv) September 18, 2023 Olekszij Reznyikovot még szeptember elején váltotta le a parlament Volodimir Zelenszkij kérésére . Úgy vélem, hogy a tárcának az együttműködés új megközelítéseire és más formáira van szüksége mind a katonákkal, mind összességében a társadalommal. A minisztériumot most Rusztem Umerovnak kell vezetnie. A Legfelsőbb Tanács jól ismeri őt, és Rusztem Umerovnak nincs szüksége további bemutatásra. Azt várom a parlamenttől, hogy támogassa ezt a jelölést − fogalmazott akkor az ukrán elnök. Reznyikov 2021 óta vezette a tárcát, azonban a háború kirobbanását követően rengeteg vád érte minisztériumát, többek közt a nyugati katonai támogatások kezelése miatt. Ezek több jelentés szerint sem mindig értek célba, más esetekben túlárazottan vásároltak silány minőségű termékeket. A korrupciós botrányokba belebukott miniszter szerint a vádak hamisak, céljuk pedig a tárca befeketítése volt. A Mandiner összegzése szerint a politikus menesztésének indokai között felröppentek azok a hírek is, hogy a CIA avatkozott közbe Kijevnél a korrupció miatt. Más meglátások szerint Reznyikov londoni nagykövet lehet, ez a pozíció ugyanis idén július 23-a óta betöltetlen. Egy kevésbé optimista híresztelés szerint ugyanakkor az ellentámadás sikertelenségét akarták leverni a politikuson, aki több mint 550 napig töltötte be a védelmi miniszteri posztot. Ukrajna védelmi miniszteri posztját 2023. szeptember 4-e óta Rusztem Umerov tölti be. Borítókép: Volodimir Zelenszkij ukrán elnök a NATO–Ukrajna Tanács ülése után tartott sajtóértekezleten a NATO vilniusi csúcstalálkozójának második napján, 2023. július 12-én (Fotó: MTI/EPA/Toms Kalnins)",0.4757,0.5522,climate crisis,west nile virus,high_both,,,,,,
