language,country,source,collection_method,article_id,url,title,content,climate_max_sim,health_max_sim,climate_best_keyword,health_best_keyword,sample_bucket,climate,health,health_climate_impact,climate_justification,health_justification,impact_justification
Korean,Korea,hani.co.kr,scrapai,291,https://www.hani.co.kr/arti/international/arabafrica/1248264.html,이란 “6개월 고강도 전쟁 가능”…미 ‘우라늄 확보’ 특수부대 투입 논의,"미국과 이스라엘이 8일(현지시각) 이란 석유 저장시설과 전투기 등 이란 전역에 공습을 퍼부었다. 도널드 트럼프 미국 대통령이 7일 트루스소셜에 “오늘 이란은 매우 강력한 타격을 입을 것”이라고 경고한 직후다. 이란 대통령은 주변국 공격을 사과했지만, 이란 혁명수비대는 처음으로 중동 국가의 해수담수화 시설에 대한 보복 공격을 감행했고, “최소 6개월간 고강도 전쟁을 지속할 능력이 있다”고 주장했다.
로이터·아에프페(AFP) 통신 등 보도를 보면, 미국과 이스라엘은 7일 밤부터 8일 새벽 이란 테헤란과 알보르즈 등의 석유 저장시설 4곳을 타격해, 대형 화재가 발생하고 4명이 숨졌다. 이란의 민간 산업시설이 공격받은 것은 처음이다. 이스라엘은 7일 이란의 이스파한 공항을 공격해 F-14 전투기 여러대를 파괴하는 등 이란 전역을 공습했다고 밝혔다. 이스라엘은 지난 1일 레바논의 친이란 민병대 헤즈볼라에 대한 공격을 재개한 이후 처음으로 레바논 수도를 공격해, 베이루트 중심가의 호텔이 공습 피해를 입고 4명이 숨졌다.
마수드 페제슈키안 이란 대통령은 7일 주변 중동 국가들에 대한 공격을 사과하며 이를 중단하겠다고 밝혔지만, 이란 혁명수비대는 공격 수위를 낮추지 않았다. 사과 수시간 뒤 혁명수비대는 자국 무인기가 아랍에미리트 아부다비 다프라 공군기지에 있는 미군 공중전투센터를 타격했다고 밝혔다. 같은 날 아랍에미리트 두바이 국제공항에서 무인기가 폭발하며 공항이 한동안 폐쇄됐다. 쿠웨이트에서는 8일 국제공항에 있는 연료탱크가 무인기의 공격을 받았고, 국경수비대원 2명이 사망했다. 사우디아라비아는 7~8일 샤이바 유전지대를 향해 날아오던 17대의 무인기를 격추했다.
이란은 해수담수화 시설에 대한 공격도 처음으로 감행했다. 바레인의 해수담수화 시설이 8일 이란 무인기의 공격을 받았다. 바레인은 상수원의 90% 이상을 바닷물을 정수해서 사용하고 있다. 이란은 전날 바레인의 미 공군기지에서 시작된 공격이 케슘섬의 담수화 시설을 타격했다며 이에 대한 보복이라고 밝혔다. 이란 혁명수비대는 8일 “최소 6개월간 고강도 전쟁을 지속할 능력이 있다”며 중동 전역의 미국과 이스라엘에 관련된 “200곳 이상의 지점을 표적으로 삼고 있으며, 그동안 적게 사용한 진보된 장거리 미사일을 사용할 것”이라고 경고했다.
미 매체 액시오스는 미국과 이스라엘이 이란의 60% 고농축 우라늄 450㎏을 확보하기 위해 특수부대를 이란에 투입하는 방안을 논의했다고 보도했다. 트럼프 대통령은 7일 전용기에서 지상군 투입 가능성을 두고 “가능성은 있을 수 있지만 매우 정당한 이유가 있어야 한다”며 “만약 그렇게 된다면 이란은 이미 너무 큰 피해를 입어 지상전에서 싸울 능력도 없을 것”이라고 주장했다.
김지훈 기자, 워싱턴/김원철 특파원 watchdog@hani.co.kr",0.3124,0.3799,ozone depletion,west nile virus,borderline,,,,,,
Korean,Korea,hani.co.kr,scrapai,43,https://www.hani.co.kr/arti/area/yeongnam/1248222.html,소형모듈원자로 시장 선점에 나선 부산시…지원센터 국내 첫 착공,"부산시가 틈새시장으로 떠오르고 있는 소형모듈원자로 시장에 뛰어들었다.
부산시는 “9일 부산 강서구 미음알&디산업단지에서 소형모듈원자로(SMR. Small Modular Reactor) 보조기기 제작지원센터 착공식을 연다”고 8일 밝혔다.
소형모듈원자로 보조기기 제작지원센터는 터 면적 4000㎡, 연면적(건축물 각 층 바닥면적을 모두 더한 총면적) 2308㎡, 지상 2층이다. 사업비는 국비 97억원(33%)과 부산시 예산 186억원(63%), 민간자본 12억원(4%) 등 295억원이다. 내년 5월 완공하고 2028년 12월까지 핵심 장비 열두 종류를 구축한다.
소형모듈원자로 보조기기 제작지원센터가 완공되면 한국기계연구원이 운영하고 부산테크노파크는 시제품 제작과 기업 애로기술 지원, 한국해양대는 현장 맞춤형 인재양성 교육프로그램 개발과 운영, 한국원자력기자재협회는 세계시장 판로 개척을 돕는 온·오프라인 유통망(플랫폼) 개발에 나선다. 정부·자치단체·대학·연구기관·원전업계 등 5자가 소형모듈원자로 시장에 뛰어들려는 지역 중소업체를 거들려는 것이다.
소형모듈원자로는 발전 용량이 100~300㎿다. 1000~1400㎿인 대형원전의 3분의 1~14분의 1이다. 공장에서 부품을 직접 만든 뒤 현장에서 조립이 가능해 건설기간이 4~5년인 대형원전에 견줘 절반에 불과하고 필요한 터와 초기 건설비용이 적다. 방사성물질을 대량 발생시키는 노심의 손상빈도가 10억년당 한차례여서 10만년당 한차례인 대형원전에 견줘 안전하다. 방사성물질이 유출됐을 때 안전한 곳으로 대피해야 하는 방사선비상계획구역도 300m다. 대형원전은 16~30㎞다. 대형원전은 전력 생산이 주요 목적이지만 소형모듈원자로는 전력수요가 낮은 지역 전력 공급과 산업공정 열 공급, 수소 생산, 지역난방, 담수 활용 등이 목적이다.
부산시는 자금과 장비 부족에 경쟁력이 낮은 지역 중소기업을 지원하기 위해 2021년 11월부터 소형모듈원자로 보조기기 제작지원센터를 추진했다. 2024년 4월 기후에너지환경부 ‘소형모듈원자로 제작지원센터 구축사업’ 공모에서 경남·경북과 함께 선정됐다. 이후 건설설계 공모, 기본·실시설계, 시공사 선정 등 행정절차를 서둘렀고 경남·경북보다 한발 앞서 소형모듈원자로 보조기기 제작지원센터 착공에 이르렀다.
김광수 선임기자 kskim@hani.co.kr",0.3531,0.3562,co2 emission,west nile virus,borderline,,,,,,
Korean,Korea,hani.co.kr,scrapai,16,https://www.hani.co.kr/arti/hanihealth,건강한겨레 뉴스,"남성형 탈모는 남성호르몬인 ‘안드로겐’의 영향으로 모발이 서서히 가늘어지면서 탈락이 진행되는 질환이다. 남성호르몬인 ‘테스토스테론’은 ‘5알파-환원효소’를 만나 ‘디하이드로테스토스테론’(DHT)이라는 안드로겐으로 변하는데, 이 DHT가 혈액 속을 돌아다니다 모낭에 결합할 때 모발 성장을 억제한다. 1차 치료제는 경구용 약제인 피나스테리드와 두타스테리드
광고
건강한겨레
탈모 치료제 장기 복용해도 문제없을까? [건강한겨레]
암 환자의 혁신 항암제 기다림, 왜 한국은 유독 길까? [건강한겨레]
항암제 기술의 발전에 따라 국내외적으로 각종 암종의 1차 치료제 목록과 표준치료 가이드라인이 수시로 개정되는 일도 잦아졌다. 그럼에도 유독 한국 환자들의 신약에 대한 기다림은 길다. 실제 통계에서도 나타난다. 한국글로벌의약산업협회(KRPIA)에 따르면, 2022년을 기준으로 국내에서 혁신 신약이 식품의약품안전처 허가를 받은 뒤 국민건강보험 급여 등재까지 소
40대부터 시작되는 난청…“되돌릴 수 없기에 조기 발견이 중요” [건강한겨레]
현대인의 귀는 피로하다. 시장조사업체 엠브레인 트렌드모니터 조사에 따르면 귀에 이어폰이나 헤드폰을 끼고 있는 시간이 크게 늘었다. 2020년 기준 13~59살 사용자를 대상으로 한 조사에서, 깨어 있는 시간 중 이어폰·헤드폰을 착용하는 비율은 31.8%에 달했다. 하루 4~5시간 정도를 음향기기와 함께하는 것이다. 이는 2018년 조사 결과인 24.8%보다
많이 본 기사
광고",0.3504,0.3585,ozone depletion,west nile virus,borderline,,,,,,
Korean,Korea,hani.co.kr,scrapai,183,https://www.hani.co.kr/arti/science/science_general/1242827.html,"54년 만의 유인 달 왕복 비행, 이르면 8일 발사…가장 먼 우주여행","인류가 역대 가장 먼 우주비행을 떠난다. 미 항공우주국(나사)이 이르면 오는 8일 우주비행사 4명을 태우고 달 궤도 왕복비행을 하는 아르테미스 2호를 발사한다.
나사는 지난달 우주선이 결합된 발사체를 플로리다주 케네디우주센터 39B 발사대로 옮긴 데 이어 2일 오후 9시(한국시각 3일 오전 11시) 발사 전 최종 연습을 실시한다. 로켓에 연료(액체 수소)와 산화제(액체 산소) 265만ℓ를 주입하고, 자동 발사 시스템이 작동하는 발사 33초 전까지 발사 과정을 진행한다. 2022년 아르테미스 1호 발사 때엔 이 과정에서 문제가 드러나면서 세차례나 발사가 연기된 바 있다. 나사는 최종 연습이 성공적으로 마리될 경우 기상 조건 등을 고려해 이르면 8일(현지시각) 발사에 나설 것이라고 밝혔다.
우주비행사가 달 왕복비행을 하는 것은 1972년 아폴로 17호 이후 54년만이다. 다만 이번 비행은 달에 착륙하는 것은 아니고, 달 뒤쪽으로 약 7000km를 더 날아갔다 돌아오는 것이다. 따라서 달에 착륙했던 아폴로 우주선보다 더 멀리 날아가는 역대 가장 먼 유인 우주비행이다. 재러드 아이잭먼 나사 국장은 소셜미디어 엑스에 “이번 임무는 미국의 달 복귀를 알리는 것”이라며 “우리 승무원들은 역사상 그 어느 인류보다 더 먼 우주로 나아간다”고 말했다.
2022년 11~12월 아르테미스 1호의 무인 달 왕복 비행 이후 3년여만에 시도하는 이번 비행은 그때와 마찬가지로 에스엘에스(SLS) 로켓과 오리온 우주선을 이용한다.
보잉이 제작을 주도한 에스엘에스 로켓은 높이 98m로 아폴로 임무에서 사용했던 새턴5(높이 111m)보다 크기는 조금 작지만 추력은 15% 더 강하다. 록히드마틴이 제작한 유인 우주선 오리온은 정원이 4명으로, 3명이 탑승했던 아폴로 우주선보다 내부 공간이 50% 더 넓다.
최초로 달에 가는 여성·흑인·비미국인
아르테미스 2호에 탑승하는 우주비행사 4명은 다양성 원칙에 따라 꾸려졌다. 팀장은 경험 많은 나사 우주비행사 리드 와이즈먼이 맡았고, 팀원 크리스티나 코크는 여성, 빅터 글로버는 흑인이다. 두 사람은 임무가 끝나면 각각 달 여행에 나서는 최초의 여성 및 비백인 우주비행사라는 기록을 갖게 된다. 캐나다 우주비행사인 제레미 한센은 달에 가는 최초의 비미국인으로, 아르테미스 협력국을 대표해 참여한다.
이번 비행은 출발에서 귀환까지 10일간 진행된다. 우주선은 발사 후 하룻동안 최대 7만km 거리의 타원궤도로 지구를 돌면서 기기와 시스템 작동 점검을 받은 뒤 달을 향해 날아가 5일차에 달 너머 수천km 지점에 당도한다. 우주선이 8일에 출발하면 달에 도착할 때쯤엔 반달 모양의 달 뒷면을 볼 수 있게 된다. 우주비행사들은 이 장면을 담기 위해 4K 비디오 촬영이 가능한 전문가급 니콘 D5 DSLR 카메라를 가져간다. 다만 우주선이 달 뒷면을 도는 41분간은 지구와의 통신이 끊긴다.
우주선은 달을 한 바퀴 돈 뒤 귀환길에 올라 10일차에 지구로 돌아온다. 귀환 비행에선 추진기를 사용하지 않고 오로지 중력의 힘만으로 날아온다. 달의 중력을 이용해 가속한 뒤 지구에 가까이 오면 지구 중력의 힘으로 우주선을 끌어당기는 ‘자유 귀환’ 방식이다.
성공 땐 2028년 달 착륙 시도 목표
이번 비행의 가장 큰 고비는 우주선의 대기권 재진입이다. 오리온 우주선은 지구 저궤도에서 진입하는 우주선보다 훨씬 빠른 시속 4만km의 속도로 대기권을 향해 낙하한다. 이때 발생하는 3000도가 넘는 마찰열을 우주선이 잘 견뎌내야 우주비행사들이 안전하게 돌아올 수 있다. 아르테미스 1호 시험비행 때는 열 차폐막에서 여러 조각이 떨어져 나가 안전에 대한 우려가 제기됐다. 나사는 차폐막 손상을 최소화하기 위해 이번엔 오리온 우주선의 하강 각도를 바꿀 예정이다. 이 구간을 잘 통과해 속도가 시속 500km대로 떨어지면 우주선은 낙하산을 펼치고 미 서부 샌디에이고 앞 태평양 해상에 착수하게 된다.
이번 비행의 임무는 우주선 시스템이 실제 심우주 환경에서 예상대로 작동하는지 검증하는 것이다. 비행 기간 동안 우주비행사들은 다음번 아르테미스 3호 비행에서 달 착륙에 필요한 여러가지 기동을 시험한다.
나사는 이번 임무가 성공하면 트럼프 대통령 임기가 끝나기 직전인 2028년 말까지는 달 유인 착륙을 시도한다는 방침이다. 트럼프 대통령의 임기는 2029년 1월에 끝난다. 트럼프 대통령은 지난해 12월 서명한 ‘미국의 우주우위 확보를 위한 행정명령’에서 2028년까지 미국인을 달에 보내고, 2030년까지 원자로를 발사해 달 기지를 위한 초기 요소를 건설하라는 지침을 내렸다.
그러나 달 착륙선으로 쓸 예정인 스페이스엑스의 우주선 스타십 개발이 늦어지고 있어 목표 일정을 맞출 수 있을지는 불투명하다. 나사는 복안으로 블루오리진을 포함한 다른 민간 기업의 우주선을 대체 우주선으로 쓰는 방법도 고려하고 있다.
착륙 후보지는 달 남극이다. 이곳에는 햇빛이 전혀 비치지 않는 영구음영지역이 많다. 과학자들은 이곳에 물얼음이 다량 존재할 것으로 보고 있다.
라이트 형제의 첫 비행기 천 조각 등 싣고 가
나사는 때마침 올해 미국 독립 250주년을 맞아, 미국 우주항공 역사에서 특별한 의미가 있는 기념품을 함께 실어 보낸다. 4.5kg의 기념품이 들어 있는 비행 키트에는 1903년 라이트 형제가 최초의 동력비행기 라이트 플라이어에 사용했던 작은 천 조각, 첫번째와 마지막 우주왕복선, 그리고 미국의 첫번째 민간 유인 우주선 시험비행에 실렸던 미국 국기, 아폴로 18호에서 사용하려고 했던 미국 국기, 아르테미스 1호 때 싣고 갔던 씨앗에서 자란 나무 밑동에서 채취한 흙 표본 등이 포함돼 있다.
미국의 새로운 달 착륙 로켓과 우주선의 첫 발사일은 원래 2017년 예정이었다. 그러나 예산 부족, 기술적 문제, 코로나19 팬데믹 등으로 16번이나 연기되면서 5년이 늦어져 2022년에서야 첫 무인 달 왕복비행에 나섰다. 아르테미스 1호는 발사 4일 후 달 궤도에 도착해 표면으로부터 100~6만4000㎞ 거리에서 달을 돈 뒤 12월11일 지구로 돌아왔다. 출발에서 귀환까지 25일간의 왕복 여행이었다.
아폴로 프로그램은 1968년부터 1972년까지 9...",0.3229,0.3615,ozone depletion,west nile virus,borderline,,,,,,
Korean,Korea,hani.co.kr,scrapai,175,https://www.hani.co.kr/arti/science/science_general/1208433.html,‘생명의 도그마’ 원리로 풀어본 헌법의 의미,"“사람이 아닌 헌법의 정부.”
-존 애덤스 (1735-1826)
미국 2대 대통령 존 애덤스는 미국 독립 선언서를 작성하였다. 그는 ‘정치는 인간의 행복에 관한 학문'이라는 생각을 바탕으로 헌법을 전개하였다. 이는 사람이 아닌 법에 의한 통치라는 개념으로 발현된다. 미국 헌법은 입법, 행정, 사법의 견제와 균형을 삼권분립으로 담아낸 최초의 성문법이다. 의회는 법을 만들고 행정부는 법을 운용하고 사법부는 법을 수호한다. 그리고 국민은 선거를 통해 의회와 대통령을 선출한다. 이를 통해 국가의 형성과 유지에 참여하게 된다. 미 대통령은 위치를 의미하는 ‘프레지던트(president)’다. 수반의 자리는 지속되고 사람은 바뀌기 때문이다. 과거 봉건제 국가의 국민은 왕에게 충성하였다. 하지만 현대 민주 국가의 국민은 사람이 아닌 헌법에 충성한다. 현대 국가에서 헌법은 국가 자체로 취급되기 때문이다.
이처럼 중요한 헌법을 기리는 국경일이 제헌절이다. 비록 공휴일은 아니지만 이날을 맞이해 헌법의 의미와 중요성을 다시 생각해본다. 대한민국의 헌법은 1919년 임시헌장에 뿌리를 둔 제헌헌법을 시작으로, 1987년 대통령 직접 선거가 반영된 헌법까지 열 번의 개헌이 있었다. 하지만 그 시작이 국민이 권력을 가진 민주공화국이라는 것에는 변함이 없다. 헌법 정신 지속의 중요성은 인문학적 관념에만 그치지 않는다. 과학적 관점에서도, 국가라는 집단이 번영하려면 헌법이라는 도그마(dogma)의 견고한 지속이 중요하다.
오월 밤하늘에 펼쳐진 사자자리 방향으로 126광년 거리에 k2-18b 행성이 있다. 외계 생명체의 가능성을 탐색하던 케플러 망원경이 십년 전 발견한 행성이다. 행성의 물리적 환경이 지구와 유사할수록 생명의 존재 가능성이 높아진다. 생명 현상을 지배하는 물리 법칙은 관찰 가능한 우주에서 보편적 절대성을 가지기 때문이다. 지구의 8배인 질량이 형성하는 k2-18b의 중력은 지구의 1.18배다. 그리고 우리 태양의 절반 정도인 항성을 중심으로 33일 주기로 공전한다. 공전 궤도가 골디락스 존에 있어 0도에서 40도의 기온이 유지된다. 덕분에 표면을 바다가 덮고 있으며, 대기는 수증기를 품고 있다. 액체 상태의 물은 생명 활동의 필수 환경이다.
최근 k2-18b의 대기에서 제임스웹망원경이 특정한 화합물을 확인하였다. 행성의 대기에 이 화합물이 고농도로 존재하는 것은 생명 활동의 징후로 여겨진다. 물리적 환경 이외에, 화학적으로도 이 행성에 생명의 존재 가능성이 제시된 것이다. 현재 학계에서는 이 발견을 둘러싼 뜨거운 논쟁이 진행 중이다. 물론 검증이 되어도 고등 지적 생명체의 존재를 증명하는 것은 아니다. 단지 생물학적 대사를 수행하는 원시적 단세포 생물의 존재를 의미할 뿐이다. 그럼에도 외계 생명에 대한 가능성에 관심이 집중되는 이유는, 생명의 중심 도그마(Central Dogma of Life)를 둘러싼 호기심 때문이다.
도그마 없이는 존재할 수 없는 생명
생명의 중심 도그마는 생명 정보에 대한 일방통행 규칙이다. 구체적으로는 DNA가 RNA를 만들고, RNA가 단백질을 만드는 순서를 기술한다. 지구 생태계에 존재했고, 존재하고, 존재할 모든 생명은 이 도그마를 따른다. 생명의 도그마가 지배적인 이유는 모든 생물이 루카(Last Universal Common Ancestor)의 후손이기 때문이다. 원시 생태계의 생존을 위한 공진화 경쟁에서 살아남은 최후의 승자가 루카다. 이 루카의 생물학적 특징이 생명의 도그마가 된 것이다. 만약 다른 원시 세포가 승자가 되었다면 생명의 도그마는 지금과 달랐을 것이다.
상위계 법칙의 지배를 받지만, 그것만 설명 불가능한 새로운 법칙을 가진 하위계의 등장 시점을 특이점(singularity)이라 한다. 물리학에서 빅뱅이 특이점인 것처럼, 생물학에서 루카는 생태계의 특이점이다. 빅뱅은 우주의 물리 법칙이 왜 그렇게 형성되었는지 설명하지 못한다. 하지만 빅뱅은 우주에서 관찰되는 모든 현상을 가장 잘 설명하는 이론이다. 루카도 생명의 도그마가 왜 그렇게 정해졌는지 설명하지 못한다. 하지만 생태계에서 관찰되는 모든 현상을 가장 잘 설명하는 이론이다.
생명의 도그마는 지구를 벗어나면 성립하지 않는다. 지구의 물리적 환경을 바탕으로 형성된 지구 생태계의 고유 원리이기 때문이다. 물리적 관점에서 외계의 생명 도그마가 지구와 같아야 할 이유는 없다. 기본적 물리법칙은 지구와 동일하지만, 생명의 창발(emergence) 과정에서 자기 조직화되는 도그마는 다를 수 있기 때문이다. 단백질에서 유전자가 만들어져도 상관없고, 단백질에 유전 정보가 보관되어도 상관없다. 단백질 정보를 유전자로 변환하여 죽지 않고 살아가는 생명이 우주 어딘가에 존재할 수 있다. 행성 k2-18b를 둘러싼 논란은 이런 호기심에 불을 붙인다.
생명의 중심 도그마는 생물에게 죽음이라는 숙명을 짊어지게 하였다. 동시에 생물은 유전자의 진화라는 운명을 개척해야 했다. 현대 진화론에서 진화의 주체는 생물이 아니라 유전자에 저장된 생명 정보다. 실존주의 관점에서 생물은 생명 정보가 실존으로 피투(geworfenheit)되는 것이다. 그리고 생물은 시행착오의 운명을 기투(entwurf)하게 된다. 유전 정보가 피투된 생물에게 죽음은 숙명이고, 새로운 세대로 변화를 실험하는 것은 기투의 운명이다.
로또는 왜 매주 일등 당첨자가 나올까
생물에게 생명의 도그마는 죽음의 법칙이다. 생명 정보는 일방통행이며, 죽을 때까지 유전 정보는 불변이다. 새로운 변화는 후손을 만드는 유전자 복제 과정에서만 가능하다. 변화의 성공 여부를 확인하는 것은 후손의 몫이다. 살아남아 다시 후손을 복제하면 변화는 성공, 죽으면 실패가 된다. 성공한 유전 정보의 변화는 유전자에 기록되어 세대를 관통해 전승된다. 실패한 변화는 즉각 소멸되어 사라진다. 역사가 승자의 기록이듯, 유전자도 성공의 기록이다. 유전자 진화는 죽음의 게임이며 패자는 말이 없다. 진화 게임에서 패배해 사라진 유전 정보의 수는 우주의 원자 개수도 까마득히 뛰어넘는다. 현존하는 유전자에는 이런 시행착오에서 일어난 천문학적인 죽음은 기록되어 있지 않다.
내가 로또를 사면 일등에...",0.3599,0.3613,carbon dioxide,west nile virus,borderline,,,,,,
Korean,Korea,hani.co.kr,scrapai,293,https://www.hani.co.kr/arti/international/international_general/1248267.html,러시아 기름장사 ‘반사이익’…푸틴만 웃는다,"미국·이스라엘-이란 전쟁으로 중동산 원유 공급이 급감하고 국제 유가가 급등하면서 러시아가 반사이익을 누리고 있다. 유가 급등에 부담을 느낀 미국은 러시아산 원유에 대한 제재 해제 가능성도 열어놓고 있다.
드미트리 페스코프 크렘린궁 대변인은 “이란 전쟁과 맞물려 러시아 에너지에 대한 수요가 실질적으로 증가하고 있다”고 밝혔다. 지난 5일 미국 정부는 인도 정유사에 대해 러시아산 원유 구매를 30일간 예외적으로 허용했다. 원유값 안정을 위해 대러 제재 조치를 일시적으로 완화하는 모양새다. 스콧 베선트 미 재무장관은 6일 폭스비즈니스와의 인터뷰에서 이를 언급한 뒤 “다른 러시아산 원유에 대한 제재도 해제할 수 있다”고 말했다.
중국도 러시아산 원유 수입을 늘릴 것으로 전망된다. 중국은 베네수엘라에 이어 주요 원유 수입국인 이란마저 전쟁에 휘말리면서 러시아산 원유에 한층 의존하게 될 것으로 보인다. 독일 베를린에 있는 싱크탱크인 카네기 러시아 유라시아 센터의 알렉산드르 가부예프 소장은 “이란과 베네수엘라를 합치면 중국 석유 수입량의 약 17%를 차지한다”며 “중국은 어디서든 이 석유를 공급받아야 하고, 그 공급국은 러시아가 될 것”이라고 말했다.
블라디미르 푸틴 러시아 대통령은 국영방송 인터뷰에서 “이제 유럽 시장에 대한 공급을 중단하는 게 더 유리할 수 있다”며 유럽을 압박했다. 러시아의 우크라이나 침공 이후 유럽이 추진해온 ‘러시아 에너지 탈피’ 정책을 조롱하며, 러시아가 유럽에 에너지를 공급할지 결정할 수 있는 주도권을 쥐었다고 위협한 것이다. 유럽 내 액화천연가스(LNG) 선물 가격은 지난 주말 이란 사태 발발 이후 60% 이상 상승했다. 테리에 오슬란 노르웨이 에너지장관은 “이번 가격 급등이 러시아의 전쟁 경제를 약화하기 위해 얼마나 많은 자국 내 고통을 감수할 것인지를 다시 논의하는 계기가 될 것”이라고 말했다.
정유경 기자 edge@hani.co.kr",0.2958,0.3840,ozone depletion,west nile virus,borderline,,,,,,
