language,country,source,collection_method,article_id,url,title,content,climate_max_sim,health_max_sim,climate_best_keyword,health_best_keyword,sample_bucket,climate,health,health_climate_impact,climate_justification,health_justification,impact_justification
Italian,Italy,repubblica.it,scrapai,111,https://www.repubblica.it/motori/2026/03/08/news/land_rover_defender_110_octa_unica_e_monumentale_ecco_come_va-425207867/,"Land Rover Defender 110 Octa, unica e monumentale. Ecco come va","Land Rover Defender 110 Octa, unica e monumentale. Ecco come va di Matteo Morichini 08 Marzo 2026 alle 15:39 2 minuti di lettura ROMA – I fuoristrada specialistici ad alte prestazioni sono una nicchia nella nicchia e tra l’esigua selezione di modelli in commercio, la Land Rover Defender Octa da 189.000 euro spinta dal gutturale 4.4L V8 twin-turbo in grado di erogare 635 Cv, è uno degli esemplari più elitari della categoria. Per giustificare il prezzo del biglietto la Octa si presenta con finiture dedicate, monumentali fisionomie (è più alta di 28 mm e più larga di 68mm rispetto alla versione standard) e capacità off-road di vertice tanto da poter attraversare guadi profondi un metro senza colpo ferire. Quest’ultimo valore è un record per la famiglia Defender e lo stesso accade con l’atletico scatto da 0-100km/h in 4 secondi netti. Il primato relativo allo sprint è cortesia del motore mild-hybrid collegato alla trazione integrale tramite il cambio automatico ad 8 rapporti. Nella modalità di guida Dyamic - attivabile premendo brevemente il grande tasto con l’illustrazione di un cerchio a forma di diamante sulla parte bassa del volante – il propulsore sprigiona 800nm di coppia e l’esperienza è accompagnata da illuminazione rossa sul tachimetro digitale in cui vengono proiettati grafici inerenti a potenza e forze centrifughe in atto. Dalla troneggiante prospettiva del posto guida che evoca non poco quella dei monster trucks Bigfoot , la prepotente accelerazione resa più emozionante dal rombo “vecchia scuola” dell’otto cilindri restituisce sensazioni sui generis, mascherando quasi completamente le 2,5 tonnellate di peso. Un altro trucco percettivo della Defender Octa sorretta da cerchi da 22"" avvolti da pneumatici all-terrain BF Goodrich, è quello di ridurre tutto ciò che la circonda ad una scala lillipuziana. Nel piccolo centro storico di Anguillara Sabazia – tappa del nostro test dal centro di Roma alle campagne della Tuscia e ritorno – la vettura sembrava occupare i medesimi spazi delle casette a due piani ed il surplus dimensionale, è anche una delle caratteristiche con cui il modello domina asfalti consunti e situazioni off-road. Avendo ciclopici angoli d’attacco ed i programmi del Terrain Response per scalare dune, pietraie e forcelle, il passaggio su buche, dossi e avvallamenti è impercettibile e questo consente di guidare con (molto) brio anche su manti imperfetti. A ciò si aggiunge la mappatura di punta Octa dedicata al fuoristrada ad alte prestazioni che oltre ad ottimizzare la trazione su superfici a bassa aderenza per correre a 250km/h anche sulla ghiaia, abilita l'Off-Road Launch e ricalibra l'Abs al fine di garantire una maggiore incisività su superfici cedevoli. La sensazione d’inarrestabilità è un tratto somatico della versione creata dal reparto Special Vehicle Operation di Land Rover e tra le varie soluzioni specifiche alla Octa, spiccano le sospensioni 6D Dynamics a sistema idraulico interconnesso. La tecnologia riduce quasi totalme...",0.5384,0.5596,extreme heat,west nile virus,high_both,,,,,,
Italian,Italy,repubblica.it,newsapi,1194,https://www.repubblica.it/green-and-blue/2026/03/11/news/iene_animali_spazzini-425214619/,"In Etiopia le iene aiutano a smaltire rifiuti. ""Convivenza vantaggiosa con fauna selvatica""","Uno studio sul predatore urbano ormai parte dell'ecosistema cittadino ha stimato il contributo allo smaltimento: solo a Mekelle 100.000 dollari di risparmio sui costi di gestione degli scarti

Gli animali spazzini come le iene che si aggirano nelle città dell'Etiopia impediscono ogni anno l'emissione di migliaia di tonnellate di carbonio. È quanto emerge da uno studio condotto dall'Università di Sheffield e pubblicato su Ecological Solutions and Evidence. Consumando rifiuti organici che altrimenti marcirebbero, questi predatori stanno facendo risparmiare alla sola città di Mekelle oltre 100.000 dollari in costi di gestione dei rifiuti, riducendo al contempo il significativo rischio igienico-sanitario e ambientale associato allo scarico sistematico dei rifiuti lungo le strade.

Gidey Yirga, responsabile della ricerca e docente presso la Facoltà di Bioscienze dell'Università di Sheffield, ha affermato: ""In un momento in cui le città di tutto il mondo sono alle prese con obiettivi climatici e di riduzione dei rifiuti, abbiamo scoperto che gli spazzini forniscono servizi ecosistemici essenziali, riducendo al contempo in modo significativo i rischi igienico-sanitari potenzialmente catastrofici. Animali come le iene maculate si sono adattati a un ambiente urbano ad alta densità e sono diventati una parte essenziale dell'ecosistema cittadino. Ciò dimostra una coesistenza reciprocamente vantaggiosa tra esseri umani e grandi carnivori che, nella maggior parte dei casi, necessitano di vasti ambienti naturali privi di intervento umano.""

Per comprendere l'entità dei rifiuti organici smaltiti in città, i ricercatori hanno intervistato oltre 400 famiglie selezionate casualmente per comprenderne le abitudini. Questi dati sono stati estrapolati all'intera città, rivelando che ogni anno circa 1.058.200 animali vengono macellati nelle case. Ciò genera 1.240,6 tonnellate di scarti di carne, equivalenti al peso totale di circa 31.000 pecore vive. In una città con una gestione dei rifiuti e condizioni igieniche generalmente scadenti, questa montagna di scarti di carne viene scaricata lungo i bordi delle strade e in altri luoghi aperti in tutta la città. Lo studio ha scoperto che, mangiando gli scarti della carne, i predatori urbani impediscono che oltre 1.000 tonnellate di emissioni di carbonio vengano immesse nell'atmosfera e fanno risparmiare ai servizi di smaltimento dei rifiuti un valore di oltre 100.000 dollari all'anno. Il dottor Yirga ha aggiunto: ""Nelle nostre conversazioni con i residenti abbiamo scoperto che riconoscono e apprezzano i vantaggi della convivenza con questi spazzini urbani, evidenziando l'ulteriore potenziale di una pacifica coesistenza tra fauna selvatica ed esseri umani nelle aree urbane"".",0.5601,0.5601,environmental change,undernourishment,high_both,,,,,,
Italian,Italy,repubblica.it,newsapi,3036,https://www.repubblica.it/motori/2026/02/23/news/con_la_gamma_bentley_negli_emirati_arabi_cosi_canta_il_v8_4_litri_ibrido_e_non-425177797/,Con la gamma Bentley negli Emirati arabi: così canta il V8 4 litri ibrido e non,"DUBAI - Eleganti, potenti, raffinate: se il vero lusso, come dice il ceo Frank-Steffen Walliser, è solo europeo, ""perché ha bisogno di heritage, arte e storia"", la gamma Bentley, realizzata interamente nell'impianto di Crewe nel nord dell'Inghilterra, ne rispecchia in pieno l'essenza. La Continental GT Speed, la Flying Spur Mulliner e la Bentayga Speed, hanno modalità d'uso differenti, pur avendo molti punti in comune, a iniziare dalla magnificenza degli interni e dal motore V8 4.0 litri biturbo declinato sia in versione ibrida che solo termica. E ognuna rappresenta perfettamente in chiave moderna l'eredità di un brand che fa della potenza e del lusso il suo marchio di fabbrica sin dalla fondazione nel 1919.

Abbiamo avuto modo di provare i tre gioielli di casa Bentley negli Emirati Arabi Uniti in un tragitto di circa 300 km dal traffico caotico di Dubai fino a Fujairah e ritorno, fatto di superstrade con lunghi rettilinei nel deserto intervallati da percorsi più tortuosi, nella zona montagnosa di rocce rosse che separa i due emirati prima di scivolare nuovamente verso il mare sul Golfo di Oman.

Nel parcheggio del Jumeirah Beach Hotel di Dubai, di fronte all'iconico Burj Al Arab, siamo saliti al volante della più sportiva, la Continental GT Speed ibrida, filante coupé di 4,89 metri, spinta dal 4 litri biturbo affiancato da un motore elettrico per 782 Cv totali e 1.000 Nm di coppia. La linea è aggressiva e moderna ed è caratterizzata da un frontale con fari singoli con una specie di ""sopracciglio"". E si sposa con interni raffinatissimi, con ampio uso di pelle lavorata a mano, strumentazione chiara e leggibile e tanti comandi touch. Un abitacolo riproposto in maniera pressoché identica anche su Flying Spur e Bentayga. I sedili sono comodissimi e con mille regolazioni e la posizione di guida è decisamente confortevole. Partiti dall'hotel ci siamo immersi nel caotico traffico di Dubai, dove abbiamo apprezzato la possibilità di marciare solo in elettrico per circa 80 km grazie alla batteria da 25,9 kWh. Messa la modalità Sport, però il powertrain ibrido si scatena e grazie all'ottimo lavoro fatto su telaio e sospensioni, alla trazione integrale e alle ruote posteriori sterzanti, la Continental GT Speed si trasforma in un'auto da corsa con la comodità di una ammiraglia: del resto, accelera da 0 a 100 km/h in 3,2 secondi e tocca i 335 km/h. Prezzi da 304mila euro circa.

Arrivati a Fujairah, siamo montati su una delle berline più lussuose sul mercato, la Flying Spur Mulliner, dotata dello stesso V8 biturbo ibrido da 782 Cv totali. Lunga 5,31 metri e caratterizzata da una livrea bicolore, ha una linea classica con doppio faro frontale e coda alta e imponente. A bordo il lusso è estremo, ma quello che impressiona è la facilità di guida nonostante la massa da spostare: i 1.000 Nm di coppia fanno sembrare leggera la Flying Spur, che affronta, grazie anche alle ruote posteriori sterzanti, le curve veloci con sicurezza e stabilità ed accelera da 0 a 100 km/h...",0.5342,0.5647,carbon emission,west nile virus,high_both,,,,,,
Italian,Italy,repubblica.it,newsapi,2130,https://www.repubblica.it/economia/rapporti/obiettivo-capitale/mercati/2026/03/02/news/high_yield_non_sempre_fa_rima_con_spread_elevati-425195684/,High yield non sempre fa rima con spread elevati,"Gerhard (Insight Investment): ""Vediamo buone opportunità nelle telecomunicazioni e nei servizi, con una particolare preferenza per l'Europa""

""In uno scenario caratterizzato da una crescita economica resiliente e bilanci aziendali generalmente sani, i bond high yield (quelli caratterizzati da rendimenti superiori alla media, a fronte di emittenti meno solidi, ndr) possono offrire un buon equilibrio tra rischio e rendimento. A patto di non dimenticare mai l'importanza della selezione"". È la convinzione di Uli Gerhard, senior portfolio manager di Insight Investment, centro di eccellenza nel fixed income all'interno di Bny Investments, intervistato in occasione del suo tour a Milano.

A Wall Street è entrata nel pieno la stagione delle trimestrali, mentre in Europa sono usciti i primi risultati. Quali lezioni si possono trarre in ottica di solidità dei bilanci aziendali?

""Le indicazioni sono tendenzialmente positive, ma - dalla nostra prospettiva - non sono i conti trimestrali a fare la differenza. Ci concentriamo sui bilanci consolidati, sul settore di attività e sulle prospettive di medio-lungo periodo per una valutazione più compiuta. Nemmeno il tema dei dazi colpisce in maniera incisiva queste realtà, che invece tendono a risentire delle fasi di recessione, eventualità che non vediamo all'orizzonte"".

""Il Pil americano cresce al ritmo del 2,5%, potrebbe rallentare un po', ma non decrescere. In Europa il ritmo è più lento, ma anche qui la crescita prosegue. Per altro, Paesi in passato in difficoltà come Italia, Spagna e Grecia stanno facendo bene. Inoltre gli ultimi dati Pmi (relativi alle previsioni dei responsabili acquisti aziendali, ndr) della Germania indicano che anche dalla principale economia dell'area arrivano segnali confortanti. Gli orientamenti della Bce sono per una conferma dei tassi ancora per diverso tempo, il che conferma la convinzione di una crescita sostenibile"".

A suo avviso, quali sono le aree geografiche più interessanti al momento?

""Dagli incontri che ho fatto nelle ultime settimane in giro per il mondo ho ricavato la sensazione che in Asia siano orientati a ridurre l'esposizione verso gli Stati Uniti e lo stesso, in misura minore, ho colto tra gli investitori europei. Mentre proprio il Vecchio Continente è destinatario di investimenti importanti"".

A fronte di spread compressi per i bond high yield, quanto conta ancora il premio al rischio rispetto al puro rendimento cedolare nella vostra selezione?

""Generalmente si dice che non si investe in high yield durante fase di recessione perché i default aumentano, ma non vediamo recessione all'orizzonte. Ricordiamoci che la classe d'investimento si chiama high yield e non high spread, quindi non diamo per scontati rendimenti sensibilmente superiori alle emissioni investment grade"".

Quali sono i settori che vi piacciono di più e quali meno al momento?

""Investiamo molto telecomunicazioni in quanto si tratta di un settore stabile, caratterizzato da consumi ricorrenti e cash f...",0.5309,0.5599,global heating,quality of life,high_both,,,,,,
Italian,Italy,repubblica.it,newsapi,291,https://www.repubblica.it/economia/2026/03/20/diretta/borse_oggi_20_marzo_gas_petrolio_iran_prezzi-425234009/,"Le Borse oggi, 20 marzo. Si raffreddano gas e petrolio, Milano torna in positivo","Dopo i ribassi della vigilia sulle principali piazze di Asia, Europa e Stati Uniti, nell'ultima seduta la tendenza è verso una inversione di rotta

L'ultima seduta della settimana, preceduta da una giornata di rialzi dei prezzi di petrolio e gas e di ribassi nelle principali piazze di Asia, Europa, Stati Uniti, prova a invertire la rotta. A dare fiducia è il raffreddamento in avvio degli energetici, nonostante le tensioni in Medio Oriente rimangano elevate. Così nel cosiddetto giorno delle ""quattro streghe"", per la contemporanea scadenza di future e opzioni su indici e azioni, mentre l'Europa si presenta in rialzo in avvio, l'Asia chiude mista, con il Giappone chiuso per festività.",0.5383,0.5565,global heating,west nile virus,high_both,,,,,,
Italian,Italy,repubblica.it,newsapi,2802,https://www.repubblica.it/esteri/2026/02/25/video/trump_la_sentenza_sui_dazi_della_corte_suprema_e_stata_infelice-425182069/,"Trump: ""La sentenza sui dazi della Corte suprema è stata infelice""","Durante il discorso sullo stato dell'Unione, Trump ha definito ""infelice"", ""deludente'' e ""totalmente sbagliata"" la decisione della Corte suprema che ha bocciato i dazi ""che stavano tirando fuori denaro dai Paesi che ci hanno sempre fregato"". I nuovi dazi globali del 15% ""sono un po' più complessi, ma in realtà probabilmente sono migliori, portando a una soluzione che sarà ancora più efficace di prima"". Leggi tutta la diretta: ""Il discorso di Trump sullo stato dell'Unione: ""L'America è tornata, questa è l'età dell'oro""",0.5288,0.5579,climate crisis,west nile virus,high_both,,,,,,
Italian,Italy,repubblica.it,scrapai,312,https://www.repubblica.it/motori/2026/03/10/news/enel_installati_3730_punti_di_ricarica_previsti_dal_primo_bando_del_pnrr-425210826/,"Enel, installati 3.730 punti di ricarica previsti dal primo bando del Pnrr","Enel, installati 3.730 punti di ricarica previsti dal primo bando del Pnrr di Maurilio Rigo Le stazioni di ricarica sono state realizzate in 5 regioni e 21 province e sono in arrivo ulteriori 1.200 punti di ricarica previsti dal secondo e terzo bando 10 Marzo 2026 alle 00:37 1 minuti di lettura ROMA - Enel prosegue nello sviluppo della mobilità elettrica completando le installazioni dei punti di ricarica del primo bando del Pnrr con 3.730 punti di ricarica fast attivati in 5 regioni (Campania, Lazio, Lombardia, Puglia e Sicilia) e 21 provincie (298 le colonnine nella provincia di Napoli, 227 in quella di Milano, 111 in quella di Bari, 112 in quella di Catania e 396 in quella di Roma). Per celebrare il traguardo la società ha inaugurato oggi la stazione di ricarica realizzata di fronte alla sede del ministero dell’Ambiente e della Sicurezza Energetica, a Roma. L’intervento infrastrutturale di Enel, reso possibile grazie anche ai fondi messi a disposizione dal “Next Generation EU” dell’Unione Europea, prevede poi una nuova serie di installazioni con altri 1.200 punti di ricarica del secondo e terzo bando Pnrr che porterà così a circa 5.000 punti di ricarica in 9 regioni: Lombardia, Piemonte, Veneto, Emilia-Romagna, Toscana, Lazio, Campania, Puglia e Sicilia. Il Gruppo Enel ha così raggiunto il 50% delle assegnazioni ad oggi aggiudicate nei 3 Bandi Pnrr per le infrastrutture di ricarica in contesto urbano. Le stazioni di ricarica installate hanno una potenza fino a 90 kW per singolo connettore e possono servire due veicoli in contemporanea consentendo un rifornimento rapido. Per accedere al servizio di ricarica Enel sono disponibili l’app e la card On Your Way, a cui si aggiungono quelle degli oltre 160 mobility service providers nazionali ed esteri interoperabili. Grazie alla presenza del Pos, è inoltre possibile pagare direttamente alla colonnina con carte di debito e di credito, rendendo così l’esperienza di ricarica più semplice per chi guida un veicolo elettrico. Argomenti motori enel Leggi i commenti I commenti dei lettori Video in evidenza 10 marzo 1946, alle urne senza rossetto: il primo voto delle donne in Italia Leggi anche Motodays 2026 nel segno della sicurezza, con 25 case. Il premio Uiga alla Ducati Multistrada V4 La micromobilità non è un fenomeno solo per giovani, ma cresce tra gli over 35. Ecco perché Arriva Lotus Eletre X, il super Suv ibrido da 952 Cv e 1.200 km di autonomia Raccomandati per te Essere Jayson Tatum Le conseguenze del conflitto in Medio Oriente su petrolio, oro e azioni: tre scenari per i mercati Bollette del gas, la stangata iraniana sarà pagata da anziani e più fragili Cannibale e “fan di Trump”, una nuova biografia racconta Hannibal Lecter © Riproduzione riservata",0.5489,0.5776,carbon emission,west nile virus,high_both,,,,,,
Italian,Italy,repubblica.it,newsapi,1238,https://www.repubblica.it/economia/2026/03/11/diretta/borse_oggi_11_marzo_guerra_iran_petrolio_gas-425213687/,"Le Borse oggi, 11 marzo. L'Aie apre a rilascio record di riserve petrolifere. Europa in calo","Atteso in giornata il dato sull'inflazione di febbraio degli Stati Uniti. Intanto lo stretto di Hormuz continua a rimanere bloccato

I mercati tentano di proseguire in territorio positivo mentre continua il blocco dello stretto di Hormuz e il conflitto in Iran, arrivato al 12esimo giorno. L'Agenzia internazionale dell'energia, secondo il Wall Street Journal, sta valutando il maggior rilascio di riserve petrolifere strategiche di sempre, oltre 180 milioni di barili di greggio per raffreddare il prezzo dei carburanti e scongiurare una fiammata inflazionistica.",0.5430,0.5902,heatwave,west nile virus,high_both,,,,,,
Italian,Italy,repubblica.it,newsapi,2884,https://www.repubblica.it/solidarieta/diritti-umani/2026/02/24/news/ucraina_l_emergenza_visibile_delle_mine_antiuomo_al_teatro_carcano_l_istallazione_resto-425180952/,"Ucraina, l'emergenza visibile delle mine antiuomo: al teatro Carcano l'istallazione ""Resto""","MILANO - In Ucraina la guerra c'è anche dove non si vede. Sul Paese grava una minaccia invisibile che colpisce civili, bambini e agricoltori, limitando fortemente la vita quotidiana. Si tratta delle mine antiuomo che, assieme agli ordigni inesplosi, si nascondono nei campi, lungo le strade, nei cortili delle case.

Il conto delle vittime. Dal 2022 si sono registrati 467 morti e più di mille feriti a causa dello scoppio di mine e residui bellici, in un contesto in cui circa 137mila chilometri quadrati di territorio risultano ancora contaminati - una superficie più grande dell'intero territorio della Grecia - in particolare nelle zone orientali del Paese. Oggi oltre 5,4 milioni di persone hanno bisogno di interventi di sminamento e di attività di sensibilizzazione sui rischi rappresentati dagli ordigni esplosivi: l'84% degli sfollati interni indica la contaminazione da mine come la principale preoccupazione durante l'evacuazione o la permanenza in aree occupate.

Sono 12,7 milioni gli ucraini che hanno bisogno di supporti umanitari. A quattro anni dall'inizio della guerra il bilancio è drammatico. Sono 12,7 milioni gli ucraini che necessitano di supporto umanitario, inclusi oltre 2 milioni di bambini. A questa emergenza CESVI fornisce una risposta attraverso il progetto SAFE STEPS, finanziato dalla Farnesina, attraverso l'Agenzia italiana per la cooperazione allo sviluppo (AICS). Un programma per il ritorno sicuro delle popolazioni nelle aree colpite dal conflitto.

Dallo scoppio del conflitto CESVI è attiva in Ucraina con interventi umanitari integrati: dapprima per fornire aiuti di emergenza, poi attraverso interventi di protezione dell'infanzia e delle categorie vulnerabili, e di supporto psicologico. L'Ong italiana si è occupata anche di ricostruzione e riabilitazione di edifici scolastici e di costruzione di rifugi antiaerei, oltre che di supportare il sistema sanitario con medicinali, attrezzature, autoambulanze, e dislocando cliniche mobili nelle zone del conflitto. In tutto, in questi anni, CESVI ha portato aiuti a oltre 180.000 persone.

L'installazione ""Resto"". Per sensibilizzare su questa drammatica situazione, nasce ""RESTO"", l'installazione esperienziale che CESVI promuove, in collaborazione con il Teatro Carcano di Milano che la ospiterà fino al prossimo 1° marzo. Il progetto propone due installazioni interattive, ""AURIS"" e ""NIMBUS"", che utilizzano dispositivi tattili e sonori per evocare esperienze di ascolto e comunicazione senza parole. Sarà visitabile dal pubblico del Teatro Carcano, nell'ora e mezza precedente allo spettacolo serale o pomeridiano e al termine della rappresentazione. Dal 24 febbraio al 1° marzo. Sarà aperta invece a tutto il pubblico, gratuitamente, sabato 28 febbraio dalle 11 alle 15. È consigliata la prenotazione a questo link.",0.5431,0.5717,climate crises,undernourishment,high_both,,,,,,
Italian,Italy,repubblica.it,newsapi,1380,https://www.repubblica.it/motori/2026/03/10/news/enel_installati_3730_punti_di_ricarica_previsti_dal_primo_bando_del_pnrr-425210826/,"Enel, installati 3.730 punti di ricarica previsti dal primo bando del Pnrr","ROMA - Enel prosegue nello sviluppo della mobilità elettrica completando le installazioni dei punti di ricarica del primo bando del Pnrr con 3.730 punti di ricarica fast attivati in 5 regioni (Campania, Lazio, Lombardia, Puglia e Sicilia) e 21 provincie (298 le colonnine nella provincia di Napoli, 227 in quella di Milano, 111 in quella di Bari, 112 in quella di Catania e 396 in quella di Roma). Per celebrare il traguardo la società ha inaugurato oggi la stazione di ricarica realizzata di fronte alla sede del ministero dell'Ambiente e della Sicurezza Energetica, a Roma. L'intervento infrastrutturale di Enel, reso possibile grazie anche ai fondi messi a disposizione dal ""Next Generation EU"" dell'Unione Europea, prevede poi una nuova serie di installazioni con altri 1.200 punti di ricarica del secondo e terzo bando Pnrr che porterà così a circa 5.000 punti di ricarica in 9 regioni: Lombardia, Piemonte, Veneto, Emilia-Romagna, Toscana, Lazio, Campania, Puglia e Sicilia.

Il Gruppo Enel ha così raggiunto il 50% delle assegnazioni ad oggi aggiudicate nei 3 Bandi Pnrr per le infrastrutture di ricarica in contesto urbano. Le stazioni di ricarica installate hanno una potenza fino a 90 kW per singolo connettore e possono servire due veicoli in contemporanea consentendo un rifornimento rapido. Per accedere al servizio di ricarica Enel sono disponibili l'app e la card On Your Way, a cui si aggiungono quelle degli oltre 160 mobility service providers nazionali ed esteri interoperabili. Grazie alla presenza del Pos, è inoltre possibile pagare direttamente alla colonnina con carte di debito e di credito, rendendo così l'esperienza di ricarica più semplice per chi guida un veicolo elettrico.",0.5300,0.5581,carbon emission,west nile virus,high_both,,,,,,
Italian,Italy,repubblica.it,scrapai,150,https://www.repubblica.it/commenti/2026/03/09/news/pasdaran_trump_incertezza_gentiloni-425208461/,Una cupa incertezza,"Una cupa incertezza di Paolo Gentiloni I Pasdaran Sul piano economico, se si protraesse per settimane un blocco di fatto della navigazione nello Stretto di Hormuz , le conseguenze diverrebbero disastrose L'ascolto è riservato agli abbonati premium 09 Marzo 2026 alle 00:01 3 minuti di lettura Abbonati per leggere anche Leggi i commenti I commenti dei lettori Raccomandati per te Essere Jayson Tatum Stefano Massini, il suo Putin è un evento tv. “La storia di un bambino nutrito da violenza e potere” Le conseguenze del conflitto in Medio Oriente su petrolio, oro e azioni: tre scenari per i mercati Bollette del gas, la stangata iraniana sarà pagata da anziani e più fragili © Riproduzione riservata",0.5584,0.5963,extreme event,west nile virus,high_both,,,,,,
