language,country,source,collection_method,article_id,url,title,content,climate_max_sim,health_max_sim,climate_best_keyword,health_best_keyword,sample_bucket,climate,health,health_climate_impact,climate_justification,health_justification,impact_justification
Italian,Italy,repubblica.it,newsapi,2777,https://www.repubblica.it/spettacoli/dossier/festival-di-sanremo/2026/02/25/news/achille_lauro_coconduttore_sanremo_2026-425182706/,"La svolta di Achille Lauro, co-conduttore a Sanremo 2026: ""Canto mia madre e sogno il cinema""","Ripubblichiamo questa intervista al musicista che stasera sarà sul palco dell'Ariston a fianco di Carlo Conti e Laura Pausini

Achille Lauro, in questo nuovo disco c'è una canzone, Cristina che è una dedica a sua madre. E anche il racconto crudo della sua adolescenza difficile. Ha detto che lei non l'ha ancora ascoltata. Che reazione si aspetta? E cosa pensa, sua madre, della sua musica?

""Non so davvero che reazione avrà. È è un brano molto impattante: quando lo ascolto mi viene il magone. Per il resto, sono arrivato a un punto in cui le mie canzoni arrivano a un pubblico trasversale. Qualche anno fa, io e altri amici facevamo musica per un target giovane, oggi non è più cosi. Mia madre riesce a comprendere questa trasformazione, credo ci sia una componente oggettiva e non soggettiva in questo"".

Breve riassunto: il 18 aprile esce il nuovo album di Achille Lauro, Comuni mortali (Warner Music), che contiene anche gli ultimi, fortunati singoli Amore disperato e Inconscienti giovani con il quale ha partecipato a Sanremo. Ma non è l'unica novità annunciata. Si parte dalle due date al Circo Massimo il 29 giugno e l'1 luglio (""Un terzo concerto? In realtà sto pensando a qualcosa di molto più grande"") seguito da un tour nei palazzetti nel 2026, si passa a una collaborazione con Mina (""Non l'ho ancora sentita, ma ho una canzone per lei, molto bella""), si finisce col cinema: ""Sto parlando con un grande produttore, ho già scritto alcune cose ma non mi vedo attore, sono più una persona di pensiero"". Intanto il nuovo album: dodici brani pieni di memorie, di Roma e di persone care. Tra cui -- fatto inedito per un artista che protegge moltissimo il privato -- sua madre e le vicende della sua famiglia.

Il disco è pieno di malinconia, c'è dentro tanta Roma. ""L'amore è come una pioggia sopra Villa Borghese"", canta in Incoscienti giovani. Quanto incide la città su questo suo mood?

""Roma è una città in cui ti senti l'ultimo e il primo, è la città delle contraddizioni, ti fa sentire abbandonato e ti esalta al tempo stesso. È una città strapoetica, io sono uno che ruba dalla realtà come un documentarista, cerco di catturare la tradizione che è rimasta in certi vicoli del centro, o nelle periferie ancora un po' pasoliniane"".

Nel brano Amor, per una volta, racconta un amore che inizia e non uno che finisce. Parla della sua storia familiare, ha pubblicato una lettera della sua ex fidanzata. Sta perdendo la sua proverbiale riluttanza a parlare di sé?

""Ma in realtà ho sempre messo nella mia musica tanto di personale, non mi piace parlarne, ma ho sempre raccontato il mondo che ho vissuto, la mia musica è stata sempre uno specchio di quello che sono. Cristina l'ho scritta in dieci minuti, mia madre fa parte di questo storia e volevo lasciare qualcosa per lei"".

Dice di avere un rapporto sereno con le sue storie sentimentali e che non cerca l'amore a tutti i costi. Da dove viene allora tutta questa inquietudine?

""L'amore e il non amore sono stati i grandi motori dell'a...",0.4637,0.4957,changing climates,quality of life,low_both,,,,,,
Italian,Italy,repubblica.it,newsapi,2061,https://www.repubblica.it/economia/rapporti/osserva-italia/trend/2026/03/03/news/donne_al_lavoro_cresce_l_occupazione_ma_resta_il_divario_salariale-425197094/,"Donne al lavoro, cresce l'occupazione ma resta il divario salariale","L'occupazione femminile cresce, ma la parità resta un miraggio. È il paradosso fotografato dal report 'Tra nidi, part-time e vertici', curato da Valerio Mancini per la Rome Business School. Il problema oggi non è far entrare le donne nel mercato del lavoro, ma riuscire a trattenerle e a farle crescere. Nel 2024 il tasso di occupazione femminile è salito di 0,9 punti percentuali. Eppure, il gender gap resta al 19,4%, quasi il doppio della media europea (10%). Una distanza che segnala un ritardo strutturale dell'Italia.

La frattura si fa evidente soprattutto al momento della maternità. Dopo la nascita di un figlio, quasi sette dimissioni su dieci riguardano le madri. Tra i 25 e i 54 anni lavora il 62,3% delle donne con figli, contro il 91,5% dei padri. Non è solo una scelta individuale: è un equilibrio familiare e organizzativo che continua a scaricare sulle donne il peso della cura. Anche quando restano occupate, molte rallentano. Il 29,3% delle donne lavora part-time, contro il 6,2% degli uomini. E nel 15,6% dei casi si tratta di part-time involontario. Meno ore significano meno salario, meno contributi, meno possibilità di carriera. Una penalizzazione che si accumula nel tempo.

Il divario è anche territoriale: nel Nord lavora il 62,8% delle donne, nel Mezzogiorno appena il 37,2%. Due Paesi dentro lo stesso Paese, con servizi e opportunità profondamente diversi. Ai vertici, i progressi sono visibili ma incompleti. Le donne rappresentano il 43% dei consigli di amministrazione delle società quotate, secondo Consob. Tuttavia, solo il 2,2% è amministratrice delegata e appena il 21,1% dei dirigenti è donna. La presenza cresce, il potere resta concentrato. Incide anche il clima di lavoro: il 13,5% delle donne dichiara di aver subito molestie, contro il 2,4% degli uomini. Un costo invisibile che si traduce in dimissioni, rinunce, carriere interrotte. Il nodo, dunque, è la continuità. Il report sembra suggerire: servizi per l'infanzia più diffusi, part-time davvero scelti e non imposti, percorsi di carriera trasparenti e ambienti di lavoro sicuri. Senza, persino la crescita dell'occupazione femminile rischia di restare una buona notizia solo a metà.",0.4425,0.4769,changing climate,quality of life,low_both,,,,,,
Italian,Italy,repubblica.it,newsapi,155,https://www.repubblica.it/politica/2026/03/21/video/addio_a_paolo_cirino_pomicino_cosi_raccontava_la_sua_vita_politica-425237118/,"Addio a Paolo Cirino Pomicino, così ci raccontava la sua vita politica","- Video d'archivio del marzo 2017, per la rubrica ""Quelli della Prima Repubblica -

Scaramantico e allegro come solo i napoletani sanno essere, Paolo Cirino Pomicino è uno dei personaggi più noti della prima Repubblica. Entrato in Parlamento nel 1976 nella corrente andreottiana della Democrazia cristiana, è stato ministro del Bilancio, della Funzione pubblica e deputato europeo. ""Nel corso della mia vita politica ho avuto tre infarti e tre estreme unzioni, a Giulio Andreotti ho sempre dato del 'lei' e ho trascorso 17 giorni in carcere cantando canzoni napoletane col mio compagno di cella"", racconta oggi Pomicino. ""L'aneddoto più divertente? Quando organizzai la squadra di calcio del Parlamento e i socialisti volevano lottizzare pure quella"" Video di Antonio Nasso

LEGGI: Morto l'ex ministro e leader della Dc Paolo Cirino Pomicino",0.4617,0.5011,carbon emission,west nile virus,low_both,,,,,,
Italian,Italy,repubblica.it,newsapi,693,https://www.repubblica.it/spettacoli/tv-radio/2026/03/16/news/gian_luca_pelloni_bulzoni_figlio_segreto_adottivo_raffaella_carra-425225340/,"Raffaella Carrà, c'è un figlio adottivo segreto: chi è Gian Luca Pelloni Bulzoni, il suo segretario","Un contenzioso legale su un musical riporta alla luce l'adozione dell'ex collaboratore e oggi unico erede dell'artista: a lui spettano diritti d'immagine, nome e opere

Un procedimento giudiziario legato a uno spettacolo teatrale ha fatto emergere un dettaglio rimasto finora lontano dall'attenzione pubblica: Raffaella Carrà aveva adottato un figlio, oggi indicato come il suo unico erede. A rivelarlo è il Corriere della Sera.

Si tratta di Gian Luca Pelloni Bulzoni, nato a Ferrara nel 1964 e residente a Roma, dove guida la società Arcoiris Edizioni Musicali. Per anni è stato tra i collaboratori più stretti della cantante e conduttrice, lavorando come segretario personale e manager. Il rapporto di fiducia tra i due era noto nell'ambiente professionale, ma l'adozione non era mai stata resa pubblica.

La circostanza è venuta alla luce durante una causa avviata davanti al Tribunale di Roma contro una società spagnola coinvolta nella produzione del musical Ballo ballo, ispirato al repertorio della Carrà. Pelloni Bulzoni ha chiesto al giudice di bloccare realizzazione, promozione e rappresentazione dello spettacolo, sostenendo che l'iniziativa fosse stata portata avanti senza il suo consenso.

Nel ricorso si presenta infatti come erede dell'artista e titolare dei diritti legati alla sua immagine, alla voce, al nome - sia anagrafico sia d'arte - oltre che ai materiali e alle informazioni sulla sua vita professionale e privata. In quanto erede, rivendica anche i diritti morali e quelli di sfruttamento economico delle opere legate alla carriera della showgirl.

La giudice del Tribunale capitolino, Laura Centofanti, non ha però accolto la richiesta di sospensione dello spettacolo. Le rappresentazioni teatrali previste - una trentina - si erano infatti già concluse e non risultavano nuove repliche in programma. Per eventuali richieste di risarcimento l'erede potrà quindi proseguire la battaglia legale nel processo di merito.

Nel ricorso, tra le contestazioni sollevate, viene citata anche una scelta promozionale legata allo spettacolo: insieme al biglietto per il teatro veniva offerto al pubblico un piccolo omaggio - patatine e bibita - iniziativa che, secondo Pelloni Bulzoni, avrebbe potuto risultare irrispettosa nei confronti della memoria dell'artista.

Dagli atti emerge tuttavia che l'erede sarebbe stato a conoscenza dell'esistenza del tour teatrale nato dopo il film del 2020 e che avrebbe anche firmato alcuni accordi preliminari. Sarà eventualmente il processo a chiarire i dettagli di questi rapporti.

Quel che appare certo è che la Carrà, scomparsa il 5 luglio 2021, non aveva figli biologici. L'adozione del suo storico collaboratore lo rende quindi il principale erede del patrimonio artistico e dei diritti legati alla sua immagine. Restano anche due nipoti, Matteo e Federica Pelloni, figli del fratello della showgirl, con i quali l'artista ha sempre mantenuto un rapporto molto affettuoso.

Resta comunque intatto il velo di riservatezza che ha sempre ci...",0.3893,0.4345,changing climate,casualties,low_both,,,,,,
Italian,Italy,repubblica.it,newsapi,1513,https://www.repubblica.it/spettacoli/tv-radio/2026/03/08/news/alice_azzariti_figlia_imma_tataranni_con_lei_ho_capito_quello_che_voglio_fare_nella_vita-425208080/,"Alice Azzariti: ""Devo tutto a Imma Tataranni, con lei ho capito quello che voglio fare nella vita""","L'attrice, 24 anni, è cresciuta insieme al suo personaggio Valentina che nella serie - da stasera la quinta e ultima stagione su Rai 1 - è la figlia del sostituto procuratore interpretato da Vanessa Scalera

Alice Azzariti ha 24 anni, ne aveva 17 quando è iniziata l'avventura di Imma Tataranni, un'avventura che stasera su Rai 1 si avvia alla conclusione. La quinta stagione è l'ultima per Vanessa Scalera e anche per l'attrice che per sette anni ha interpretato sua figlia Valentina.

Per attivare l'iscrizione alla newsletter The dreamers, dedicata al cinema e alle serie tv, clicca qui

Per Alice è stata l'occasione di una vita, che l'ha confermata nella sua decisione di diventare attrice, l'ha portata da Bari a Roma e l'ha convinta che per lei ""non esiste un piano B"".

Sta per dire addio a Valentina, un personaggio che è cresciuto con lei.

""Assolutamente. Come tutti i personaggi si parte da qualcosa di scritto ma poi è sempre l'attore a dargli vita; quindi, c'è stata sicuramente una osmosi tra noi. Con Valentina ho fatto il passaggio da adolescente a donna, ci siamo scambiate delicatezza e contrasto, il suo carattere tenace e la sua irruenza nei confronti della madre ma anche una certa fragilità. Sono elementi in cui mi riconosco. Ci passiamo due anni di età scenica quindi ho veramente tanto in comune con lei. È stato emozionante dirle addio, ormai ha trovato la sua strada"".

""Francesco Amato è un grande regista, è grazie a lui e agli sceneggiatori che la serie ha riscosso tutto il successo che ha avuto. Quando sul set proponi qualcosa Francesco ti dà sempre una possibilità di metterla in pratica, Nella prima puntata di questa stagione abbiamo girato in una fattoria e mi sono ritrovata con una coccinella addosso, l'abbiamo sfruttata per staccare l'inquadratura"".

""È stato un battesimo di fuoco. Ero sul set con mia madre, essendo minorenne. Dovevamo girare una scena in spiaggia. Era una scena corale, io stavo in costume, ero tranquilla perché sapevo di non essere sola. Improvvisamente è iniziato a piovere e si è dovuto cambiare al volo il piano di produzione, di colpo mi sono trovata a girare una scena molto intensa con Vanessa sul tema del compromesso e sul rapporto madre e figlia, mi è salita l'agitazione. Vanessa però è stata carina e mi ha messo a mio agio"".

""Vanessa è spettacolare. Fin dalle prime stagioni mi ha considerato una donna, quando altri mi vedevano ancora come una ragazzina. Il nostro è un bel rapporto, lei per me è un modello dal punto di vista attoriale. Frequento qui a Roma una palestra per attori professionisti, l'Argot studio, vedere i suoi lavori a teatro di dieci o quindici anni fa è stato molto emozionante"".

Il successo di Imma come ha impattato sulla sua vita? La riconoscono per strada?

""Sì per strada, sulla metro. Mi chiamano Valentina. Alcuni giorni fa mi ha fermato una bambina che mi aveva riconosciuto. È solo un grande piacere perché questo è quello che voglio fare nella vita, non esiste nessun piano B. Quello che mi...",0.4305,0.4595,changing climate,west nile virus,low_both,,,,,,
Italian,Italy,repubblica.it,newsapi,2373,https://www.repubblica.it/spettacoli/dossier/festival-di-sanremo/2026/02/28/news/alessandro_gassman_post_instagram_iran_dopo_polemica_sanremo-425190941/,Alessandro Gassmann pubblica un post sull'Iran dopo aver cancellato quello polemico su Sanremo,"L'attore e regista aveva pubblicato nella serata dei duetti un messaggio critico: ""Allora non era vero che il parente di un Big non può partecipare"". Poi la retromarcia e un nuovo post sull'attacco contro l'Iran

Alessandro Gassmann pubblica un post polemico sui social, poi nella notte lo cancella. È successo ieri dopo il duetto di Tredici Pietro con il padre Gianni Morandi, l'attore e regista aveva scritto: ""Quindi non era vero che quando un cantante è in gara a Sanremo un parente non può partecipare al Festival. Perché io sarei dovuto andare per presentare Guerrieri, perché padre di un cantante... vabbè dai, sticazzi, regole NON uguali per tutti"".

Poi però il post viene cancellato. Si sarà pentito di aver sollevato una polemica, sarà stato il figlio Leo Gassmann a fargli cambiare idea? Fatto sta che l'attore e regista questa mattina sceglie di volgere lo sguardo lontano da Sanremo e verso scenari più drammatici come l'attacco di Stati Uniti e Israele contro l'Iran. E sulle note di Give peace a chance scrive: ""Le notizie che arrivano da Teheran e dal medio oriente sono quelle che portano paura e senso di angoscia La pace è la nostra unica possibilità. Mai una guerra porta pace. Chiediamo la pace!!!!

Intanto prosegue il suo sostegno a distanza del figlio sempre con un filo di polemica, ieri ha scritto: ""L'ho seguito la prima sera quando ha cantato per terzultimo e lo seguirò anche stasera che canterà per ultimo. Fagli vedere chi sei e a testa alta"".",0.4715,0.4888,climate crisis,west nile virus,low_both,,,,,,
Italian,Italy,repubblica.it,newsapi,2325,https://www.repubblica.it/sport/calcio/esteri/2026/02/28/news/roberto_mancini_iran_usa_esplosioni_doha-425192316/,"Roberto Mancini posta le esplosioni da casa a Doha: ""A mamma ho detto di stare tranquilla. Per ora""","Il tecnico dell'Al-Sadd ha ricevuto il messaggio dell'attacco con alert: non uscite di casa

Roberto Mancini si trova tra esplosioni e paura. L'ex ct della Nazionale è a Doha, da mesi, allena l'Al Sadd. All'improvviso ha ricevuto un messaggio del telefonino: ""Ha iniziato a suonare l'allarme del mio cellulare, la scritta era in arabo. Sono arrivati cinque o sei messaggi. Poco dopo sono iniziate le esplosioni. Eravamo a messa, sono arrivati gli alert mentre eravamo in chiesa. Dicevano di tornare subito a casa e di non muoversi da lì"".

Il tecnico italiano, che aveva guidato la Nazionale saudita, all'improvviso si è trovato in mezzo a missili, paura, persone che urlano. Su Instagram ha condiviso un video nel quale ha mostrato l'attacco e le esplosioni con la scritta ""Qatar close to Doha"": ""È una delle esplosioni che ho sentito da casa"".

Nel collegamento con il Tg1 della sera ha raccontato il terrore dei genitori in Italia: ""Mi ha chiamato mia mamma, era preoccupata. Le ho detto di stare tranquilla. Almeno per il momento"". Ma non nasconde l'ansia per una situazione che temeva da giorni: ""C'è un immenso dispiegamento di forze qua nel Golfo, avevamo paura che succedesse qualcosa. Ci auguravamo che la diplomazia potesse sciogliere la tensione. Ora speriamo bene"".",0.4513,0.4712,extreme event,west nile virus,low_both,,,,,,
Italian,Italy,repubblica.it,newsapi,1116,https://www.repubblica.it/spettacoli/tv-radio/2026/03/12/news/enrica_bonaccorti_morta_tumore_pancreas-425216400/,Enrica Bonaccorti è morta. Addio al volto gentile della nostra tv,"Aveva annunciato la malattia sui social, rompendo il silenzio, per spiegare perché fosse sparita. Poi aveva ripreso il dialogo con le tantissime persone che le avevano scritto per incoraggiarla. Alla fine di ottobre aveva confidato a Gente che le avevano sospeso la chemioterapia. ""Non ho avuto più dolori né nausea"", aveva raccontato Enrica Bonaccorti, ""ma mi è rimasta un po' di debolezza. Il tumore si è insinuato in un punto del corpo molto delicato, è impossibile operarlo, intervenire per rimuoverlo. Purtroppo. Ora devo iniziare le sedute di radioterapia. Ho speranza nella scienza, che ha fatto passi avanti incredibili, nella ricerca, che dobbiamo sostenere sempre più. E poi, il sentirmi circondata da così tanto affetto, con i racconti di chi ci era passato, di chi l'aveva superato, di chi lo stava affrontando come me... Tutto questo mi ha restituito uno sguardo verso il futuro. Inoltre pare che l'atteggiamento positivo aiuti molto dunque, guarirò"".

Nonostante la tenacia e la speranza, la conduttrice non ce l' ha fatta. Si è spenta a 76 anni a Roma. Solare, elegante, Bonaccorti, nata a Savona il 19 novembre 1949, era una signora borghese prestata alla tv: nella bella casa romana a due passi da Ponte Milvio, scriveva e si raccontava. Autrice di cinque libri, grande osservatrice (Il condominio era un'ironica commedia umana) ha spaziato nello spettacolo: presentatrice, paroliera, autrice. Nello studio era circondata dalle foto: la madre bella come Ingrid Bergman, il padre sosia di David Niven, le eleganti signore della famiglia (""tutte laureate, all'epoca una rarità""). Spiegava: ""In televisione si scrive sull'acqua, i libri restano. Un giorno un mio pro[1]nipote potrà dire: però, guarda la bisnonna"". Papà colonnello, mamma insegnante (<Per lei non ero mai abbastanza elegante. Troppo disordinata. Diceva: ""Enrica, ti ci vorrebbe una moglie""""), si sposta dal Nord al Sud per le esigenze di lavoro del padre. L'adolescenza a Sassari è il periodo più felice (<Per me era New York. La Sardegna mi è rimasta dentro, ho scrit[1]to La lontananza per quella terra>), Bonaccorti si trasferisce a Roma. Lo diceva in un'intervista sul Venerdì: <Ho vissuto anni felici a immaginare il futuro: attrice teatrale, giornalista o neurologo, come mio zio. La medicina mi affascina ancora"". Recita a teatro, in diversi sceneggiati Rai degli anni Settanta (Eleonora, L'amaro caso della baronessa di Carini), al cinema (Jus primae noctis, Paolo il caldo, Faccione), è conduttrice di tanti programmi radiofonici di successo (Per chi suona la campana?, Chiamate Roma 3131) ma il futuro è la tv: Italia sera, con Mino Damato <che mi ha insegnato tut[1]to>, spiegava <con lui avevo fatto un percorso gior[1]nalistico>. Poi la collaborazione con Gianni Boncompagni: viene individuata per condurre Pronto, chi gioca? dopo i no della coppia Mondaini-Vianello, Ugo Tognazzi, Virna Lisi, Nino Manfredi, Sandra Milo, Claudia Cardinale. Nessuno osava sostituire Raffaella Carrà, che aveva lasciato, dopo...",0.4450,0.4906,changing climate,west nile virus,low_both,,,,,,
Italian,Italy,repubblica.it,newsapi,733,https://www.repubblica.it/salute/2026/03/16/news/sindrome_bambino_scosso_effetti_gravissimi-425224637/,"La sindrome del bambino scosso, quando un gesto che dura pochi secondi può avere effetti gravissimi","Scuotere un bambino per farlo smettere di piangere è uno dei gesti più pericolosi che possa compiere un genitore e che in pochi secondi può creare danni irreversibili

I neonati piangono spesso e il loro pianto sembra non avere fine. Notti insonni, genitori esausti, nervi tesi. È un'esperienza comune, universale. Ma proprio in quei minuti di disperazione può consumarsi uno dei gesti più pericolosi e meno conosciuti dell'infanzia: scuotere un bambino per farlo smettere di piangere. Un gesto che può durare solo pochi secondi. Ma che può provocare danni irreversibili.

La Sindrome del Bambino Scosso, conosciuta a livello internazionale come Shaken Baby Syndrome, rappresenta oggi una delle forme più gravi di maltrattamento infantile nei primi mesi di vita. Non sempre nasce da violenza intenzionale: può essere frutto di stanchezza, inesperienza o perdita momentanea di controllo. Ma le conseguenze possono essere devastanti.

I dati emersi dalla ""Prima indagine sui casi di bambini e bambine vittime di Shaken Baby Syndrome in Italia"", realizzata nel 2023 da Terre des Hommes insieme alla Rete Ospedaliera contro il Maltrattamento Infantile, fotografano una realtà ancora poco conosciuta nel nostro Paese.

I più colpiti da questa forma di trauma cerebrale sono i bambini tra le due settimane e i sei mesi di vita, periodo di massima intensità del pianto del lattante. In un caso su quattro, lo scuotimento può causare coma o morte del neonato. Negli altri casi, gli effetti possono essere comunque gravi ed includono: danni cerebrali permanenti, problemi alla vista o all'udito, disturbi comportamentali, difficoltà cognitive, problemi di coordinazione motoria.

Ancora più allarmante è un altro dato che ci deve far riflettere: in un caso su tre i bambini erano già stati portati in Pronto Soccorso, presentando precedenti segni di maltrattamento.

La sindrome del bambino scosso non è dunque quasi mai un episodio isolato, ma spesso parte di un contesto di fragilità familiare o di stress cronico.

Perché scuotere un neonato è così pericoloso

Per comprendere la gravità del fenomeno bisogna guardare all'anatomia del neonato. Nei primi mesi di vita la testa è proporzionalmente molto più grande rispetto al corpo ed i muscoli del collo sono deboli: ecco perché viene raccomandato di sostenere sempre la testa del neonato. Inoltre, il cervello è ancora in pieno sviluppo e le ossa craniche sono più elastiche.

Quando un adulto scuote violentemente un neonato, la testa oscilla avanti e indietro senza controllo. Il cervello urta contro le pareti del cranio e questo può portare ad emorragie cerebrali, edema e lesioni diffuse delle fibre nervose. Possono comparire anche emorragie retiniche, danni spinali e compromissioni neurologiche permanenti. Non serve una forza estrema: non esiste uno scuotimento ""leggero"" sicuro. Bastano pochi secondi.

Il pianto: un fattore di rischio sottovalutato

Il principale fattore scatenante è quasi sempre lo stesso: il pianto inconsolabile. Si sa, un ...",0.4483,0.4411,extreme event,west nile virus,low_both,,,,,,
